Sắc Màu Tổ Ấm - Tập 7.1: Biệt Thự Hiện Đại,https://www.vinabook.com/images/thumbnails/product/240x/46813_53356.jpg,Nhà ở - nội thất," Sắc Màu Tổ Ấm - Tập 7.1: Biệt Thự Hiện ĐạiQuý vị đang cầm trên tay tuyển tập thiết kế nhà ở ""Sắc Màu Tổ Ấm"" tập 7, với 3 chuyên đề: ""Biệt thự hiện đại"", ""Không gian nhà phố"" và ""Đường nét cổ điển"". Đây là bộ sách được biên tập công phu gồm những tác phẩm thiết kế mới nhất của Công ty Cổ phần Kiến trúc Xây dựng Nhà Vui trong hai năm 2011 - 2012. Kể từ năm 2007 ra tuyển tập ""Sắc Màu Tổ Ấm"" đầu tiên, chúng tôi đã luôn nhận được nhiều sự khen ngợi, động viên từ các bạn đọc, đáng quý nhất là những góp ý chân thành, những câu hỏi rất sâu, rất thực tế về từng mẫu thiết kế. Qua đó, chúng tôi hiểu được sự mong chờ của bạn đọc đối với tuyển tập hàng năm, không chỉ là sự đón xem các mẫu nhà đẹp, mà còn là sự xét đoán rất khắt khe các thiết kế của Nhà Vui qua từng thời kỳ xây dựng với sự phát triển của các công nghệ mới, vật liệu mới và những xu hướng thẩm mỹ ngày càng cao.Sự đối chiếu giữa năng lực thiết kế của đội ngũ với nhu cầu ngày càng lớn của khách hàng là tiêu chí hàng đầu để Nhà Vui hiểu rõ những thế mạnh và điểm yếu của mình. Mang sứ mạng và lĩnh ấn tiên phong trong lĩnh vực thiết kế nhà ở tư nhân tại Việt Nam từ năm 2000.Đã xuất hiện các văn phòng thiết kế tại TPHCM, Hà Nội, Hải Phòng, Huế và các công trình trên khắp cả nước, Nhà Vui đang tự tin về nghề và đang gấp rút hoàn thiện về chất lượng dịch vụ hoàn hảo nhất trong chuỗi chu trình thiết kế - thi công - nội thất trọn gói cho khách hàng. Tuy vẫn còn thiếu các mẫu thiết kế mang đẳng cấp quốc tế, thiếu những thiết kế được nghiên cứu khoa học, chuẩn hóa, tiết kiệm vật liệu để tiến tới công nghệ xây dựng nhà ở Việt Nam ngày càng xanh hơn, thân thiện với môi trường; vẫn còn nhiều mơ ước cải tiến dịch vụ trong một công việc tưởng chừng đơn giản nhưng hàm chứa bao trách nhiệm: Xây dựng những ngôi nhà ""Nhiều niềm vui""! Chúng tôi hiểu sự hoàn thiện về nghề và nghiệp làm nhà còn rất dài nhưng xứng đáng để hướng tới.Nói về chuyện thiết kế, ba tập sách của lần xuất bản này chia rõ các thể loại công việc thiết kế: Nhà biệt thự hay nhà phố, nhà mang phong cách hiện đại - đương đại, hay phong cách sử dụng các đường nét cổ điển làm chủ đạo. Càng ngày các thiết kế của Nhà Vui càng dễ đối thoại và gần đến ý muốn của chủ nhà. Sự tập hợp chuyên biệt các mẫu nhà trong 3 xu hướng thiết kế cũng giúp độc giả dễ cảm nhận đâu là ngôi nhà mơ ước của riêng mình. Chúng tôi mong muốn trong những lần xuất bản tới, ngôi nhà của chính quý vị sẽ thành hình, sẽ viết tiếp, đầy ấn tượng những tập sách ""Sắc Màu Tổ Ấm"".Mời bạn đón đọc. ",180.0, 21 x 27 cm , 10/2012 , CTCP Truyền Thông Gia Phúc , Nxb Trẻ ,98.0,, Bìa cứng ,
Hơi Thở Nhiệt Đới,https://www.vinabook.com/images/thumbnails/product/240x/46159_52702.jpg,Nhà ở - nội thất,"  Thông tin tác giả    KTS. Nguyễn Văn Tất     Vào trang riêng của tác giả   Xem tất cả các sách của tác giả      Hơi Thở Nhiệt Đới   ""Nghệ thuật kiến trúc là tinh hoa của sản phẩm xây dựng đã được sáng tạo - nhào nặn - định hình bằng tri thức và văn hóa ứng xử"" - KTS Nguyễn Văn Tất     Những câu chuyện bất chợt được cảm nhận bằng trái tim hơn là lý luận - Bằng chút trăn trở nghề nghiệp Kiến trúc sư trên mảnh đất thân thuộc nắng, thân thuộc gió",140.0, 22 x 22 cm , 12/2012 , NXB Văn Hóa Văn Nghệ , NXB Văn hóa - Văn nghệ ,112.0, KTS. Nguyễn Văn Tất , Bìa mềm ,
Bố Trí Nội Thất Gia Đình Theo Phong Thủy,https://www.vinabook.com/images/thumbnails/product/240x/43607_50150.jpg,Nhà ở - nội thất,"  Thông tin tác giả    Hoài Anh 
                                                                                                                                            Hoài Anh
                                                                   Vào trang riêng của tác giả   Xem tất cả các sách của tác giả     Trước nay, rất nhiều người vẫn xem phong thủy như một trường phái mê tín nhưng khoa học đã chứng minh tác động của các nguyên tắc phong thủy là rất quan trọng, góp phần không nhỏ trong thành công cuộc sống con người. Không chỉ ở Trung Quốc mà ngay những nước tiên tiến nhất như: Anh, Đức, Mỹ, Thụy Sĩ, Thụy Điển, Pháp, Tây Ban Nha, Singapore, Hàn Quốc",29.0, 13 x 20.5 cm , 2011 , Minh Long , NXB Thời Đại ,192.0, Hoài Anh , Bìa mềm ,
Thiết Kế Phòng Khách,https://www.vinabook.com/images/thumbnails/product/240x/46053_52596.jpg,Nhà ở - nội thất,"  Thông tin tác giả    Võ Mai Lý 
                                                                                                                                            Võ Mai Lý
                                                                   Vào trang riêng của tác giả   Xem tất cả các sách của tác giả       Trần Lê Thanh     Vào trang riêng của tác giả   Xem tất cả các sách của tác giả     Nhà Đẹp Vận Lành - Phong Thủy - Thiết Kế Phòng KháchViệc xác định được phong cách xây dựng, trang trí phòng khách vô cùng quan trọng. Kết hợp quan niệm thiết kế xây dựng, trang trí trong và ngoài nước (đang thịnh hành), cuốn sách này sưu tập một số lượng lớn những bức ảnh thật về xây dựng và trang trí phòng khách mà giới thiết kế cho là tinh ưu cung cấp cho bạn đọc tham khảo.Mời bạn đón đọc.  ",53.0, 16 x 24 cm , 03/2010 , Văn Lang , Nxb Mỹ thuật ,96.0," Võ Mai Lý , Trần Lê Thanh ", Bìa mềm ,
Bố Trí Nội Thất Văn Phòng Theo Phong Thủy,https://www.vinabook.com/images/thumbnails/product/240x/43608_p50151mbotrinoithat.jpg,Nhà ở - nội thất,"  Thông tin tác giả    Hoài Anh 
                                                                                                                                            Hoài Anh
                                                                   Vào trang riêng của tác giả   Xem tất cả các sách của tác giả     Phong thuỷ tức là nước và gió, là học thuyết chuyên nghiên cứu sự ảnh hưởng của địa lý đến đời sống hoạ phúc của con người. Cụ thể là sự ảnh hưởng của hướng gió, hướng khí, mạch nước đến mỗi cá nhân. Phong thuỷ có vai trò rất to lớn, tuy nhiên nó chỉ hỗ trợ, có tác dụng cải biến chứ không thể làm thay đổi hoàn toàn mệnh vận. Nó là nhân tố quyết định sự thành bại. Nếu phong thuỷ tốt sẽ giúp giảm thiểu được tai hoạ khi vào vận xấu, giúp gia tăng sự thành công và may mắn khi vào vận tốt",20.0, 13 x 20.5 cm , 2011 , Minh Long , NXB Thời Đại ,124.0, Hoài Anh , Bìa mềm ,
Kỹ Thuật Điều Chỉnh Trường Khí Vào Nhà (Thuật Hóa Giải Phong Thủy Nhà) - Tái bản 03/12/2012,https://www.vinabook.com/images/thumbnails/product/240x/43225_49768.jpg,Nhà ở - nội thất,  Thông tin tác giả    GS.TS. Nguyễn Tiến Đích     Vào trang riêng của tác giả   Xem tất cả các sách của tác giả     Kỹ Thuật Điều Chỉnh Trường Khí Vào Nhà (Thuật Hóa Giải Phong Thủy Nhà)Sách cung cấp cho bạn đọc những kiến thức về điều chỉnh trường khí trong môi trường sống và làm việc.Gồm 9 chương:Chương 1: Yêu cầu trường khí trong nhà và kỹ thuật điều chỉnh.Chương 2: Điều chỉnh trường khí bằng giải pháp tụ khí và dẫn khíChương 3: Điều chỉnh trường khí bằng bố cục hệ cửaChương 4: Điều chỉnh bàn thờ và lò bếpChương 5: Điều chỉnh bằng phương pháp chẻ khí và tách khíChương 6: Điều chỉnh bằng hệ gươngChương 7: Điều chỉnh bằng Phù hiệu và Linh vậtChương 8: Điều chỉnh bằng cảm xạ vật lýChương 9: Nêu một số giải pháp cụ thể điều chỉnh trường khí vào nhàMời bạn đón đọc. ,85.0, 14.5 x 20.5 cm , 03/2012 , NXB Thông Tin và Truyền Thông , Nxb Thông tin & truyền thông ,312.0, GS.TS. Nguyễn Tiến Đích , Bìa mềm ,
3 Bước Tự Thiết Kế Phong Thủy,https://www.vinabook.com/images/thumbnails/product/240x/43059_49602.jpg,Nhà ở - nội thất,"  Thông tin tác giả    Thái Thứ Lang     Vào trang riêng của tác giả   Xem tất cả các sách của tác giả     Phong thuỷ nhà ở là một học vấn liên quan đến sự quy hoạch và thiết kế môi trường nhà ở của người cổ đại, đã có lịch sử rất lâu đời, trải qua hàng ngàn năm phát triển, phong thuỷ nhà ở đã dần hình thành nên một hệ thống lý luận hoàn chỉnh và nhiều trường phái riêng. Đây là một sản vật văn hoá truyền thống đặc sắc, có ảnh hưởng vô cùng quan trọng đối với việc thiết kế và phát triển nhà ở .Để thiết kế phong thuỷ nhà ở theo khoa học, cần có những bước cụ thể. Cuốn sách này sẽ giúp bạn từng bước tìm hiểu phong thuỷ, cũng như có thể tự thiết kế phong thuỷ cho nhà ở, văn phòng của mình. Qua đó, bạn đọc sẽ tìm thấy những niềm hứng thú riêng và tự tin hơn sau khi sắp xếp và thiết kế mọi thứ hoàn hảo, để công việc và cuộc sống hiệu quả, thoải mái và hạnh phúc.Mời bạn đón đọc. ",165.0, 19 x 27 cm , 12/2011 , Huy Hoàng , NXB Thời Đại ,344.0, Thái Thứ Lang , Bìa cứng ,
Bát Trạch Minh Kính - Bộ Kinh Điển Đầy Đủ Nhất Về Phong Thủy Dương Trạch,https://www.vinabook.com/images/thumbnails/product/240x/43057_49600.jpg,Nhà ở - nội thất,"  Thông tin tác giả    Dương Quân Tùng (Thời Đường)     Vào trang riêng của tác giả   Xem tất cả các sách của tác giả     Nếu bạn không muốn sự thiếu hụt về kiến thức Phong thủy kìm hãm bước phát triển của sự nghiệp, vậy thì còn chần chừ gì nữa, hãy nhanh chóng lật giở cuốn sách này và tiếp nhận những tinh hoa trong đó. Với đặc trưng đơn giản, dễ hiểu, dễ thực hành, đây chính là bảo điển Phong thuỷ mà bạn đang tìm kiếm.Nội dung ""Bát trạch minh kính"" chủ yếu dựa vào niên mệnh, Tam nguyên của con người để phán đoán phương vị trạch cát tương ứng với người người đó và phương cát lợi của các sự vật cụ thể như giường, bếp",125.0, 16 x 24 cm , 2012 , Huy Hoàng , NXB Hồng Đức ,384.0, Dương Quân Tùng (Thời Đường) , Bìa mềm ,
Phong Thủy Thực Hành - Trang Trí Nội Thất Theo Phong Thủy,https://www.vinabook.com/images/thumbnails/product/240x/42301_48844.jpg,Nhà ở - nội thất,"  Thông tin tác giả    Tống Thiều Quang 
                                                                                                                                            Tống Thiều Quang
                                                                   Vào trang riêng của tác giả   Xem tất cả các sách của tác giả     Phong thủy học đã có từ rất lâu ở Trung Quốc. Nhưng cùng với sự thay đổi của thời gian, kết cấu nhà ở cổ kim cũng có những thay đổi rất lớn. Chính vì vậy, một số lý luận phong thủy truyền thống không theo kịp thời đại, nếu không qua chỉnh lý chọn lọc e rằng không thể sử dụng được. Vì vậy tôi quyết định viết cuốn sách phong thủy có kết hợp với những điều kiện thực tế của nhà ở hiện nay. Đây cũng là một trong những mục tiêu của cuốn sách này.Không khoa trương phù phiếm, đi vào thực tế dễ hiểu cũng là 2 mục tiêu quan trọng nữa của cuốn sách.Mục lục:Chương 1: Trạch - mệnh tương phốiChương 2: Cửa chính lành dữChương 3: Nhà bếp lành dữChương 4: Nhà vệ sinh lành dữChương 5: Sự cát hung của phòng ngủChương 6: Sự cát hung về giường ngủChương 7: Phòng ngủ của trẻ emChương 8: Sự cát hung về phòng đọcPhục lục:Năm điều nên về phòng ngủ và giường ngủMười điều kiêng về phòng ngủ và giường ngủMời bạn đón đọc.  ",55.0, 13 x 20.5 cm , 2012 , Phương Đông , Nxb Văn hóa Thông tin ,300.0, Tống Thiều Quang , Bìa mềm ,
Tuyển Tập Các Thiết Kế - Trang Trí Bằng Gỗ - Tập 3,https://www.vinabook.com/images/thumbnails/product/240x/42386_48929.jpg,Nhà ở - nội thất," Tuyển Tập Các Thiết Kế - Trang Trí Bằng Gỗ - Tập 3Bạn đã bao giờ nghĩ đến việc thay đổi những chất liệu trong nhà bằng gỗ chưa? một đường viền gỗ nhỏ phía bên ngoài các tường ốp bằng gạch men sẽ giúp phòng tắm trở nên sinh động và ấn tượng hơn.Bếp ăn, sàn nhà, ghế, bàn, tủ, giường, kệ sách",78.0, 19 x 26 cm , 2010 , Trí Việt , Nxb Trẻ ,160.0,, Bìa mềm ,
Phong Thủy Cho Không Gian Sống,https://www.vinabook.com/images/thumbnails/product/240x/41934_48477.jpg,Nhà ở - nội thất,"  Thông tin tác giả    Treena Dean     Vào trang riêng của tác giả   Xem tất cả các sách của tác giả     Con người luôn bị một tác động bởi một nguồn năng lượng vô hình vận hành trong mô trường sống. Hiểu và ứng dụng được thuật phong thủy, chúng ta có thể thay đổi cuộc sống một cách đáng kể.Thuật phong thủy đã lý giải rất thuyết phục về nguồn năng lượng vô hình ấy, đồng thời đưa ra những phương cách bài trí nhà cửa, sắp xếp đồ vật giúp không gian sống của mỗi người, cả bên trong lẫn bên ngoài trở nên hài hòa.Bạn có thể bị tràn ngập thông tin về phong thủy giữa một rừng sách vở và không đủ thời gian cũng như sự kiên nhẫn để tìm hiểu sâu về lĩnh vực vốn đã đầy huyền bí này, Phong thủy cho không gian sống sẽ giúp bạn chọn lựa những hiểu biết căn bản và thực tiễn để áp dụng cho ngôi nhà của mình.Mời bạn đón đọc. ",35.0, 13.5 x 21 cm , 12/2011 , Văn Lang , Nxb Mỹ thuật ,144.0, Treena Dean , Bìa mềm , Huỳnh Văn Thanh 
Phong Thủy Cho Văn Phòng - Tái bản 2011,https://www.vinabook.com/images/thumbnails/product/240x/39813_46356.jpg,Nhà ở - nội thất,"  Thông tin tác giả    Triều Sơn     Vào trang riêng của tác giả   Xem tất cả các sách của tác giả     Phong Thuỷ Cho Văn Phòng - Vận dụng khoa học phong thuỷ phương Đông trong việc bài trí không gian làm việc để đạt hiệu quả tốt nhất trong công việc.Nhiều người chúng ta dành phần lớn thời gian trong đời cho công việc, vì vậy mà môi trường làm việc có ảnh hưởng rất lớn đến chất lượng cuộc sống của chúng ta, tác động đến nhiều khía cạnh khác trong đời mỗi người. Bên cạnh năng lực và sự yêu thích công việc là những yếu tố không thể thiếu thì việc bài trí không gian làm việc một cách hài hoà, cân đối sẽ góp phần giúp bạn đạt được hiệu quả tốt nhất trong việc phát triển năng lực bản thân cũng như đạt được những kết quả thuận lợi cho công việc của mình.Dù nơi làm việc của bạn chỉ là một chiếc bàn nhỏ hẹp hay là một căn phòng thông thoáng, rộng rãi thì bạn vẫn có thể tạo cho mình một không gian lý tưởng và thích hợp với công việc hiện tại của mình. Hình dạng và kích thước của bàn làm việc, sự tiện nghi của chiếc ghế ngồi, màu sắc của những bức tường hay của các vật trang trí ",25.0, 13.5 x 20.5 cm , 2011 , Huy Hoàng , NXB Thời Đại ,128.0, Triều Sơn , Bìa mềm ,
Phong Thủy Biệt Thự,https://www.vinabook.com/images/thumbnails/product/240x/39743_46286.jpg,Nhà ở - nội thất,"  Thông tin tác giả    Từ Cao Bình     Vào trang riêng của tác giả   Xem tất cả các sách của tác giả     Mục lụcLựa chọn mảnh đất phong thủy tốt xây dựng ngôi biệt thự may mắnI. Thế nước cát tườngII. Đại ngọc ôm lưngIII. Tìm một kháo sơn tốtIV. Lựa chọn khu đất tốtTrang hoàng biệt thự, chào đón vận mayI. Cửa chính nói lên thân phận và địa vị chủ nhàII. Biến cửa sổ trở thành con mắt sáng nhất trong ngôi biệt thựIII. Không được coi nhẹ tác dụng phong thủy của huyền trangIV. Bố cục phòng khách có liên quan đến toàn bộ vận thế của biệt thựV. Phòng ngủ có phong thủy tốt mang lại cho bạn giấc ngủ ngon và những giấc mơ đẹpVI. Vị trí văn xương trong phong thủy phòng làm việcVII. Bố cục phòng ănVIII. Bếp có quan hệ đến họa phúc và sức khỏe của con ngườiIX. Thiết kế  khu công trình phụ mang lại cảm giác thư giãn tuyệt vờiX. Ban công, nơi ""tử khí đông lai""XI. Phòng tập: Đem lại sức khỏe và thư giãn",125.0, 16 x 24 cm , 2011 , Huy Hoàng , Nxb Văn hóa Thông tin ,160.0, Từ Cao Bình , Bìa mềm ,
Bố Trí Đồ Vật Theo Phong Thủy,https://www.vinabook.com/images/thumbnails/product/240x/39344_45887.jpg,Nhà ở - nội thất,"  Thông tin tác giả    Triều Sơn     Vào trang riêng của tác giả   Xem tất cả các sách của tác giả     Một ngôi nhà đẹp không thể thiếu những bức trang trang trí, thế nhưng việc chọn và treo tranh phụ thuộc vào chức năng của từng không gian và đối tượng sống trong ngôi nhà. Treo một bức tranh đẹp, đúng với sở thích và phù hợp phong thuỷ không chỉ giúp làm đẹp không gian sống nhà bạn mà còn khiến bạn có thể thư giãn với nó, nó còn mang lại sự may mắn và thịnh vượng cho gia đình bạn.Nhằm hướng dẫn bạn đọc chọn và treo tranh cho phù hợp, để vừa có thể tạo không gian đẹp và thoáng đãng, lại có thể mời gọi được nhiều tài lộc và may mắn về nhà.Mời bạn đón đọc. ",128.0, 16 x 24 cm , 2011 , Huy Hoàng , Nxb Văn hóa Thông tin ,320.0, Triều Sơn , Bìa mềm ,
Phong Thủy Phòng Ngủ (HH),https://www.vinabook.com/images/thumbnails/product/240x/39341_45884.jpg,Nhà ở - nội thất,"  Thông tin tác giả    Triều Sơn     Vào trang riêng của tác giả   Xem tất cả các sách của tác giả     Phòng ngủ không chỉ là nơi để con người nghỉ ngơi, thư giãn mà còn là chốn kín đáo, riêng tư của mỗi thành viên trong gia đình. Bởi vậy, nó cũng thể hiện một cuộc sống chân thực và cá tính thật nhất của một người. Trong cuộc sống hiện đại, chúng ta luôn theo đuổi một cuộc sống chất lượng cao, việc bài trí trong phòng ngủ không chỉ cần phải xem xét đến các yếu tố khiến cho căn phòng trở nên dễ chịu, ấm cúng mà còn phải chú ý đến một vài yếu tố phong thuỷ có liên quan.Cuốn sách sẽ liệt kê ra những thiết kế phòng ngủ tốt nhất, ưu việt nhất, với những cách trang trí phòng ngủ tuyệt đẹp, kết hợp với những kiến thức phong thuỷ chuẩn xác nhất để tạo nên một không gian phòng ngủ đem lại sự cát tường như ý, góp phần xây dựng nên một cuộc sống ấm êm, hạnh phúc.Mời bạn đón đọc. ",75.0, 16 x 24 cm , 2011 , Huy Hoàng , Nxb Văn hóa Thông tin ,128.0, Triều Sơn , Bìa mềm ,
Cát Tường Trạch Địa,https://www.vinabook.com/images/thumbnails/product/240x/39338_45881.jpg,Nhà ở - nội thất,"  Thông tin tác giả    Trương Thuận Nhiệm     Vào trang riêng của tác giả   Xem tất cả các sách của tác giả     Nhà ở cát tường là gì? Cách nhìn của người hiện đại và người xưa cố nhiên có điều khác biệt, tuy một vài triết lý cơ bản là vĩnh viễn không bao giờ thay đổi nhưng là một người hiện đại, cần phải có cái nhìn chính xác về nhà ở cát tường hiện đại.Về nhà ở cát tường ngày nay, tôi cho rằng phải bắt đầu về thay đổi tư tưởng, cuộc sống nội tâm cân bằng, lành mạnh và vui vẻ mới là nhà ở cát tường tốt nhất. Dù cho căn nhà lớn cỡ nào, chỉ cần có sách, có trà, có đèn, có giường là căn nhà ấm cúng sẽ trở nên tràn đầy sức sống thì đó chính là nhà ở cát tường. Việc chọn lựa căn nhà tốt cũng không được quá tùy tiện, căn nhà chật hẹp sơ sài cũng được, chỉ cần trong lòng vui vẻ, thế giới cảnh quan sẽ biến thành thế giới tâm hồn. Chính là nhà ở cát tường.Có được bố cục bài trí không gian tốt (vượng trạch phúc địa) chính là điều mà chúng ta mong mỏi.Mời bạn đón đọc.  ",50.0, 16 x 24 cm , 2011 , Huy Hoàng , Nxb Văn hóa Thông tin ,224.0, Trương Thuận Nhiệm , Bìa mềm ,
Tẩy Độc Bếp - Vì Không Thể Sống Mà Không Ăn Gì,https://www.vinabook.com/images/thumbnails/product/240x/363092_p92641mnxbtrefull18342020043400.jpg,Nhà ở - nội thất,"  Thông tin tác giả    Pha Lê     Vào trang riêng của tác giả   Xem tất cả các sách của tác giả     Cùng tác giả của cuốn sách bán chạy ""Ăn gì cho không độc hại"".Mỗi món ngon ra đời là kết quả của cả quá trình đằng sau - không đơn thuần là kỹ thuật nấu nướng mà là chuyện về muối đường tương mắm, các dụng cụ, nồi niêu, bếp nấu… Một khi nắm rõ các vấn đề, các khía cạnh của bếp, chúng ta sẽ biết lý do đằng sau mỗi món ngon và món chưa ngon. Chúng ta sẽ hiểu sức mình làm việc bếp núc tới đâu là vừa. Chúng ta cũng sẽ biết, trong ma trận những nội dung quảng cáo, chia sẻ về những thứ “cần có trong gian bếp của bạn”, cái gì thực sự cần thiết, phù hợp với điều kiện, hoàn cảnh mỗi người và tốt cho sức khỏe, cái gì đã bị thổi phồng về công năng, tác dụng. Từ đó, mỗi người có thể bắt đầu quá trình detox (tẩy độc) cho gian bếp, từ nồi niêu, dụng cụ đến gia vị, để có một gian bếp sạch theo cả nghĩa đen lẫn nghĩa bóng. Nếu ""Ăn gì cho không độc hại"" là hành trình “học ăn”, ""Tẩy độc bếp: Vì không thể sống mà không ăn gì"" là bước đầu của hành trình “học nấu” một các tường tận, nghiêm túc, bắt đầu từ việc hiểu về bếp.Tác giả Pha Lê tốt nghiệp trường ẩm thực danh tiếng Le Cordon Bleu (Vương quốc Anh), hiện là cây bút ẩm thực - văn hóa chủ lực của soi.today và Tuổi Trẻ Cuối Tuần.Mời bạn đón đọc! ",180.0," 15,5 x 23 cm ", 11/2020 , NXB Trẻ , Nxb Trẻ ,300.0, Pha Lê , Bìa mềm ,
