tên sách,ảnh bìa,thể loại,nội dung tóm tắt,giá bìa,kích thước,ngày xuất bản,nhà phát hành,nhà xuất bản,số trang,tác giả,loại bìa,dịch giả
Kỹ Thuật Trồng Mai - Tái bản 02/2013,https://www.vinabook.com/images/thumbnails/product/240x/291327_p79816mxx226.jpg,Cây – cá cảnh,"  Thông tin tác giả    Việt Chương 
                                                                                                                                            Việt Chương
                                                                   Vào trang riêng của tác giả   Xem tất cả các sách của tác giả     Tập sách Kỹ Thuật Trồng Mai đề cập đến cái thú chơi Mai và tìm hiểu 
cái đẹp đặc sắc của cây Mai ra sao cho người thưởng ngoạn. Đồng thời 
cũng đề cập đến một số kinh nghiệm kỹ thuật trồng Mai cho người trồng.Mục lục:TựaThú chơi Mai của người xưaCách chọn một cây Mai đẹpThử tìm hiểu hoạ pháp cây MaiGiống MaiI. Mai vàng năm cánhII. Mai vàng nhiều cánhIII. Bạch MaiIV. Mai đỏ - Mai xanhV. Mai Tứ QuýVI. Mai chiếu thuỷVẻ đẹp của cây Mai ghép và BonsaiMai kiểngChọn đất trồng MaiBón phân cho MaiKỹ thuật trồng MaiChăm sóc cây MaiCho Mai ra hoa đúng vào dịp TếtChưng Mai ngày TếtMời bạn đón đọc.   ",32.0, 13 x 19 cm , 02/2013 , Văn Lang , Nxb Mỹ thuật ,100.0, Việt Chương , Bìa mềm ,
Làm Vườn Cho Người Mới Bắt Đầu,https://www.vinabook.com/images/thumbnails/product/240x/359740_p91624manh2d9c2e1aba5b7f4ba7afaada9515f013d4master.jpg,Cây – cá cảnh,"  Thông tin tác giả    Abigail Wheatley     Vào trang riêng của tác giả   Xem tất cả các sách của tác giả       Emily Bone     Vào trang riêng của tác giả   Xem tất cả các sách của tác giả     Cuốn sách này sẽ giúp các bạn biết cách trồng nhiều loại cây
quanh nhà hoặc ngay trong nhà mà không nhất thiết phải có một khu vườn. Với các
bước hướng dẫn từ đơn giản đến chi tiết, bạn có thể trồng hoa, thảo mộc, các loại
rau như cà chua, khoai tây, các loại sen đá… hoặc thậm chí là trồng ngô ngọt
hay làm một bồn thủy sinh nho nhỏ tại nhà. Những phương pháp sang chậu, tự ủ
phân bón, trồng củ hoa trong bình… hóa ra lại dễ dàng đến bất ngờ! Ngoài ra, qua các đường link liên kết với trang web của
Usborne trong sách, bạn sẽ tìm thấy nhiều mẹo vặt và ý tưởng làm vườn thú vị
giúp tạo thêm cảm hứng làm vườn mỗi ngày nữa đấy! Hãy bắt đầu thực hành theo cuốn sách này để có những hoạt động
tích cực, hòa mình vào thiên nhiên và tự cung cấp những thực phẩm an toàn cho
gia đình bạn nhé! ----- Để có thêm nhiều liên kết dẫn tới các trang web giúp bạn có
thể xem được cảnh tượng những bông hoa nở rực rỡ, thử tham gia các hoạt động trồng
cây trực tuyến và tìm hiểu thêm được nhiều kiến thức về việc làm vườn hơn nữa,
bạn hãy truy cập vào trang web Usborne Quicklinks tại địa chỉ
www.usborne.com/quicklinks và gõ từ khóa “gardening for beginners” nhé!Mời bạn đón đọc. ",60.0, 19 x 24 cm , 28/08/2020 , Đinh Tị , Nxb Hà Nội ,64.0," Abigail Wheatley , Emily Bone ", Bìa mềm , Thùy Dương 
Nghệ Thuật Chơi Bonsai,https://www.vinabook.com/images/thumbnails/product/240x/299828_p81542mnghethuat.jpg,Cây – cá cảnh,"  Thông tin tác giả    Hoài Anh 
                                                                                                                                            Hoài Anh
                                                                   Vào trang riêng của tác giả   Xem tất cả các sách của tác giả     Người chơi bonsai phải biết tạo ra các thế cây, hiểu được ý nghĩa của các thế cây bonsai là một điều rất lý thú.Bonsai phải được bàn tay nghệ thuật của con người tác động và để hình thành một thân cây, đó là một dáng đứng, một điệu vươn của cây có bố cục chặt chẽ, đẹp đẽ, hình thành nên một tác phẩm nghệ thuật độc đáo có sức sống và toát lên một chủ đề một ý tưởng nhất định.Nghệ thuật chơi bonsai là một tài liệu tham khảo giúp bạn đọc có thêm nhiều hiểu biết hơn về bonsai, về cách chơi, cũng như kỹ thuật trồng và chăm sóc cây, nhằm tạo ra những tác phẩm nghệ thuật có giá trị.Mời bạn đón đọc. ",30.0, 13.5 x 20.5 cm , 2011 , Huy Hoàng , Nxb Văn hóa Thông tin ,164.0, Hoài Anh , Bìa mềm ,
Trồng Hoa Quanh Nhà (Tái Bản 2016),https://www.vinabook.com/images/thumbnails/product/240x/233729_p71803mimg067.jpg,Cây – cá cảnh,"  Thông tin tác giả    Thiên Kim 
                                                                                                                                            Thiên Kim
                                                                   Vào trang riêng của tác giả   Xem tất cả các sách của tác giả     Mỗi loài hoa là một thế giới, trồng hoa tựa như khi ta đang yêu vậy!Chúng ta dành cho hoa cỏ sự chăm sóc tận tâm nhất, hoa cỏ cũng sẽ báo đáp chúng ta vẻ đẹp thanh tao nhất.Trong mỗi đóa hoa là cả một thế giới, cũng giống như lúc ta đang yêu, điều ta nhìn thấy là nét đẹp của người yêu, là sự ban tặng, sẻ chia những tình cảm nồng ấm nhất!Bất luận là chúng ta bắt đầu từ một hạt giống, hay từ một nhành cây, thì sự sống của hạt giống hay nhành cây ấy cũng nằm trong tay bạn, nó sẽ lớn lên khoẻ mạnh, hay yếu ớt cũng từ đôi tay bạn, tựa như khi ta nuôi trẻ, chúng sẽ lớn lên hàng ngày, niềm vui cuộc sống sẽ là thu hoạch lớn nhất.Nhưng, cho dù đang yêu hay nuôi trẻ nhỏ, thì ngoài tình yêu, chúng ta còn cần phải có những hiểu biết cần thiết. Sự sống của thực vật không thể thiếu bất cứ yếu tố nào, đương nhiên bạn cũng cần phải dành chút thời gian để hiểu rõ về chúng.Mời bạn đón đọc. ",65.0, 13 x 19 cm , 03/2016 , Văn Lang , Nxb Thanh Hóa ,128.0, Thiên Kim , Bìa mềm ,
Kỹ Thuật Trồng Mai (Tái Bản 2015),https://www.vinabook.com/images/thumbnails/product/240x/229686_p71237mbiatruoc.jpg,Cây – cá cảnh,"  Thông tin tác giả    Việt Chương 
                                                                                                                                            Việt Chương
                                                                   Vào trang riêng của tác giả   Xem tất cả các sách của tác giả     Cây mai vàng ở Miền Nam, hay cây đào ở miền Bắc là một biểu tượng cho cái Tết cổ truyền, đại diện cho mùa xuân. Cho dù, ngày xuân còn có rất nhiều loại hoa khoe hương thắm sắc, cây mai, cây đào vẫn chiếm giữ một vị trí quan trọng trong lòng của người thưởng hoa, nó gần như mang tính quốc hồn quốc túy trong lòng của người dân Việt.Trong tập sách nhỏ này, tác giả giới thiệu về thú chơi mai và tìm hiểu cái đẹp đặc sắc của cây Mai. Đồng thời cũng đề cập đến một số kinh nghiệm kỹ thuật trồng Mai cho người trồng.Mời bạn đón đọc. ",45.0, 13 x 19 cm , 06/2015 , Văn Lang , Nxb Thanh Hóa ,128.0, Việt Chương , Bìa mềm ,
Kỹ Thuật Trồng Bonsai,https://www.vinabook.com/images/thumbnails/product/240x/294813_p80344m21256.jpg,Cây – cá cảnh,"  Thông tin tác giả    Trần Văn Huân 
                                                                                                                                            Trần Văn Huân
                                                                   Vào trang riêng của tác giả   Xem tất cả các sách của tác giả     Cùng với sự phát triển của xã hội, nhu cầu của con người ngày càng được nâng cao. Việc trồng và thưởng thức cây bonsai do đó cũng trở thành một thú chơi phổ biến bên cạnh việc tạo ra thu nhập.Nhưng, để có được những cây kiểng bonsai vừa ý, đẹp và có giá trị đòi hỏi chúng ta phải thực hiện được một quá trình hoàn hảo gồm nhiều giai đoạn: làm vườn, kỹ thuật chuyên môn, nghệ thuật, triết học và trồng bonsai",65.0, 13x19 cm , 06/2006 , Văn Lang , Nxb Mỹ thuật ,252.0, Trần Văn Huân , Bìa mềm ,
Bonsai,https://www.vinabook.com/images/thumbnails/product/240x/152884_p58975mbonsai.jpg,Cây – cá cảnh,"  Thông tin tác giả    Kunio Kobayashi     Vào trang riêng của tác giả   Xem tất cả các sách của tác giả     Khi Bonsai bắt đầu phổ biến trên toàn thế giới qua cuộc Triển lãm Quốc tế Osaka năm 1970, Liên đoàn Bonsai Thế giới (WBFF) và Hiệp hội Bonsai Châu Á - Thái Bình Dương (ASPAC) lần lượt được thành lập, “Bonsai” đã trở thành một từ quốc tế. Ngày nay, có khoảng 120 loài cây được sử dụng trong việc tạo ra bonsai, và nhiều hơn một chút nếu tính cả các giống cây trồng. Bonsai (Hán-Việt: bồn tài) là loại cây cảnh nhỏ có dáng cổ thụ trồng trong chậu cảnh. Cái khác biệt giữa sự thưởng thức một cây cảnh thường và thưởng ngoạn bonsai, là trong cây cảnh thường, người ta tập trung nhiều hơn vào việc ngắm hoa và lá. Ở Bonsai, sự thưởng ngoạn nằm ở vẻ đẹp của toàn cây và sự hòa điệu của cây với chậu cảnh. Bonsai là một hình thức nghệ thuật cũng như nghệ thuật hội họa và nghệ thuật điêu khắc, nhưng tác phẩm của nghệ sĩ Bonsai chưa bao giờ hoàn tất, vì nó là tác phẩm sống và vẫn tiếp tục sinh trưởng qua thăng trầm, thử thách. Mỗi Bonsai là một tác phẩm duy nhất, không bao giờ có hai cây hoàn toàn giống nhau, kể cả chậu. Các nghệ sĩ Bonsai không chỉ tạo ra một cây cảnh mà còn cho nó một linh hồn. Giá trị của Bonsai không nằm trong chất liệu từ đó nó được tạo ra, mà nằm trong tâm hồn của người tạo ra nó và cả người thưởng ngoạn nó. Mời bạn đón đọc. ",145.0, 16 x 24 cm , 2014 , Văn Lang , Nxb Mỹ thuật ,224.0, Kunio Kobayashi , Bìa mềm ,
"Trồng Mai - Kỹ Thuật Bón Tưới, Phòng Trừ Sâu Rầy - Bệnh Hại",https://www.vinabook.com/images/thumbnails/product/240x/175661_p62892mtrongmai.jpg,Cây – cá cảnh,"  Thông tin tác giả    Phúc Quyên     Vào trang riêng của tác giả   Xem tất cả các sách của tác giả       Việt Chương 
                                                                                                                                            Việt Chương
                                                                   Vào trang riêng của tác giả   Xem tất cả các sách của tác giả     Từ xa xưa, như một tập tục, cứ đến ngày 30 tết, dù nghèo hay giàu, dù sang hay hèn, trên bàn thờ ông Vải của nhà nào cũng bày bình hoa mai chưng cúng suốt ba ngày tết. Nhiều nhà còn chọn những cây mai có dáng thế đẹp mà cành nào cũng oằn sai những nụ hoa chớm nở chưng trong phòng khách với mơ ước những cây mai đó sẽ đem lại sự may mắn và hạnh phúc cho gia đình.Hoa mai với sắc vàng tươi tắn, rực rỡ đối với người dân Nam bộ từ ngàn đời nay tượng trưng cho sự may mắn, thịnh vượng và hạnh phúc tràn đầy.Phòng trừ sâu rầy và bệnh hại cho cây mai là công việc mà bất cứ người trồng mai nào thời nay cũng phải đặc biệt quan tâm tới, nhằm tạo ra những cây mai đẹp và hoàn thiện nhất. Nhưng, điều này lại khác biệt với người trồng mai thời xưa.Ngày nay, cây mai đã trở thành một thứ hàng hóa để đem ra mua bán như các hàng hóa khác ngoài chợ. Vì vậy nghề trồng mai ngày nay được xem là một nghề dễ hái được nhiều tiền.Muốn trồng được những cây mai đẹp đạt giá bán cao ngất ngưỡng như vậy, người làm vườn, tức là nghệ nhân hoa kiểng phải dày công chăm sóc tưới bón, và hằng ngày quan tâm đến việc phòng trị các loài sâu rầy và bệnh hại cho cây.Mời bạn đón đọc. ",35.0, 13 x 19 cm , 03/2015 , Văn Lang , Nxb Mỹ thuật ,120.0," Phúc Quyên , Việt Chương ", Bìa mềm ,
Bonsai Cho Mọi Nhà (Tái Bản 2014),https://www.vinabook.com/images/thumbnails/product/240x/219048_p69488mbt.jpg,Cây – cá cảnh,"  Thông tin tác giả    Penelope O'sullivan     Vào trang riêng của tác giả   Xem tất cả các sách của tác giả     Nắm bắt bí quyết tạo dáng và chăm sóc bonsai để có một chậu cảnh độc đáo sẽ khiến nơi bạn ở thật sự sinh động vì đã được thiên nhiên hiện diện, hòa điệu vào không gian sống của riêng mình.Bonsai cho mọi nhà hướng dẫn phương pháp tạo dáng các kiểu bonsai với nhiều hình ảnh minh họa phong phú, nổi bật nét tinh tế của một chậu bonsai đạt đỉnh cao nghệ thuật.Mời bạn đón đọc. ",55.0, 13.5 x 20.5 cm , 03/2014 , Văn Lang , Nxb Mỹ thuật ,196.0, Penelope O'sullivan , Bìa mềm , Nguyễn Kim Dân 
Kỹ Thuật Trồng Bonsai (Tái Bản 2013),https://www.vinabook.com/images/thumbnails/product/240x/233150_p71755m001.jpg,Cây – cá cảnh,"  Thông tin tác giả    Trần Văn Huân 
                                                                                                                                            Trần Văn Huân
                                                                   Vào trang riêng của tác giả   Xem tất cả các sách của tác giả       Văn Tích Lượm 
                                                                                                                                            Văn Tích Lượm
                                                                   Vào trang riêng của tác giả   Xem tất cả các sách của tác giả     Cùng với sự phát triển của xã hội, nhu cầu của con người ngày càng được nâng cao. Việc trồng và thưởng thức cây bonsai do đó cũng trở thành một thú chơi phổ biến bên cạnh việc tạo ra thu nhập.Nhưng, để có được những cây kiểng bonsai vừa ý, đẹp và có giá trị đòi hỏi chúng ta phải thực hiện được một quá trình hoàn hảo gồm nhiều giai đoạn: làm vườn, kỹ thuật chuyên môn, nghệ thuật, triết học và trồng bonsai",95.0, 13 x 19 cm , 12/2013 , Văn Lang , Nxb Mỹ thuật ,256.0," Trần Văn Huân , Văn Tích Lượm ", Bìa mềm ,
Làm Quen Với Nghệ Thuật Bonsai (Tái Bản 2013),https://www.vinabook.com/images/thumbnails/product/240x/205333_p67594m001.jpg,Cây – cá cảnh,"  Thông tin tác giả    Hoài Anh 
                                                                                                                                            Hoài Anh
                                                                   Vào trang riêng của tác giả   Xem tất cả các sách của tác giả     Bonsai là loại nghệ thuật tạo dáng truyền thống, độc đáp của thời cổ Trung Quốc. Bonsai là dùng cây kiểng, đá núi và các loại vật liệu khác, qua nghệ thuật gia công và chăm sóc tỉ mỉ tạo thành tác phẩm nghệ thuật. Bonsai là hình ảnh thu nhỏ của vẻ đẹp thiên nhiên. Qua nghệ thuật gia công từng phiến đoạn cảnh đẹp thiên nhiên, có tư thế sinh động đẹp đẽ. Trong sáng tác thường ẩn chứa một nội dung tư tưởng và kết hợp nghệ thuật thi hoạ, gốm sứ, điêu khắc để bonsai hoàn mỹ mang ý thơ nét hoạ ngây ngất lòng người. Bonsai cũng có sức sống của điêu khắc nghệ thuật. Nó tuỳ theo sự biến hoá của thời tiết đem lại màu sắc với cảnh quan nghệ thuật khác nhau.Khi sở hữu một số cây, một số hoa của riêng mình, người chơi bonsai thường có cảm giác “làm chủ thiên nhiên”. Ngoài thiên nhiên, có hoa đấy, có cây đấy, nhưng những hoa, những cây kia là của đất trời, của mọi người. Chúng mọc, chúng phát triển và ra hoa kết quả ngoài sự can thiệp của con người. Vì thế, bonsai đã đi vào cuộc sống như một mỹ tục, một thú chơi tao nhã thể hiện sự thanh thoát trong tâm hồn của mỗi người chơi.Con người càng văn minh càng tiến bộ, càng ăn nên làm ra thì càng coi bonsai như một nhu cầu không thể thiếu trong đời sống của mình. Dù là trong phố phường chật hẹp người ta cũng trồng những chậu bonsai, trong bồn và cả lan can…. để ngày ngày được ngắm cây, được tư tay vui tưới vào những giờ rảnh rỗi. Đây là cách giải trí vô cùng lành mạnh, không những chỉ hợp với người già mà còn với mọi người và mọi lứa tuổi.Việc sở hữu một chậu bonsai có giá trị là cả một trách nhiệm cao cả, đòi hỏi người chơi phải dày công nghiên cứu nghệ thuật trồng và chăm sóc cây. Những người yêu nghệ thuật bonsai cũng như người trồng bonsai vừa là những nghệ nhân - nghệ sĩ bẩm sinh, vừa là những người kỳ công khổ luyện. Bên cạnh sự nhẫn nại, niềm đam mê thực sự, họ phải trang bị cho mình những kiến thức cần thiết về lĩnh vực này. Cuốn sách “Làm quen với nghệ thuật Bonsai” sẽ giúp các bạn có những hiểu biết cơ bản nhất về bonsai, cũng như kỹ thuật trồng và chăm sóc cây, nhằm tạo ra những tác phẩm nghệ thuật giá trị.Mời bạn đón đọc. ",27.0, 13.5 x 20.5 cm , 2013 , Huy Hoàng , NXB Hồng Bàng ,160.0, Hoài Anh , Bìa mềm ,
Nghệ Thuật Làm Vườn - Tái bản 12/2010,https://www.vinabook.com/images/thumbnails/product/240x/152531_p58882mbaitruoc.jpg,Cây – cá cảnh,"  Thông tin tác giả    Việt Thư 
                                                                                                                                            Việt Thư
                                                                   Vào trang riêng của tác giả   Xem tất cả các sách của tác giả     Cải tạo khu vườn không phải là công việc nặng nhọc. Để cải tạo khu vườn, bạn chỉ cần có kế hoạch cụ thể, dụng cụ thích hợp, vốn kiến thức căn bản về làm vườn, và lòng nhiệt tình. Khởi đầu với một vài cải tạo trên quy mô nhỏ sẽ không tốn quá nhiều thời gian và tiền bạc. Quyển sách này sẽ giúp bạn cảm thấy lạc quan về khu vườn, khơi dậy niềm cảm hứng, và thúc đẩy bạn giải quyết có căn cơ hơn.Mục lục:Cải tạo khu vườnTrồng câyTrồng cây trong chậuChăm sóc cây trồng",55.0, 13.5 x 21 cm , 12/2010 , Văn Lang , Nxb Mỹ thuật ,304.0, Việt Thư , Bìa mềm ,
Kỹ Thuật Trồng Hoa Và Cây Lá Trong Nước - Tái bản 2008,https://www.vinabook.com/images/thumbnails/product/240x/152339_p58868mbt.jpg,Cây – cá cảnh,"  Thông tin tác giả    Trương Lỗ Quy 
                                                                                                                                            Trương Lỗ Quy
                                                                   Vào trang riêng của tác giả   Xem tất cả các sách của tác giả     Cây lá không cần chăm sóc nhiều mà vẫn mang lại giá trị thưởng ngắm cao. Đó chính là sức hấp dẫn của cây lá màu khiến nó được trồng nhiều trong nhà và trong các phòng ốc.Cuốn sách ""Kỹ thuật trồng hoa và cây lá trong nước"" là sự tổng kết kinh nghiệm thực tiễn trong nhiều năm nghiên cứu của tác giả. Hy vọng cuốn sách sẽ mang lại cho bạn đọc những giây phút tìm về với thiên nhiên thật thoải mái và bổ ích.Mục lục:Lời nói đầuCái nhìn tổng quan về cây lá màu trồng trong nướcThiết kế trồng tổ hợp cây lá màu trong nướcLựa chọn các loại cây lá màu trồng trong nướcLấy giống cây lá màu trồng trong nướcBình đựng cây lá màu trồng trong nướcChăm sóc cây lá màu trồng trong nướcNhững vấn đề thường gặp khi trồng cây lá màu trong nướcChẩn đoán bệnh thường gặp ở cây lá màu trồng trong nước",48.0, 13 x 19 cm , 2008 , Văn Lang , Nxb Mỹ thuật ,136.0, Trương Lỗ Quy , Bìa mềm , Nguyễn Kim Dân 
Tạo Dáng Cây Thế Bonsai,https://www.vinabook.com/images/thumbnails/product/240x/150906_p58683mbt.jpg,Cây – cá cảnh,"  Thông tin tác giả    Lan Anh 
                                                                                                                                            Lan Anh
                                                                   Vào trang riêng của tác giả   Xem tất cả các sách của tác giả     Việc tạo ra một cây Bonsai là cả một quá trình nghệ thuật. Bằng bàn tay khéo léo tinh xảo và sự sáng tạo người nghệ sĩ Bonsai tái tạo thiên nhiên bằng cách thu nhỏ lại những chất liệu là cây thật. Để đáp ứng yêu cầu của bạn đọc, Tạo Dáng Cây Thế Bonsai phát hành với mục đích mang lại cho độc giả, những người yêu thích cây cảnh một phong cách mới mẻ và kỹ thuật điêu luyện để tạo ra một cây Bonsai độc đáo và ấn tượng. Với cách cắt tỉa, tạo dáng, tạo ấn tượng hy vọng sẽ mang lại cho bạn đọc những cây Bonsai như ý.Mời bạn đón đọc. ",25.0, 13 x 19 cm , 2010 , PandaBooks , Nxb Từ điển Bách khoa ,116.0, Lan Anh , Bìa mềm ,
Tạo Dáng Bonsai - Tái bản 06/2012,https://www.vinabook.com/images/thumbnails/product/240x/145535_p58188mxx798.jpg,Cây – cá cảnh,"  Thông tin tác giả    Nguyễn Kim Dân 
                                                                                                                                            Nguyễn Kim Dân
                                                                   Vào trang riêng của tác giả   Xem tất cả các sách của tác giả     Nghệ thuật cắt tỉa và tạo dáng bonsai đã có ở Trung
 Hoa ít nhất từ thế kỷ 17. Penjing, một dạng cây kiểng nghệ thuật cổ, 
được dịch là “Phong cảnh trong chậu hay đĩa”, Làng nghệ thuật tạo phố 
cảnh thu nhỏ. Với 17 kiểu phong cảnh được mô tả nổi bật, đặc sắc trong 
cuốn “Tạo dáng Bonsai” không chỉ hấp dẫn người đọc bằng những chỉ dẫn và
 hình minh hoạ rõ ràng, cụ thể, sắc nét mà còn giải thích về cách toạ 
dáng, cách trồng và chọn lựa vị trí cho các yếu tố trong phong cảnh, 
cách chăm sóc cây… giúp bạn có thể tạo bầu không khí trong lành, dễ chịu
 và tâm hồn thanh thản cho ngôi nhà của mình từ những cây kiểng nghệ 
thuật. Mỗi phong cảnh là một tác phẩm nghệ thuật đặc sắc, được sáng tạo 
một cách khéo léo và tinh vi, mang đậm dấu ấn của điều khắc, hội họa và 
âm nhạc, tô điểm thêm sắc màu và dư vị cho cuộc sống của bạn. Mục lục: Lời giới thiệu Nguyện vật liệu Kỹ thuật Những cây kiểng nghệ thuật Thác nước Bát tiên Thạch lựu Núi hình ga trông nhà Lệ bách Phong đỏ Táo tây Kim thạch Lục long Hoa anh đào nở rộ Thần tài",82.0, 16 x 24 cm , 06/2012 , Văn Lang , Nxb Mỹ thuật ,128.0, Nguyễn Kim Dân , Bìa mềm ,
