,tên sách,ảnh bìa,thể loại,tác giả,nội dung tóm tắt,giá bìa,công ty phát hành,nhà xuất bản,ngày xuất bản,kích thước,loại bìa,số trang,dịch giả,path,phiên bản,thương hiệu,xuất xứ,xuất xứ thương hiệu
0,,,,,,,,,,,,,,,,,,
1,Hoa Học Trò Số 1368,https://cdn0.fahasa.com/media/catalog/product/cache/1/small_image/600x600/9df78eab33525d08d6e5fb8d27136e95/u/n/untitledhht-1368.jpg,TẠP CHÍ - CATALOGUE,Báo Sinh Viên Việt Nam - Hoa Học Trò,"
HHT - Hoa Học Trò 1368 sẽ là một tia nắng, một chút niềm vui thêm vào một tuần mới nhiều năng lượng của bạn!
Mùa thi tốt nghiệp THPT và tuyển sinh đại học 2022 sẽ có những thay đổi gì?
Dịch COVID-19 và việc chuyển từ học trực tiếp sang online đã ảnh hưởng rất nhiều đến kỳ thi tốt nghiệp THPT và các phương án tuyển sinh ĐH, CĐ 2 năm qua. Trong khi nhiều sĩ tử gặp khó khăn như điểm thi tốt nghiệp cao vẫn không trúng tuyển Đại học thì cũng có những teen đã tận dụng tốt những thay đổi này, biến thành cơ hội cho mình. Chuyên đề phân tích về xu hướng thay đổi trong thi và xét tuyển cùng kinh nghiệm từ những “tiền bối” đã “hoá rồng” thành công trên số báo tới sẽ giúp bạn tự tin hơn để sẵn sàng đối mặt với thử thách lớn này!
Vượt ""chốt chặn"" tình yêu theo kiểu Squid Game
Mùa giãn cách, khi tình iu gà bông bỗng đầy rẫy “chốt chặn” thử thách và đường đến trái tim nhau trở thành hành trình sinh tồn như trong phim Trò Chơi Con Mực (Squid Game), phải làm sao để mối quan hệ của cả hai “sống sót” qua đại dịch từ “virus tan vỡ” này?
Bản địa hóa - nghề hot chưa nhiều người khám phá
Bản địa hóa là “người hùng thầm lặng” ở sau tính năng phụ đề của Netflix hay sự xuất hiện của chương trình Rap Việt từ bản gốc The Rapper (Thái Lan). Cùng là anh em với nghề phiên dịch viên nhưng lĩnh vực bản địa hóa “đa-zi-năng” hơn nhiều, cụ thể như thế nào thì cùng tìm hiểu với nhà Hoa nhé!
Gương mặt trang bìa: Thanh Sơn (11 Tháng 5 Ngày)
Sở hữu loạt vai diễn ấn tượng trong các “phim giờ vàng” trên VTV, Thanh Sơn được đông đảo khán giả yêu mến. Tuy nhiên, nam diễn viên tiết lộ bản thân không tự tin về ngoại hình của mình, lý do là gì? 
",20.000 đ,,,,,,,,https://www.fahasa.com/hoa-hoc-tro-so-1368.html,,,,
2,Hoa Học Trò Số 1360 - Tặng Kèm Fanbook Visual of Visual + Idol Poster Jin (BTS) và Jisoo (BLACKPINK),https://cdn0.fahasa.com/media/catalog/product/cache/1/small_image/600x600/9df78eab33525d08d6e5fb8d27136e95/z/2/z2490365749017_0db859e65686add5d3aae694d0d56e12.jpg,TẠP CHÍ - CATALOGUE,Báo Sinh Viên Việt Nam - Hoa Học Trò,"
Mùa Hè đã cận kề, bạn có Hoa Học Trò 1360 tặng kèm fanbook Visual chưa?
HHT - Miền Bắc và miền Trung đã bắt đầu có những đợt nắng gắt còn miền Nam đã vào mùa mưa với những cơn mưa bất chợt. Và luôn luôn, Hoa Học Trò 1360 đồng hành với bạn đi qua những ngày mưa nắng đỏng đảnh để khám phá những cơ hội trải nghiệm, học tập thú vị!
Rich kid có có gì ngoài hàng hiệu?
Nếu nghĩ rằng ""sống trong nhung lụa"", ""có gia đình chống lưng"" là sở trường của ""rich kid"" thì bạn lầm to rồi nhé! Trải lòng của một cô bạn “rich kid” tài năng đang hot hòn họt trên mạng xã hội trên số báo sau sẽ xoá tan định kiến ""trông nhà mà bắt hình dong"" của nhiều người. Hãy đón xem nhé!
“Lời lỗ” sau 10 ngày đi hết miền Trung
Điên rồ và đáng yêu - chuyên mục đốn tim lẫn chạm dây thần kinh cười của teen mình sẽ trở lại với chuyến thực tập làm hướng dẫn viên nhiều ""thăng trầm"" tại miền Trung. Đừng bỏ lỡ liệu pháp ""giải nhiệt"" mùa Hè này nhé!
Học song ngành có ""ngầu"" như bạn nghĩ?
Phân vân giữa hai ngành yêu thích hay đơn giản là muốn bổ trợ kiến thức nhiều hơn trên giảng đường đại học, nhiều teen tần ngần đứng trước việc học song ngành. Hoa Học Trò 1360 sẽ giải đáp cho bạn những câu hỏi về hình thức mới lạ này, sẵn sàng hành trang rời ghế cấp Ba bạn nhé! 
",30.000 đ,,,,,,,,https://www.fahasa.com/hoa-hoc-tro-so-1360-tang-kem-fanbook-visual-of-visual-idol-poster-jin-bts-va-jisoo-blackpink.html,,,,
3,"Sống Đi, Ngại Gì Uổng Phí Thanh Xuân - Tặng Kèm Sticker BTS & TWICE - Bìa Giao Ngẫu Nhiên",https://cdn0.fahasa.com/media/catalog/product/cache/1/small_image/600x600/9df78eab33525d08d6e5fb8d27136e95/1/_/1_78_5.jpg,TẠP CHÍ - CATALOGUE,Báo Sinh Viên VN - Hoa Học Trò,"
Sống Đi, Ngại Gì Uổng Phí Thanh Xuân
Vừa là cuốn day-runner theo bạn cả năm, vừa là cuốn sách mở ra cuộc hành trình thú vị khiến 24 giờ 7 ngày của bạn xứng đáng đến từng khoảnh khắc thanh xuân. 

Sống đi, ngại gì uổng phí thanh xuân không chỉ là cuốn nhật ký ghi chú những việc phải làm, những sự kiện đáng nhớ; mà còn là nơi để bạn tự trò chuyện với chính mình mỗi ngày bằng cách viết vào đây những cảm xúc vui buồn. Vừa là sổ nhật ký vừa là sách tâm lý - rất độc đáo, bạn sẽ được thỏa sức khám phá những bí ẩn về tính cách, tương lai, nghề nghiệp, tình cảm... giúp bạn sống “deep” nhất có thể. 24h mỗi ngày là không thể kéo dài hơn, thanh xuân là thứ không thể mặc cả thêm dù tiếc nuối, chỉ có thể sống sâu nhất để tận hưởng cảm nhận nhiều nhất mà thôi. Hãy nhanh tay đặt trước trên các nhà sách online để không bỏ lỡ bạn nhé!
Thiết kế đặc biệt cực chất, những câu “quote” thấm cực hạn và cả bộ sticker siêu xinh,... tất cả đều có trong cuốn day-runner đang chờ bạn rước về. Tất nhiên, không thể thiếu thần tượng của thanh xuân đang chờ bạn trong ấn phẩm này, BTS và Twice và những điều bạn thì thầm với họ có luôn trong đây nhé!
Trong cuốn day-runner này còn rất nhiều câu hỏi thú vị chờ bạn điền vào, ghi chép, để khám phá niềm tin, tham vọng, tình bạn, ký ức của bạn. Đánh thức tiềm năng, trí tưởng tượng và khả năng sáng tạo của bạn nữa.
Không chỉ là sổ nhật ký, đây còn là một cuốn sách đặc biệt với những chỉ dẫn để bạn có thể khám phá mọi ngóc ngách suy nghĩ của mình, trả lời câu hỏi muôn thuở: “Tôi là ai?” và cả những điều nho nhỏ dễ thương có thể giúp bạn tận hưởng thanh xuân trọn vẹn, dũng cảm nhất, không phí một giây nào.
Tin chắc rằng day-runner Sống đi, ngại gì uổng phí thanh xuân sẽ là một món quà sáng tạo và thú vị nhất mà bạn có thể tự tặng cho bản thân trước thềm năm mới.
 
",90.000 đ,,,,,,,,https://www.fahasa.com/song-di-ngai-gi-uong-phi-thanh-xuan-tang-kem-sticker-bts-twice-bia-giao-ngau-nhien.html,,,,
4,"Thiên Thần Nhỏ - Số 404 - Tặng Kèm Poster Khổ Lớn SHINEE, BTS Và Board Game TWICE",https://cdn0.fahasa.com/media/catalog/product/cache/1/small_image/600x600/9df78eab33525d08d6e5fb8d27136e95/t/t/ttn404.jpg,TẠP CHÍ - CATALOGUE,Báo Sinh Viên VN - Hoa Học Trò,"
Thiên Thần Nhỏ 404: Bạn có biết đôi bàn tay mình kỳ diệu đến thế nào chưa?
HHT - Hóa ra đôi bàn tay quen thuộc có thể tạo ra rất nhiều phép màu, chỉ là bạn có biết cách hay không mà thôi.
Nhìn bàn tay biết ngày tháng
Mỗi tháng có số ngày thường không giống nhau, vì thể để nhớ được chính xác thì rất khó khăn. Nhưng chỉ cần nhìn vào 2 bàn tay là bạn có thể biết được gần như chính xác số ngày của một tháng.
Đầu tiên, bạn nắm hai bàn tay lại và để hai bàn tay sát lại với nhau. Khi nắm tay lại, mỗi bàn tay chúng mình sẽ tạo thành những phần lồi, lõm xem kẽ nhau và Thiên Thần Nhỏ 404 sẽ mách bạn cách đọc ngày tháng từ chúng.
Dự báo thời tiết có gì thú vị?
Bây giờ, nếu bạn muốn biết thời tiết của ngày mai thì có thể mở ứng dụng dự báo thời tiết trên điện thoại, hoặc xem trên TV. Nhưng ngày xưa, khi chưa có công nghệ và các thiết bị cần thiết, thì con người chỉ cần quan sát xung quanh, chú ý đến những tín hiệu của thiên nhiên là cũng có thể dự báo được đấy. Mà những người như thủy thủ, nông dân, người chăn cừu… lại dự đoán cực kỳ chính xác nhé.
Những đám mây là thứ mà người xưa rất tin tưởng trong việc dự báo thời tiết, cả thời tiết tốt lẫn thời tiết xấu. Những đám mây vảy rồng có dạng như những chiếc túi nhỏ lồng phồng, thường sẽ biến thành giông bão. Những đám mây ti trông như những dải mỏng, như những sợi dây hay túm tóc, thường có nghĩa là sắp có mưa hoặc bão.
Còn những đám mây trung tích trông như vảy cá thường báo hiệu mưa sẽ đến trong vòng một ngày tới. Các thủy thủ ngày xưa rất chú ý đến những đám mây kiểu này. 
",20.000 đ,,,,,,,,https://www.fahasa.com/thien-than-nho-so-404-tang-kem-poster-kho-lon-shinee-bts-va-board-game-twice.html,,,,
5,Hoa Học Trò Số 1352 - Tặng Kèm Fanbook Khổ Lớn Idol 97-Line + 2 Mega Poster Jung Kook (BTS) & Vương Nhất Bác,https://cdn0.fahasa.com/media/catalog/product/cache/1/small_image/600x600/9df78eab33525d08d6e5fb8d27136e95/z/2/z2290572548528_7a55e636046a24044864e3417674d31a.jpg,TẠP CHÍ - CATALOGUE,Báo Sinh Viên Việt Nam - Hoa Học Trò,"
Hoa Học Trò 1352: Sải bước tiến vào năm mới, nhận ngay fanbook khổ lớn Idol 97-Line
HHT - Một năm mới đến, tiếp thêm động lực và cảm hứng để chúng “xắn tay” vào những kế hoạch mới mẻ. Hãy cùng Hoa Học Trò 1352 sải những bước dài trên con đường tiến vào tương lai phía trước.
Trả lương cho chính mình
Tết đến, teen mình háo hức chờ… tiền lì xì. Nhưng làm thế nào để túi tiền của các tháng còn lại trong năm cũng rủng rỉnh như Tết mà không cần “động tay động chân” nhiều, cùng Hoa Học Trò 1352 khám phá ngay thôi nào!
Về nhà ăn… tức
Những câu hỏi muôn thuở, những tình huống “tránh vỏ dưa, gặp vỏ dừa”, những nhân vật mỗi-năm-chỉ-gặp-một-lần đã vô tình khiến chuyến về nhà ăn Tết của nhiều bạn trở thành về nhà ăn… tức. Cùng Góc hóng gió số sau khui ra những câu chuyện cười ra nước mắt chỉ có trong dịp Tết ở nhà bạn nhé!
10 cách để bắt đầu câu chuyện với crush
Dù là thế kỷ 21 hay thế kỷ 23, việc bắt chuyện với crush vẫn mãi là một loại công nghệ cao mà không phải ai cũng có thể thành thục. Đã đến lúc bạn nên thôi lo lắng, chuẩn bị dứt áo ra đi khỏi tình cảnh F.A vì Hoa Học Trò 1352 đã có mắt để giúp bạn đây rồi! 
",30.000 đ,,,,,,,,https://www.fahasa.com/hoa-hoc-tro-so-1352-tang-kem-fanbook-kho-lon-idol-97-line-2-mega-poster-jung-kook-bts-vuong-nhat-bac.html,,,,
6,Hoa Học Trò Số Số 1331,https://cdn0.fahasa.com/media/catalog/product/cache/1/small_image/600x600/9df78eab33525d08d6e5fb8d27136e95/c/8/c8ddc46a6d42961ccf53.jpg,TẠP CHÍ - CATALOGUE,Báo Sinh Viên VN - Hoa Học Trò,"
Hoa Học Trò Số Số 1331
Hoa Học Trò 1331 đem đến cho các bạn ti tỉ câu chuyện vui nhộn cùng những xu hướng “sốt dẻo” nhất cho tuần mới thật năng động. Bảo đảm đọc báo vui như được gặp crush!
Nếu Itaewon Class là một trường học
Sức hút của bộ phim hot nhất hiện nay - Itaewon Class nằm ở kịch bản hấp dẫn cùng những nhân vật với tính cách đặc trưng và rất thực tế. Lấy cảm hứng từ bộ phim, một Itaewon Class phiên bản “học đường” được ra đời với nhiều câu chuyện thú vị chờ đón bạn khám phá trên số báo Hoa Học Trò 1331.
Fan của Itaewon Class bhắc chắn không nên bỏ qua số báo này vì vô vàn những bài viết tuôn tràn cảm hứng từ bộ phim sẽ dành cho bạn một cẩm nang vô cùng đặc biệt.
Mách công thức tạo kỷ yếu “triệu like” từ A đến Z
Để sở hữu bộ ảnh kỷ yếu “để đời”, không ít tập thể lớp đã có những bài học “nhớ đời” không đáng có. Bài viết hứa hẹn sẽ cung cấp cho teen tất-tần-tật bí kíp lẫn kinh nghiệm “xương máu” của các tiền bối từ khâu lên ý tưởng, tìm concept cho đến giai đoạn bắt tay thực hiện, cân đối chi phí… “Lời nguyền” bộ ảnh chia cắt tình bạn sẽ được “hóa giải”! 
",30.000 đ,,,,,,,,https://www.fahasa.com/hoa-hoc-tro-so-so-1331.html,,,,
7,Hoa Học Trò Số 1353 - Tặng Kèm Fanbook Horoscope Idol Aquarius + 2 Mega Poster J-Hope (BTS) & Rosé (BLACKPINK),https://cdn0.fahasa.com/media/catalog/product/cache/1/small_image/600x600/9df78eab33525d08d6e5fb8d27136e95/z/2/z2298380990699_e7a4ad08a13c252e45870e79274542e6.jpg,TẠP CHÍ - CATALOGUE,Báo Sinh Viên Việt Nam - Hoa Học Trò,"
Hoa Học Trò 1353: Nạp cảm hứng cho Tết Trâu Vàng, tặng kèm fanbook Horoscope Idol Aquarius
HHT - Không khí Tết đã rộn ràng, những “đường hoa” bắt đầu bừng sắc. Hãy cùng Hoa Học Trò 1353 nạp đầy cảm hứng, chuẩn bị cho mùa lễ hội tưng bừng bạn nhé!
Giáo sư ""quần đùi"": Bài học chuyển động cho thời đại mới
Nếu bạn đang là một thành viên của hội ""chán đời"", chẳng thể tìm thấy động lực hay niềm yêu thích ở điều gì để “nhấn ga” phát triển mạnh mẽ hơn cho năm mới này, hãy gặp gỡ giáo sư “quần đùi” - thầy Trương Nguyện Thành để “rinh” về các bí kíp xịn sò từ thầy, tìm ra “máy kích hoạt năng lượng” của mình và học cách biến mơ ước thành hành động trên số báo Hoa Học Trò 1353.
Có những ngày nghe nhạc thật khác
Acoustic thì chẳng còn gì xa lạ với teen nhưng vừa nghe nhạc vừa ngắm hoàng hôn ở ngoài trời trong cái se se lạnh của Đà Lạt lại là một trải nghiệm vô cùng mới mẻ. Chuyến xách ba lô lên vùng cao để tận hưởng tiếng nhạc du dương như thế liệu có đáng? Cùng đón xem trên Hoa Học Trò 1353 nha!
Tìm gà bông: Đi tiếp hay Dừng lại?
Trên hành trình đi tìm gà bông của mình, sẽ có không ít lần bạn thấy say nắng một ai đó. Nhưng đây cũng là lúc bạn tự hỏi liêu xiêu như thế đã đủ để mình ""dừng cuộc tìm kiếm"" hoặc làm sao để biết đây chính là Mr. Right của mình? Nhà Hoa sẽ cho bạn câu trả lời trên số báo sau đó! 
",30.000 đ,,,,,,,,https://www.fahasa.com/hoa-hoc-tro-so-1353-tang-kem-fanbook-horoscope-idol-aquarius-2-mega-poster-j-hope-bts-rose-blackpink.html,,,,
8,Thiên Thần Nhỏ - Số 410 - 411,https://cdn0.fahasa.com/media/catalog/product/cache/1/small_image/600x600/9df78eab33525d08d6e5fb8d27136e95/u/n/untitled-thi_n-th_n-nh_1.jpg,TẠP CHÍ - CATALOGUE,Báo Sinh Viên VN - Hoa Học Trò,"
Úm ba la, mở ra chiếc hộp thần kỳ mang tên Thiên Thần Nhỏ ""phiên bản mini""!
HHT - Năm học mới đã bắt đầu một cách quá đặc biệt và Thiên Thần Nhỏ cũng sớm trở lại gặp các tween với diện mạo cực kỳ mới lạ. Hãy cùng chào đón Thiên Thần Nhỏ ""phiên bản mini""!
Tặng bạn những liều “phúc lạc dược” để sạc đầy cảm hứng
Để sẵn sàng trở lại trường, trở lại cuộc sống bình thường mới sau thời gian dài quanh quẩn trong nhà học online, ngoài đồng phục, sách vở, dụng cụ học tập, bạn còn cần thêm gì nữa nhỉ? À, tất nhiên là cần thêm sự chăm chỉ, nhiệt tình, sẵn sàng học hỏi rồi. Thiên Thần Nhỏ sẽ tặng bạn rất nhiều câu danh ngôn đầy cảm hứng về sự cố gắng để thành công, giúp bạn sạc đầy năng lượng trong cả năm học.Gửi những lời động viên đến người khác cũng là cách mang đến niềm vui cho chính mình. Bạn có thể làm những tấm thiệp, viết thư, hoặc đơn giản là viết lên mạng xã hội những lời cảm ơn đến người mà bạn thấy cần thiết. Ví dụ như bố mẹ, thầy cô, bạn bè của bạn hoặc những người y, bác sỹ nơi tuyến đầu chống dịch. Đó chính là cách để bạn thể hiện sự quan tâm của mình với mọi người.
Khi bạn ở yên trong nhà, thế giới vẫn không ngừng chuyển động
Càng ở lâu trong nhà để tránh dịch, chúng mình càng muốn khám phả thế giới xung quanh nhiều hơn. Thiên nhiên vẫn luôn chuyển động, lúc nào cũng có rất nhiều điều mới mẻ chờ bạn khám phá.Một nghiên cứu mới đã cho thấy rằng, những chú vẹt mào vàng hoang dã ở Úc đã học được cách mở thùng rác của nhà dân để tìm thức ăn thừa. Mà điều đáng ngạc nhiên là dường như, chúng học “chiêu” này của nhau, bởi ban đầu, các nhà nghiên cứu chỉ theo dõi được một con vẹt “phát minh” ra “kỹ thuật mở nắp thùng rác”, không lâu sau đó thì nhiều con vẹt ở trong vùng đã làm theo.
Bạn đã sẵn sàng cho cảm giác sợ hãi?
Chẳng ai thích đối mặt với những điều khiến mình sợ hãi cả, với các tween lại càng không. Nhưng sợ hãi cũng là một cảm giác, một trải nghiệm cần thiết với chúng mình đấy. Chẳng thế mà có hãng phim đã sản xuất phim kinh dị dành riêng cho trẻ em, cũng có những cuốn sách mang đầy sự hồi hộp khi bạn đọc.Những chuyện kỳ bí cho bầy cáo non là một cuốn sách đặc biệt như vậy. Muốn biết bầy cáo non đã trải qua những việc gì, bạn hãy đón đọc trên Thiên Thần Nhỏ số 410 + 411 phát hành ngày 11/10 nhé! 
",24.000 đ,,,,,,,,https://www.fahasa.com/thien-than-nho-so-410-411.html,,,,
9,"Vòng Quanh Thế Giới Board Game - Sách Độc Quyền Fahasa - Tặng Kèm Poster 40x60cm Idol Game + Game Vòng Quanh Thế Giới + 01 Tờ Hướng Dẫn Cắt, Gấp Xí Ngầu In Màu",https://cdn0.fahasa.com/media/catalog/product/cache/1/small_image/600x600/9df78eab33525d08d6e5fb8d27136e95/z/2/z2280714086307_de10b6aa9e8c140b6e2162e81fe5ac77.jpg,TẠP CHÍ - CATALOGUE,Báo Sinh Viên VN - Hoa Học Trò,"
Không biết chơi gì 9 ngày Tết? Khám phá ngay 20+ board game đỉnh nhất thế giới!
HHT - Những tựa game vô cùng lý thú như Ma Sói, Mèo Nổ, Monopoly, Catan… luôn khiến những cuộc “tụ tập” của teen vui nổ trời. Và Tết chính là thời điểm để teen quây quần cùng anhchị em, bạn bè đổ xí ngầu với những board game đỉnh nhất thế giới được “gói gọn” trong bộ sách + phụ kiện “Vòng quanh thế giới board game” với hơn 20 board game đỉnh nhất thế giới.
Là fan cứng của board game? Quyển sách này dành cho bạn!
Nếu đã say mê những bộ board game quyền lực, bạn chắc chắn sẽ thích thú khi tự mình “khui” bí mật làm nên những bộ game huyền thoại. Như Mèo Nổ đã làm nổ tung trang gọi vốn Kickstarter như thế nào, tại sao nói Dungeons & Dragons là “ông tổ” của tất cả video game hiện đại, Monopoly đã làm cách nào để biến một trò chơi được tạo ra để học về địa chủ trở thành board game được tiêu thụ nhiều nhất trên thế giới, hay Catan đã giúp board game trở thành ngành công nghiệp tỷ đô ra sao… 
Bạn sẽ còn nhặt được những bí kíp bá đạo để trở thành cao thủ UNO. Hay tha hồ “đàm đạo” với ông bà chú bác và “chém gió” cùng hội cạ về bộ board game Việt mang tên Đổ Xăm Hường mà ngày xưa vua Tự Đức vô cùng say mê. Đó là chưa kể, hàng loạt những cột mốc liên quan đến ngành công nghiệp board game thế giới nói chung hay cộng đồng board game Việt Nam nói riêng cũng sẽ được chia sẻ chi tiết trong sách.
Là một cuốn sách tham khảo giá trị nếu bạn quan tâm tìm hiểu về board game và ngành công nghiệp giải trí trí tuệ này.
Cuốn sách mở ra thế giới giải trí qua board game đầy lý thú
Với “Vòng quanh thế giới board game”, bạn sẽ được tìm hiểu board game là gì, vì sao nó được yêu mến khắp hành tinh này đến vậy. Và một điều đặc biệt nữa, quyển sách tặng cho bạn chuyến hành trình khám phá board game vòng quanh thế giới. Đó là những board game truyền thống từ Trung Quốc, Nhật Bản, Hàn Quốc, Ấn Độ, đến Pháp, Mỹ, châu Phi…, những bộ board game lừng lẫy quốc gia nhưng vô cùng đơn giản, dễ chơi, dễ ghiền. Và bạn hoàn toàn có thể trải nghiệm những board game này ngay trên sách. Chưa bao giờ những bộ board game cổ xưa và đặc trưng của các nước được “tề tựu” đầy đủ và hấp dẫn đến vậy. Còn chờ gì mà không khám phá ngay! 
Sau khi đã “đi đường quyền” với những game cơ bản, bạn có thể nâng trình của mình ở chương khám phá về thế giới board game hiện đại.
Tết này chưa biết chơi gì? Có tới hơn 20 board game để bạn khám phá!
Sách Board Game 108 trang trong đó 104 trang ruột (Giới thiệu 20 game đỉnh nhất thế giới - khám phá về board game, board game cho bạn đọc chơi). Tặng thêm 01 tờ Poster 40x60cm idol game + game vòng quanh thế giới - gấp cùng trong sách và 01 tờ hướng dẫn cắt + gấp xí ngầu in màu toàn bộ. 
",85.000 đ,,,,,,,,https://www.fahasa.com/vong-quanh-the-gioi-board-game.html,,,,
10,Hoa Học Trò Số 1343 - Tặng Kèm Fanbook Candy Boys + 2 Mega Poster Jung-kook Và Vương Nhất Bác,https://cdn0.fahasa.com/media/catalog/product/cache/1/small_image/600x600/9df78eab33525d08d6e5fb8d27136e95/z/2/z2080446739570_86abd6208aa9b420651c8954fe91e6e3.jpg,TẠP CHÍ - CATALOGUE,Báo Sinh Viên Việt Nam - Hoa Học Trò,"
Hoa Học Trò Số 1343 - Tặng Kèm Fanbook Candy Boys + 2 Mega Poster Jung-kook Và Vương Nhất Bác
School tour: Ghé thăm ngôi trường ""sản xuất"" thủ khoa
Ngôi trường ""tâm điểm"" trên Hoa Học Trò 1343 sẽ là nơi ""tinh hoa hội tụ"", trạm dừng chân thanh xuân của biết bao thủ khoa trong các kỳ thi tốt nghiệp THPT. Cùng xem thử trường THPT Chuyên Lê Hồng Phong Nam Định có điều gì thú vị bên trong nhé!
Nhân số học - “món mới” hot không thua kém Horoscope
Numerology có cái tên Việt hóa là Nhân Số Học. Đây là một trong các bộ môn nghiên cứu giúp người tiếp nhận có thể tự “đào sâu” mọi khía cạnh về bản thân. Nhân Số Học nhận định rằng những con số có mối quan hệ với nhau và tồn tại dưới dạng sóng rung khác nhau. Âm thanh “quen tai” từ “bà hàng xóm”, mùi hương và cả suy nghĩ thầm kín nhất tâm trí chúng mình đều có thể tạo nên sóng rung và quy đổi bằng con số tượng trưng cụ thể. Cùng tìm hiểu ý nghĩa các con số xoay quanh bạn để tìm thấy những khám phá thú vị về bản thân nhé!
Khám phá  tương lai sôi động của Digital Marketing
Bên cạnh sự phát triển của công nghệ, đại dịch cũng khiến mọi hoạt động chuyển từ nền tảng offline sang online. Đây chính là cơ hội tuyệt vời để Digital Marketing vốn đã có chỗ đứng nay lại càng vùng lên mạnh mẽ. Nhà Hoa sẽ giúp bạn giải đáp những thắc mắc mới xung quanh ngành học này trên số sau đó, đón xem nha! 
",30.000 đ,,,,,,,,https://www.fahasa.com/hoa-hoc-tro-so-1343-tang-kem-fanbook-candy-boys-2-mega-poster-jung-kook-va-vuong-nhat-bac.html,,,,
