45,,https://cdn0.fahasa.com/media/catalog/product/cache/1/small_image/600x600/9df78eab33525d08d6e5fb8d27136e95/i/m/image_190917.jpg,ĐẢNG - ĐOÀN - HỘI,NXB Lao Động,"
Nằm trong ""Tủ Sách Bác Hồ"", Cuốn sách “Tuyển Tập Thơ Văn Hồ Chí Minh”, là một tác phẩm viết về những câu chuyện của Bác Hồ với các em học sinh, sinh viên. Cuốn sách do Nhà sách Tân Việt và NXB Văn Học liên kết hợp tác phát hành. Sách được xuất bản lần đầu năm 2017 và đã được công chúng nồng nhiệt đón nhận. Cuốn sách đã trở nên thân thiết với các bạn đọc với nhiều lứa tuổi khác nhau, đặc biệt là các cháu thiếu niên. 
",72.000 đ,,,,,,,,,,,,,Tủ Sách Bác Hồ - Tuyển Tập Thơ Văn Hồ Chí Minh
46,,https://cdn0.fahasa.com/media/catalog/product/cache/1/small_image/600x600/9df78eab33525d08d6e5fb8d27136e95/i/m/image_231672.jpg,ĐẢNG - ĐOÀN - HỘI,NXB Kim Đồng,"
Không kể về những gương lớn khắp nơi đều biết, tập sách chép nhiều chuyện có thật, với những nhân vật thậm chí không rõ tên, nhằm ghi nhận đóng góp của thiếu nhi trong kháng chiến, từ Bắc tới Nam, ở bất cứ nơi đâu, tưởng như không bao giờ hết.
Với gần ba mươi câu chuyện nho nhỏ, ngắn gọn, giản dị, nhưng ý nghĩa, phản ánh tinh thần yêu nước, ý chí bất khuất kiên cường, quyết tâm học tập, chăm ngoan… Tuổi nhỏ chí cao của nhà văn Tô Hoài có thể xem là tập tư liệu quý, giúp bạn đọc hiểu thêm về truyền thống cách mạng của thiếu nhi Việt Nam trong khoảng những năm 1945 − 1950. 
",20.000 đ,,,,,,,,,,,,,Tuổi Nhỏ Chí Cao
47,,https://cdn0.fahasa.com/media/catalog/product/cache/1/small_image/600x600/9df78eab33525d08d6e5fb8d27136e95/i/m/image_195509_1_5967.jpg,ĐẢNG - ĐOÀN - HỘI,NXB Văn Học,"
Quyển sách nêu bật vai trò quan trọng của văn học, nghệ thuật trong xây dựng nhân cách con người Việt Nam, khẳng định văn hóa là nền tảng tinh thần, vừa là mục tiêu, động lực phát triển của kinh tế - xã hội. Đồng thời chia sẻ những cảm nhận, suy nghĩ về giá trị trường tồn đã làm nên bản sắc và bản lĩnh dân tộc trong suốt hành trình lịch sử ngàn năm dựng nước và giữ nước. 
",119.000 đ,,,,,,,,,,,,,Tổ Quốc Đồng Đội Và Văn Nghệ
48,,https://cdn0.fahasa.com/media/catalog/product/cache/1/small_image/600x600/9df78eab33525d08d6e5fb8d27136e95/i/m/image_195509_1_37934.jpg,ĐẢNG - ĐOÀN - HỘI,NXB Trẻ,"
Sách gồm hơn 200 câu trắc nghiệm về truyền thống Đoàn Thanh niên Cộng sản Hồ chí Minh. Sách dành cho tất cả những người yêu thích và muốn tìm hiểu về truyền thống Đoàn. Đặc biệt hữu ích cho các cơ sở Đoàn - Hội - Đội, trong hệ thống trường học để sử dụng trong các cuộc thi đố kiến thức, tìm hiểu truyền thống, thi đố vui ôn tập văn hóa, lịch sử... 
",50.000 đ,,,,,,,,,,,,,Những Câu Đố Trắc Nghiệm Về Truyền Thống Đoàn Thanh Niên Cộng Sản Hồ Chí Minh
49,,https://cdn0.fahasa.com/media/catalog/product/cache/1/small_image/600x600/9df78eab33525d08d6e5fb8d27136e95/i/m/image_231676.jpg,ĐẢNG - ĐOÀN - HỘI,NXB Kim Đồng,"
Tập sách tuyển chọn những ca khúc nổi tiếng của nhạc sĩ Phong Nhã, được nhiều thế hệ thiếu nhi yêu thích, trở thành bài hát truyền thống của phong trào Đội Thiếu niên Tiền phong Hồ Chí Minh như: Ai yêu Bác Hồ Chí Minh hơn thiếu niên nhi đồng, Nhanh bước nhanh nhi đồng, Kim Đồng, Cùng nhau ta đi lên, Đội ta lớn lên cùng đất nước, Hành khúc Đội...
Đúng như nhạc sĩ Văn Chung đã viết: ""Đó là những lời ca thiết tha yêu Bác Hồ, yêu Tổ quốc và ham say hoạt động cách mạng của lớp măng non trong những ngày đầu cách mạng. Đặc biệt bài hát Ai yêu Bác Hồ Chí Minh hơn thiếu niên nhi đồng đã để lại ấn tượng sâu sắc trong các em... Các em đã sống vui với bài ca, tiếng hát của Phong Nhã. Các em yêu quý tác giả và mãi mãi ghi nhớ công lao của anh - người đã viết cho các em rất nhiều bài hát về sinh hoạt Đội, về những anh hùng của tuổi thiếu niên...""
Vị trí đầu bảng “Nhạc sĩ của tuổi thơ” lâu nay vẫn thuộc về Phong Nhã. Nhạc sĩ Văn Chung coi ông như “Tiên chỉ” của làng ca khúc thiếu nhi. Nhạc sĩ Phạm Trọng Cầu tôn ông làm “Vua sáng tác thiếu nhi” - Nguyễn Thị Minh Châu (Báo An ninh Thủ đô).
Nhạc sĩ Phong Nhã (4.4.1924 - 28.3.2020) tên thật là Nguyễn Văn Tường, quê quán Duy Tiên, Hà Nam. Ông được Giải thưởng Nhà nước về Văn học Nghệ thuật năm 2001. 
",45.000 đ,,,,,,,,,,,,,Cùng Nhau Ta Đi Lên (Tái Bản 2021)
50,,https://cdn0.fahasa.com/media/catalog/product/cache/1/small_image/600x600/9df78eab33525d08d6e5fb8d27136e95/i/m/image_232223.jpg,ĐẢNG - ĐOÀN - HỘI,NXB Trẻ,"
Sách ""Trẻ em như búp trên cành"" tập hợp những bài viết, bài thơ, bức thư của Bác Hồ dành cho thiếu nhi. Đó là những lời khuyên dạy sâu sắc của vị lãnh tụ đối với thiếu nhi, cùng những hình ảnh minh họa Bác Hồ với thiếu nhi, thiếu nhi với Bác Hồ. Đây là tập sách cần thiết cho công tác học tập, làm theo lời Bác, chăm lo cho thiếu nhi, tương lai của đất nước. 
",60.000 đ,,,,,,,,,,,,,Di Sản Hồ Chí Minh - Trẻ Em Như Búp Trên Cành
51,,https://cdn0.fahasa.com/media/catalog/product/cache/1/small_image/600x600/9df78eab33525d08d6e5fb8d27136e95/i/m/image_232224.jpg,ĐẢNG - ĐOÀN - HỘI,NXB Trẻ,"
Quyển sách gồm những câu chuyện kể về truyền thống Đội Thiếu niên Tiền phong Hồ Chí Minh do nhà văn Phong Thu vốn từng công tác tại Hội đồng Đội Trung ương thực hiện. Sách tái bản lần X nhân kỷ niệm 80 năm thành lập Đội Thiếu niên Tiền phong Hồ Chí Minh (15-- 5- 1941_ 15-5- 2021)
Với nghệ thuật viết văn phù hợp đối tượng thiếu nhi, với tấm lòng yêu thương bạn đọc nhỏ tuổi, cùng với các sự kiện hoạt động Đội nhà văn từng hiểu biết, nên trong tác phẩm Kể chuyện truyền thống Đội Thiếu niên tiền phong Hồ Chí Minh bạn đọc nhận thấy phong cách viết gần gũi, tạo xúc động sâu sắc từ những sự kiện, nhân vật của tổ chức Đội trong tiến trình lịch sử của đất nước. Có những nhân vật từ lâu đã trở thành nhân vật lịch sử như Lý Tự Trọng, Kim Đồng, Võ Thị Sáu… cùng nhiều gương sáng thiếu nhi khác luôn cố gắng vượt qua những khó khăn để học giỏi, làm hay, tuổi nhỏ làm việc nhỏ xứng đáng là Cháu ngoan Bác Hồ trong cuộc sống đời thường. Những sự việc, con người ấy hợp lại thành truyền thống vẻ vang của Đội ta. 
",60.000 đ,,,,,,,,,,,,,Kể Chuyện Truyền Thống Đội Thiếu Niên Tiền Phong Hồ Chí Minh (Tái Bản 2021)
52,,https://cdn0.fahasa.com/media/catalog/product/cache/1/small_image/600x600/9df78eab33525d08d6e5fb8d27136e95/i/m/image_233030.jpg,ĐẢNG - ĐOÀN - HỘI,NXB Kim Đồng,"
“Biệt đội X” của Hùng, Xăm “lì”, Cưu “còi”, Nam, Bé… đã hoàn thành những nhiệm vụ rất gian khó như rải truyền đơn, đập đèn bão, thu thập thông tin và đặc biệt là xử tội tên Sồm cuộc trưởng cảnh sát.
Ông Hai cuộc trưởng cảnh sát mới về thay, khác hẳn tên Sồm ác ôn tiền nhiệm, gần gũi, thân tình với dân làng, tổ chức dạy học cho các em nhỏ, ngăn chặn mọi hành động bắt bớ, tra tấn dã man của Bảy Búa khiến Hùng và các bạn đặt một câu hỏi: ông Hai là người thế nào?
Không ai biết rằng bộ hồ sơ mật với tên “Những sư tử non” đang dần được hoàn thành…
Và đó chính là ĐỘI BIỆT ĐỘNG THIẾU NIÊN hai xã Hàm Chính, Hàm Liêm (huyện Hàm Thuận Bắc, tỉnh Bình Thuận) trong cuộc chiến chống Mỹ cứu nước. 
",40.000 đ,,,,,,,,,,,,,Những Sư Tử Non
53,,https://cdn0.fahasa.com/media/catalog/product/cache/1/small_image/600x600/9df78eab33525d08d6e5fb8d27136e95/9/7/9786045861509.jpg,ĐẢNG - ĐOÀN - HỘI,NXB Tổng Hợp TPHCM,"
Một Số Vấn Đề Cấp Bách Về Xây Dựng Đảng Hiện Nay Dưới Ánh Sáng Tư Tưởng Hồ Chí Minh
Một Số Vấn Đề Cấp Bách Về Xây Dựng Đảng Hiện Nay Dưới Ánh Sáng Tư Tưởng Hồ Chí Minh là cuốn sách chính trị cung cấp cho bạn đọc những hiểu biết cơ bản, sâu sắc một số vấn đề về Đảng trong sự nghiệp đổi mới, chỉnh đốn Đảng được tiến hành dưới ánh sáng tư tưởng Hồ Chí Minh.
Gắn với Nghị quyết Trung ương 4 khóa XI và khóa XII về tăng cường xây dựng, chỉnh đốn Đảng, cuốn sách phân tích, làm rõ những cảnh báo sớm của Hồ Chí Minh về sự suy thoái tư tưởng chính trị, đạo đức, lối sống, ""tự diễn biến"", ""tự chuyển hóa"" trong một bộ phận cán bộ, đảng viên và những giải pháp xây dựng Đảng. Hạt nhân trong tư tưởng Hồ Chí Minh về xây dựng Đảng vững mạnh là giữ vững lòng tin của dân chúng vào Đảng. Đó cũng là một trong những điều căn cốt nhất trong công tác xây dựng Đảng hiện nay.

",65.000 đ,,,,,,,,,,,,,Một Số Vấn Đề Cấp Bách Về Xây Dựng Đảng Hiện Nay Dưới Ánh Sáng Tư Tưởng Hồ Chí Minh
54,,https://cdn0.fahasa.com/media/catalog/product/cache/1/small_image/600x600/9df78eab33525d08d6e5fb8d27136e95/i/m/image_233876.jpg,ĐẢNG - ĐOÀN - HỘI,NXB Trẻ,"
Tác phẩm Bác Hồ với Chính phủ Việt Nam tập hợp nhiều sử liệu và phân tích về Hồ Chí Minh - vị kiến trúc sư trưởng của Chính phủ Việt Nam Dân chủ Cộng hòa - để lại cho chúng ta những tiền đề và bài học thiết thực trong việc xây dựng và điều hành Chính phủ kiến tạo ngày nay. 
",50.000 đ,,,,,,,,,,,,,Di Sản Hồ Chí Minh - Bác Hồ Với Chính Phủ Việt Nam
