49,Thiên Thần Nhỏ - Số 394 - Tặng Kèm Cup Holder aespa + Lịch Năm Mới 2021 Của BLACKPINK,https://cdn0.fahasa.com/media/catalog/product/cache/1/small_image/600x600/9df78eab33525d08d6e5fb8d27136e95/u/n/untitled-1_132.jpg,TẠP CHÍ - CATALOGUE,Báo Sinh Viên VN - Hoa Học Trò,"
Thiên Thần Nhỏ 394: Cứ nghĩ ăn uống dễ ẹc nhưng không phải ai cũng biết ăn đúng cách
Ăn sao cho đúng?
Nhiều bạn có thói quen vừa ăn vừa xem điện thoại hoặc tivi. Khi vừa ăn vừa suy nghĩ, não bộ của bạn sẽ không tập trung vào việc ăn vì thế bạn không có cảm giác no. Các nhà khoa học còn nghiên cứu được rằng, khi ăn không tập trung, bạn có thể ăn quá khẩu phần ăn bình thường của mình.
Ngoài việc tập trung ăn thì chúng mình nên ăn chậm và nhai thật kĩ. Ăn quá nhanh sẽ khiến cho não bộ của bạn không kiểm soát được lượng thức ăn bạn đã nạp vào người và khiến bạn có thể ăn gấp nhiều lần lượng thức ăn mà cơ thể cần. Ăn nhanh cũng làm bạn không thể nhai kỹ thức ăn làm ảnh hưởng đến hệ tiêu hóa của cơ thể.
Cải thiện trí nhớ theo cách đơn giản nhất
Chúng ta có xu hướng nhớ mọi thứ theo mức độ quan trọng của chúng. Chính vì thế mà bạn hay quên mất rằng mình để cái bút hay cục tẩy ở đâu (vì bạn thấy chúng nhỏ nhặt, không quan trọng lắm), nhưng thường sẽ nhớ rõ ngày thi (vì nó rất quan trọng).
Bởi vậy, với một thông tin nào đó cần ghi nhớ, bạn nên dành nhiều thời gian hơn một chút, nghĩ đi nghĩ lại đến nó để đảm bảo rằng não mình xác nhận thông tin đó là quan trọng, và nó sẽ được ghi vào bộ nhớ dài hạn.
Đam mê bất tận của Lisa
Khi được một fan hỏi về món quà ao ước nhất, Lisa đã kể ngay rằng cô nàng từng thích mê một chiếc máy ảnh, thậm chí đã đặt hàng rồi. Nhưng cuối cùng Lisa đành phải hủy đơn, trả hàng chỉ vì nó quá đắt. Nghe điều này, netizen vô cùng ngạc nhiên vì Lisa nay đã là idol hàng đầu, tài sản không hề nhỏ, thừa sức mua được chiếc máy ảnh dù thuộc hàng xa xỉ, ấy thế mà Lisa vẫn ""quay xe"" vì tiếc tiền. 
",20.000 đ,,,,,,,,https://www.fahasa.com/thien-than-nho-so-394-tang-kem-cup-holder-aespa-lich-nam-moi-2021-cua-blackpink.html,,,,
50,Hoa Học Trò Số 1346 - Tặng Kèm Fanbook TWICE + 2 Mega Poster Lee Do Hyun (18 Again) & Jin (BTS),https://cdn0.fahasa.com/media/catalog/product/cache/1/small_image/600x600/9df78eab33525d08d6e5fb8d27136e95/z/2/z2150964403022_130832ca29be0ce608d2369dac66142a.jpg,TẠP CHÍ - CATALOGUE,Báo Sinh Viên Việt Nam - Hoa Học Trò,"
Hoa Học Trò Số 1345 - Tặng Kèm Fanbook TWICE + 2 Mega Poster Lee Do Hyun (18 Again) & Jin (BTS)
Với phe kẹp nơ thì ""vi-ô-lông"" là một trong những thứ phiền phức nhất trên đời, làm mất tính thẩm mỹ mà còn khó chịu muôn phần. Cùng khám phá công cuộc ""diệt trừ"" những ""cánh đồng"" này để xem liệu nó có thích hợp cho teen mình không nha!
Thời đại thơ ca lên ngôi
Khi hầu hết những xu hướng, câu nói trendy, hai chương trình Rap đang ""hót hòn họt"" đều xuất phát từ thơ - vần - chơi chữ, phải chăng việc học Văn của teen mình cũng đã đến thời ""bùng nổ""? Đón xem tụi mình có thể áp dụng được những ""bí kíp"" nào để giật điểm 10 Văn ngon ơ không nhé!
Quả bom khó phá: ""Bom hàng""
Cách độ vài ba ngày, một cú ""phốt"" về hội bùng đơn, bom hàng lại được chia sẻ rần rần trên mạng xã hội. Cùng trưởng hội ""hóng"" gió ""mổ xẻ"" một chút về những con người chuyên nhận ""gạch đá"" này nha! 
",30.000 đ,,,,,,,,https://www.fahasa.com/hoa-hoc-tro-so-1346-tang-kem-fanbook-twice-2-mega-poster-lee-do-hyun-18-again-jin-bts.html,,,,
51,Hoa Học Trò Số 1321 - Tặng Kèm Fanbook K-POP GIRL POWER + MegaPoster TAEYEON & IU,https://cdn0.fahasa.com/media/catalog/product/cache/1/small_image/600x600/9df78eab33525d08d6e5fb8d27136e95/5/d/5db284810f50d-bia-1-4.jpg,TẠP CHÍ - CATALOGUE,Báo Sinh Viên VN - Hoa Học Trò,"
Hoa Học Trò Số 1321
Khép lại tháng Mười của bạn, Hoa Học Trò 1321 sẽ lên kệ vào ngày 29/10/2019 tại các sạp báo, bưu điện, nhà sách FAHASA trên toàn quốc. Cùng liệt kê những lý do bạn không thể nào thiếu số báo này trong tuần cuối tháng Mười nào!
Mùa Halloween sôi động với nhiều sự kiện hấp dẫn và các xu hướng hóa trang thu hút nhất năm, bạn teen nào cũng muốn được trải nghiệm tất cả để có mùa lễ hội rùng rợn nhưng cũng không kém phần vui vẻ. Vậy nên ""thổ địa bí ngô"" đã nhanh tay tổng hợp một loạt những điều bạn cần biết khi ""bắt sóng"" Halloween 2019, bạn chỉ cần lựa chọn điểm đến yêu thích và ""xin kẹo"" mà thôi.
Bên cạnh đó, các tin tức giải trí, thời trang mới nhất cũng gói gọn trong Hoa Học Trò 1321. Phong cách thường của sao Hàn luôn cực hợp với mùa Thu - Đông, bạn đã chọn được ""hình mẫu"" để lên đồ trong chuỗi ngày se lạnh? Phía sau sự thành công của Miu Lê là những suy nghĩ sâu sắc nhưng rất cá tính, mời bạn cùng chúng tớ ""đọc - hiểu"" công chúa nhé!
Cơn sốt truyện kinh dị tương tác và sức hút của những truyền thuyết đô thị
Xuất hiện lần đầu trên nền tảng Reddit quen thuộc, truyện tương tác kinh dị dần nhận được sự chú ý và say mê của cộng đồng mạng - những người vừa có thể là tác giả, vừa có thể là độc giả.
Mượn truyền thuyết bí ẩn của các thành phố, truyện tương tác kinh dị liên kết rất nhiều câu chuyện quen-lạ đến từ nhiều địa phương, được kể lại dưới sự thêm thắt, trải nghiệm của người viết. Hàng trăm, thậm chí hàng nghìn người truy cập vào các chủ đề kinh dị đã cho thấy truyện kinh dị tương tác đang gây ấn tượng mạnh với giới trẻ.
Quỳnh JP vs Bà Tân Vlog - Sự không khoan nhượng của cộng đồng mạng
Điệp khúc ""siêu to khổng lồ"" của Bà Tân Vlog ngày càng trở nên thiếu hấp dẫn trong bảng tin Youtube của ""các cháu"", những video triệu view chỉ còn ở mức 500-600 nghìn lượt xem và đang có dấu hiệu giảm dần. Trong khi đó, Quỳnh Trần JP - một bà nội trợ sống ở Nhật lại đang thu hút sự chú ý của khán giả cũng với các video theo chủ đề ăn uống. 
Tuy nhiên, trên đường đua sáng tạo của hội Youtuber, Quỳnh Trần JP lại được đánh giá có sức bền hơn Bà Tân Vlog khi khéo léo lồng ghép văn hóa Nhật Bản qua từng video một cách chân thật, gần gũi nhất. Điều này hoàn toàn dễ hiểu, vì cuộc đua duy trì sức nóng không dành chỗ cho những vòng lặp.
Học cách ""detox"" tinh thần cùng ""tiên nữ Tứ Xuyên"" Lý Tử Thất
Lý Tử Thất đã quá quen thuộc với giới trẻ qua những thước hình trong trẻo, yên bình của vùng thôn quê. Một cuộc sống tự làm giấy, bàn tre, tự nấu ăn từ nguyên liệu hoàn toàn ""cây nhà, lá vườn"" khiến bao người trẻ mơ mộng được tạo dựng trong video dành cho hơn 19 triệu follow-ers trên Weibo và 5 triệu subcrise-ers trên Youtube. 
Tuy nhiên, hành trình trở thành ""tiên nữ Tứ Xuyên"" của Lý Tử Thất lại không hề dễ dàng như vậy, và bạn cũng sẽ nhận ra rằng, cuộc sống thôn quê đáng ngưỡng mộ ấy được thực hiện trên rất nhiều nỗ lực. 
K-Pop Girl Power - Bộ sưu tập những ""chị đẹp"" mang nhạc cho bạn nghe
Cuốn fanbook đính kèm Hoa Học Trò 1321 không dành cho một nhóm nhạc, mà là món quà tặng những cô nàng ""chao đảo"" K-Pop - nơi các idol nam vẫn thường chiếm thế thượng phong. Họ là IU, Taeyeon, Sunmi, Chung Ha và Heize, những cái tên quen thuộc trên bảng xếp hạng âm nhạc, đề cử giải thưởng cùng các bài khen ngợi của báo chí, cộng đồng fan. Thế mạnh khác nhau, phong cách khác nhau, điểm chung của những ""chị đẹp"" mà công chúng tin tưởng là gì? Mời bạn cùng chúng tớ tìm đáp án trong cuốn fanbook K-Pop Girl Power nhé! 
",30.000 đ,,,,,,,,https://www.fahasa.com/hoa-hoc-tro-so-1321.html,,,,
52,Thiên Thần Nhỏ - Số 384 - Tặng Kèm 4 Cup Holder TWICE Và 2 Mega Poster Khổ Lớn Của BLACKPINK,https://cdn0.fahasa.com/media/catalog/product/cache/1/small_image/600x600/9df78eab33525d08d6e5fb8d27136e95/t/t/ttn384_1.jpg,TẠP CHÍ - CATALOGUE,Báo Sinh Viên VN - Hoa Học Trò,"
Thiên Thần Nhỏ - Số 384 - Tặng Kèm 4 Cup Holder TWICE Và 2 Mega Poster Khổ Lớn Của BLACKPINK
Từ khi Black Pink debut đến nay, chưa lần nào nhóm được comeback một cách hoành tráng như thế này. Chiến dịch quảng bá cho single How you like that được YG Ent thực hiện vô cùng bài bản, chuyên nghiệp khi mỗi ngày lại hé lộ một ảnh mới, một concept mới khiến fan K-Pop chỉ biết ngồi hóng. Ấy thế mà fan của Lisa vẫn chưa vui cho lắm khi phát hiện ra một chi tiết nhỏ trong loạt ảnh quảng bá đấy nhé!
Vèo một cái, đã lại đến Tháng Lịch Sự Khi Dùng Điện Thoại Di Động (Cell Phone Courtesy Month) rồi nhỉ! Bạn còn nhớ không, chính là tháng 7 hằng năm đấy! Nghe tên tháng này thì bạn đã biết rằng nó nhắc nhở và khuyến khích chúng ta xem lại những thói quen dùng điện thoại di động của mình, và nghĩ đến người khác trước khi mở điện thoại. Những phép lịch sự như không cầm điện thoại trên tay khi đang nói chuyện với người khác, tắt chuông trong những tình huống quan trọng… thì bạn có nhớ không nào?
Đại dịch COVID-19 vẫn đang khiến cả thế giới lao đao, bao nhiêu người khổ sở nhưng nó cũng mang đến một điều tích cực: Đó là Trái Đất đang dần phục hồi sau khi hàng triệu người ở nhà cách ly, hạn chế di chuyển, đi du lịch hay đi máy bay cũng giảm thiểu tối đa. Kết quả là một lỗ hổng tầng Ozone phía trên Nam Cực đang được lành lại và tạo ra những thay đổi tích cực với luồng gió trên bán cầu Nam. Việc này đã ngăn chặn rất nhiều nguy cơ và các mối đe dọa đáng lo ngại đang xảy ra trên toàn Trái Đất. 
",20.000 đ,,,,,,,,https://www.fahasa.com/thien-than-nho-so-384-tang-kem-4-cup-holder-twice-va-2-mega-poster-kho-lon-cua-blackpink.html,,,,
53,"Thiên Thần Nhỏ - Số 397 - Tặng Kèm Poster Khổ Lớn Của Khổ Lớn BTS Và 2 Móc Treo Cửa J-Hope, V",https://cdn0.fahasa.com/media/catalog/product/cache/1/small_image/600x600/9df78eab33525d08d6e5fb8d27136e95/t/t/ttn397.jpg,TẠP CHÍ - CATALOGUE,Báo Sinh Viên VN - Hoa Học Trò,"
Thiên Thần Nhỏ 397: Cùng Jungkook BTS đi tìm mẹo nhỏ hữu ích đón năm mới rực rỡ
HHT - Không thời điểm nào thích hợp để lên kế hoạch bằng những ngày đầu tiên của năm mới. Nhưng làm thế nào để đưa ra được những kế hoạch khả thi, hợp lý để bạn không bỏ cuộc giữa chừng đây?
Lên danh danh sách công việc cố định
Mỗi ngày bạn có 24 tiếng, trong đó 8 tiếng chúng mình dành cho giấc ngủ, tám tiếng khác dành cho học hành, công việc, tám tiếng còn lại cho các hoạt động cá nhân cũng như người thân của mình. Bạn cần lập ra một giới hạn về số lượng các công việc cần làm trong mỗi ngày để không rơi vào cảnh rối beng vì quá nhiều việc và cuối cùng là bỏ cuộc.
Có rất nhiều cách để lên kế hoạch cho bản thân, bạn có thể chọn giữa việc sử dụng những quyển sổ ghi chú xinh xắn hoặc phần mềm trên điện thoại hoặc máy tính để lên kế hoạch cho mình. Bạn cũng có thể sử dụng đồng thời cả hai để giúp chúng mình linh hoạt hơn trong mọi việc.
Những câu nói mang lại năm 2021 tươi đẹp
Mọi việc đều bắt đầu từ suy nghĩ của chúng ta, nên nếu bạn bắt đầu một năm mới với suy nghĩ và tinh thần tích cực thì chắc chắn bạn sẽ có một năm tốt đẹp. Chẳng hạn như nhà thiết kế thời trang Paul Smith có nói “Bạn có thể tìm thấy cảm hứng trong tất cả mọi điều. Nếu bạn không thể thì tức là bạn chưa tìm đúng cách thôi.
Thế nên bạn đừng chờ đến khi có cảm hứng mới bắt tay vào học bài, hay đọc sách, hay dọn nhà. Cảm hứng luôn nằm sẵn ở đó rồi, bạn cứ hành động đi là sẽ tìm thấy “nó” ngay.
Ai cũng có lúc trải qua những lúc khó khăn, căng thẳng, những lúc tưởng như chẳng việc gì là theo ý mình cả. Nhưng nếu bạn nhìn rộng ra một chút, thì bạn cũng sẽ thấy còn rất nhiều điều đáng quý trong cuộc sống (bố mẹ luôn ở bên bạn, bạn vẫn được đi học mỗi ngày…, ví dụ thế). Giống như câu nói “Dù mình đang trải qua điều gì vào lúc này, thì bạn biết không, cuộc sống cũng không tệ đâu”. 
",20.000 đ,,,,,,,,https://www.fahasa.com/thien-than-nho-so-397-tang-kem-poster-kho-lon-cua-kho-lon-bts-va-2-moc-treo-cua-j-hope-v.html,,,,
54,Hoa Học Trò Số 1341 - Tặng Kèm Fanbook Khổ Lớn THE9 + 2 Mega Poster BTS & Rosé (BLACKPINK),https://cdn0.fahasa.com/media/catalog/product/cache/1/small_image/600x600/9df78eab33525d08d6e5fb8d27136e95/z/2/z2035175428812_277b78265aba2cba90dbac6ee712be45_1.jpg,TẠP CHÍ - CATALOGUE,Báo Sinh Viên Việt Nam - Hoa Học Trò,"
Hoa Học Trò Số 1341 - Tặng Kèm Fanbook Khổ Lớn THE9 + 2 Mega Poster BTS & Rosé (BLACKPINK)
Hẹn hò cùng ""soái ca phòng vé""
Thử vai khi chỉ mới 17 tuổi, trở thành nhân vật chính trong bộ phim đạt giải ""Phim hay nhất"" tại Liên hoan phim quốc tế Busan lần thứ 24, còn gì hay ho mà bạn chưa biết về anh chàng này? Cùng đón xem trên Hoa Học Trò 1341 nhé, chắc chắn teen nhà mình sẽ tìm được rất nhiều cảm hứng cho con đường phía trước của mình đây!
Giảng đường Đại học liệu có chỗ để bạn ""nghỉ chân""?
Khi cảm thấy mất phương hướng về lựa chọn của mình ở giảng đường Đại học, không ít người phân vân giữa nhắm mắt đi tiếp và bảo lưu việc học để đi tìm chính mình. Bảo lưu liệu có khó, rủi ro có cao và có thực sự cần thiết? Nhà Hoa đã mời ""tiền bối"" đến để chia sẻ kinh nghiệm trên số sau rồi đây!
Longboard Dancing - ""ngôi sao"" mới trong làng thể thao đường phố
Là người anh em của skateboard, longboard dancing có gì khác biệt và thú vị mà các cô nàng đang ""mê mẩn"" đến thế? Cùng zoom vào môn thể thao đường phố ""cực nghệ"" này để khám phá thôi nào! 
",30.000 đ,,,,,,,,https://www.fahasa.com/hoa-hoc-tro-so-1341-tang-kem-fanbook-kho-lon-the9-2-mega-poster-bts-rose-blackpink.html,,,,
55,Cá Koi - Tập 6,https://cdn0.fahasa.com/media/catalog/product/cache/1/small_image/600x600/9df78eab33525d08d6e5fb8d27136e95/c/a/cakoinhat_sample_vol6_01.jpg,TẠP CHÍ - CATALOGUE,NXB Thanh Niên,"
Cá Koi - Tập 6
CÁ KOI là ấn phẩm dành riêng cho những người yêu Koi và được phát hành định kỳ 3 tháng.
Với những chuyên mục về bệnh của Koi, hồ Koi, Koi Show hay Koi Farm được cập nhật thường xuyên,
CÁ KOI VIETNAM mong muốn sẽ mang đến nhiều thông tin hữu ích đến cho Quý bạn đọc yêu Koi, giúp bạn có thể chăm sóc Koi tốt hơn & thêm hiểu biết về nền công nghiệp cá Koi đang hoạt động ở Việt Nam, thế giới.
CÁ KOI (Tập 6) gồm những mục: 
The 55th ZNA International Koi Show 
Hội thảo Nishikigoi - Kohaku lần thứ 2
Chuyên mục ""Chuyện về Koi"": ""Loài cá chép có thực sự ""hóa rồng""?""
Reiko Sakai Photo Salon
Bệnh của Koi – Ichthyobodosis
Kinh nghiệm thi công: ""Bí kíp thi công hồ Koi bất bại""
Trang trại và cửa hàng
Chuyên mục ""Tôi yêu Nishikigoi"" 
Hỏi đáp về cách nuôi dưỡng 
Koi Basic Information
CÁ KOI là một phiên bản của Gekkan Nishikigoi - quyển tạp chí về Koi được nhiều độc giả trong và ngoài nước Nhật yêu thích hiện đã có mặt tại Việt Nam.
Mời Quý độc giả đón đọc.  
",165.000 đ,,,,,,,,https://www.fahasa.com/ca-koi-tap-6.html,,,,
56,Hoa Học Trò Số 1340 - Tặng Kèm Fanbook Taylor Swift + 2 Mega Poster SEVENTEEN & Jisoo (BLACKPINK),https://cdn0.fahasa.com/media/catalog/product/cache/1/small_image/600x600/9df78eab33525d08d6e5fb8d27136e95/b/_/b_a-1340-1.jpg,TẠP CHÍ - CATALOGUE,Báo Sinh Viên Việt Nam - Hoa Học Trò,"
Hoa Học Trò Số 1339 - Tặng Kèm Fanbook Taylor Swift + 2 Mega Poster SEVENTEEN & Jisoo (BLACKPINK)
Thích thì thính, không thích... vẫn thính!
Nếu lúc nào mọi thứ cũng rạch ròi giữa “thính” và “bả” thì thế giới đã bình yên. Thế nhưng có rất nhiều tay thả thính nghiệp dư, có gia tài là một bụng thính chất lượng nhưng mỗi lần thả chỉ khiến ""con mồi"" muốn né xa vạn dặm. Liệu bạn có phải là một trong những ""thành viên"" của Nhọ Hội này không?
Ngắm nhìn thế giới qua đôi mắt của ""hotboy khung ảnh""
Là người gác giấc mơ ở nước Nga xa xôi sang một bên, trở về Sài Gòn để đuổi theo vẻ đẹp ""mềm tim"" của cuộc sống nơi này và gói gọn tất cả vào những tấm ảnh, chàng trai thanh xuân trên Hoa Học Trò 1340 sẽ đưa bạn vào thế giới của niềm đam mê nhiếp ảnh và đôi mắt hút hồn của mình. Bạn đã sẵn sàng chưa?
“Thần chú” chữa lành từ những câu chuyện của người lạ
Giữa mạng xã hội “phốt” và drama ngập trời, vẫn có một “ngôi nhà” với hơn 200.000 thành viên hàng ngày đong đầy Facebook bằng những điều tử tế và đáng yêu. Ở đây, dù bạn có là ai, dù bạn có thường xuyên chia sẻ trên mạng hay không, bạn vẫn luôn muốn mở lòng và tặng mọi người một “bát cháo hành” thật ấm áp. Tìm hiểu thêm về “chiếc tổ” bé xinh này trên HHT 1340 nhé! 
",30.000 đ,,,,,,,,https://www.fahasa.com/hoa-hoc-tro-so-1340-tang-kem-fanbook-taylor-swift-2-mega-poster-seventeen-jisoo-blackpink.html,,,,
57,Cá Koi - Tập 5,https://cdn0.fahasa.com/media/catalog/product/cache/1/small_image/600x600/9df78eab33525d08d6e5fb8d27136e95/i/m/image_244104.jpg,TẠP CHÍ - CATALOGUE,NXB Thanh Niên,"
CÁ KOI là ấn phẩm chuyên đề cung cấp thông tin về Koi phát hành định kỳ 3 tháng với mong muốn cung cấp thông tin ở Nhật Bản, Việt Nam và ở những quốc gia khác.
CÁ KOI là một phiên bản Việt của Gekkan Nishikigoi - quyển tạp chí về Koi được nhiều độc giả trong và ngoài nước Nhật yêu thích hiện đã có mặt tại Việt Nam với mong muốn góp phần nào vào văn hóa Nishikigoi cũng như mang đến những thông tin mà Fan Koi Việt Nam khó nắm bắt được.
Với những thông tin như chuyên mục về bệnh của Koi, cuộc thi Koi, ao Koi hay những trại Koi,... được cập nhật, CÁ KOI sẽ làm hài lòng Quý bạn đọc.
CÁ KOI (Tập 5) gồm những mục:
The 51th All Japan Combined Nishikigoi Show
Hội thảo Nishikigoi - Showa Sanshoku lần 2
Chuyên mục ""Tôi yêu Nishikigoi"": ""Mục đáng chú ý - Tạo môi trường sống tốt cho Koi""
Reiko Sakai Photo Salon
Bệnh của Koi – Trichodinosis
Hỏi đáp về cách nuôi dưỡng
Koi Basic Information
CÁ KOI là một phiên bản của Gekkan Nishikigoi - quyển tạp chí về Koi được nhiều độc giả trong và ngoài nước Nhật yêu thích hiện đã có mặt tại Việt Nam. 
",165.000 đ,,,,,,,,https://www.fahasa.com/ca-koi-tap-5.html,,,,
58,Hoa Học Trò 1299 - Những Đóa Hoa Nở Rộ Ngày Con Gái,https://cdn0.fahasa.com/media/catalog/product/cache/1/small_image/600x600/9df78eab33525d08d6e5fb8d27136e95/i/m/img_4456.jpg,TẠP CHÍ - CATALOGUE,Báo Sinh Viên Việt Nam - Hoa Học Trò,"
Hoa Học Trò 1299 - Những Đóa Hoa Nở Rộ Ngày Con Gái
Dù mạnh mẽ hay bánh bèo, dù gầy nhom hay múp míp, dù có ""gấu"" hay đang ""ế chỏng chơ"", con gái vẫn luôn là một điều tuyệt vời của thế giới. Chính vì thế, HHT số đặc biệt 1299 chào mừng ngày 8/3 sẽ là một đóa hoa rực rỡ dành riêng tặng hội chị em bạn dì.
Đặc khu ""con gái hội""
Con gái là những sinh vật dễ dàng dính lấy nhau nhất trên đời, có khi chỉ bằng một mẩu chuyện nhỏ xíu. Tuy nhiên, HHT 1299 sẽ mách bạn thêm hàng loạt bí kíp để thắt chặt tình bạn với hội chị em - từ những món quà xinh xắn, những bữa tiệc không-có-con-trai cho đến cách bắt tay nhau ""cá kiếm"" từ một cửa hàng handmade đậm chất ""bánh bèo"".
Song song đó, ""Quán cà phê tuổi trẻ"" cũng sẽ mang đến bạn cuộc gặp với những nữ chính ""xịn xò"" - tung tích sẽ được ""ẩn giấu"" cho đến phút cuối nhưng chắc chắn sẽ không làm bạn thất vọng về độ ""cool"" đâu nha!
Những cô giáo được bình chọn ""cool ngầu "" cũng sẽ ""lên sóng"" trên số sau, đón xem bạn nhé!
Những cực nam châm trái dấu
8/3 là ngày để thể hiện sự trân trọng đối với phái nữ, không vì thế mà làm ""lép vế"" hội ""đầu đinh"". Từ crush - chàng trai không biến sắc - cho đến thằng bạn thân - nhân vật mà ai cũng nghi ngờ sự ""trong sạch"" khi chơi cùng con gái đều sẽ xuất hiện và mang đến những khám phá thú vị. Cẩm nang để đối phó với những ""thất thường"" của con trai theo cách vô cùng con gái cũng sẽ được ""bật mí"" đó nha!
Những món quà cho thanh xuân con gái nở hoa
""20 chàng trai của thanh xuân"" - Phụ kiện đính kèm xứng đáng là món quà đáng nhớ trong tháng xinh đẹp này. Những cái tên như mà bạn đang nghĩ đến trong đầu biết đâu sẽ có với bạn một cuộc gặp bất ngờ trên HHT 1299. Sẵn sàng ""vỡ òa"" trong niềm sung sướng nha! 
",30.000 đ,,,,,,,,https://www.fahasa.com/hoa-hoc-tro-1299-nhung-doa-hoa-no-ro-ngay-con-gai.html,,,,
