20,Binh Pháp Cưa Trai,https://cdn0.fahasa.com/media/catalog/product/cache/1/small_image/600x600/9df78eab33525d08d6e5fb8d27136e95/b/i/bia_ngoai.jpg,TẠP CHÍ - CATALOGUE,Hoa Học Trò,"
Binh Pháp Cưa Trai
NÀY CÔ GÁI, BẠN ĐÃ BIẾT BÍ KÍP ĐỂ TRỞ THÀNH  “CHÂN ÁI” CỦA MỌI CHÀNG TRAI CHƯA?
Đừng tốn công cưa cẩm bất cứ chàng trai nào, bởi nếu họ có hứng thú với bạn, họ sẽ là người chủ động tấn công. Không phải cố thay chàng làm mèo Tom, vô ích.
Muốn cưa đổ một anh trai nào đó thì một là phải trông ngon, hai là phải biết nấu món ngon cho chàng ăn! 
Con trai dứt tình nhanh lắm, nhất là mấy gã trai hư ấy, có bao giờ yêu đương tử tế đâu!
…
Nào, những câu “định nghĩa” về đàn ông này nghe quen không? Và bao lâu nay biết bao nhiêu nàng vẫn coi những “luật bất thành văn” này là điều đương nhiên đúng về tụi con trai nên cứ hồn nhiên áp dụng để rồi bị hết anh này đến anh khác từ chối cho sấp mặt.
Con trai dễ “đọc vị”, bởi các chàng dù bao nhiêu tuổi cũng chỉ là một cậu nhóc to xác ư? Nhầm to rồi! Nhưng ai bảo thanh xuân là thời điểm đẹp nhất để yêu cơ chứ! Nên dù có khó khăn, thử thách, thì bất cứ cô nàng nào cũng đã từng ít nhất một lần mơ mộng mình sẽ có thể biến “anh trai mưa” thành “anh người yêu” hay thoát khỏi kiếp muôn đời bị friendzoned bởi bạch mã hoàng tử của mình.
Liệu đó có phải là nhiệm vụ bất khả thi không? Hoàn toàn không. Nhất là khi bạn có trong tay thứ vũ khí bí mật, là cuốn đặc san Binh pháp cưa trai! Tình trường cũng như chiến trường, để không phải đổ máu vì những pha “vỡ tim” ngoài kiểm soát, bạn cần phải trang bị cho mình đủ vũ khí và cả áo giáp, để có thể “mặt dày” chủ động cầm cưa, để có thể “đọc vị” bất cứ anh chàng nào như đọc một cuốn sách mở, hay có thể đo ngay được độ chung thủy, độ lăng nhăng của chàng dù chỉ mới biết đúng ngày sinh nhật của anh ấy!
Còn chờ gì mà không nhanh tay đăng kí để có thể trở thành cô nàng “vạn chàng mê” từ ngay hôm nay? 
",75.000 đ,,,,,,,,https://www.fahasa.com/binh-phap-cua-trai.html,,,,
21,Hoa Học Trò Số 1341 - Tặng Kèm Fanbook Khổ Lớn THE9 + 2 Mega Poster BTS & Rosé (BLACKPINK),https://cdn0.fahasa.com/media/catalog/product/cache/1/small_image/600x600/9df78eab33525d08d6e5fb8d27136e95/z/2/z2035175428812_277b78265aba2cba90dbac6ee712be45_1.jpg,TẠP CHÍ - CATALOGUE,Báo Sinh Viên Việt Nam - Hoa Học Trò,"
Hoa Học Trò Số 1341 - Tặng Kèm Fanbook Khổ Lớn THE9 + 2 Mega Poster BTS & Rosé (BLACKPINK)
Hẹn hò cùng ""soái ca phòng vé""
Thử vai khi chỉ mới 17 tuổi, trở thành nhân vật chính trong bộ phim đạt giải ""Phim hay nhất"" tại Liên hoan phim quốc tế Busan lần thứ 24, còn gì hay ho mà bạn chưa biết về anh chàng này? Cùng đón xem trên Hoa Học Trò 1341 nhé, chắc chắn teen nhà mình sẽ tìm được rất nhiều cảm hứng cho con đường phía trước của mình đây!
Giảng đường Đại học liệu có chỗ để bạn ""nghỉ chân""?
Khi cảm thấy mất phương hướng về lựa chọn của mình ở giảng đường Đại học, không ít người phân vân giữa nhắm mắt đi tiếp và bảo lưu việc học để đi tìm chính mình. Bảo lưu liệu có khó, rủi ro có cao và có thực sự cần thiết? Nhà Hoa đã mời ""tiền bối"" đến để chia sẻ kinh nghiệm trên số sau rồi đây!
Longboard Dancing - ""ngôi sao"" mới trong làng thể thao đường phố
Là người anh em của skateboard, longboard dancing có gì khác biệt và thú vị mà các cô nàng đang ""mê mẩn"" đến thế? Cùng zoom vào môn thể thao đường phố ""cực nghệ"" này để khám phá thôi nào! 
",30.000 đ,,,,,,,,https://www.fahasa.com/hoa-hoc-tro-so-1341-tang-kem-fanbook-kho-lon-the9-2-mega-poster-bts-rose-blackpink.html,,,,
22,Cá Koi - Tập 6,https://cdn0.fahasa.com/media/catalog/product/cache/1/small_image/600x600/9df78eab33525d08d6e5fb8d27136e95/c/a/cakoinhat_sample_vol6_01.jpg,TẠP CHÍ - CATALOGUE,NXB Thanh Niên,"
Cá Koi - Tập 6
CÁ KOI là ấn phẩm dành riêng cho những người yêu Koi và được phát hành định kỳ 3 tháng.
Với những chuyên mục về bệnh của Koi, hồ Koi, Koi Show hay Koi Farm được cập nhật thường xuyên,
CÁ KOI VIETNAM mong muốn sẽ mang đến nhiều thông tin hữu ích đến cho Quý bạn đọc yêu Koi, giúp bạn có thể chăm sóc Koi tốt hơn & thêm hiểu biết về nền công nghiệp cá Koi đang hoạt động ở Việt Nam, thế giới.
CÁ KOI (Tập 6) gồm những mục: 
The 55th ZNA International Koi Show 
Hội thảo Nishikigoi - Kohaku lần thứ 2
Chuyên mục ""Chuyện về Koi"": ""Loài cá chép có thực sự ""hóa rồng""?""
Reiko Sakai Photo Salon
Bệnh của Koi – Ichthyobodosis
Kinh nghiệm thi công: ""Bí kíp thi công hồ Koi bất bại""
Trang trại và cửa hàng
Chuyên mục ""Tôi yêu Nishikigoi"" 
Hỏi đáp về cách nuôi dưỡng 
Koi Basic Information
CÁ KOI là một phiên bản của Gekkan Nishikigoi - quyển tạp chí về Koi được nhiều độc giả trong và ngoài nước Nhật yêu thích hiện đã có mặt tại Việt Nam.
Mời Quý độc giả đón đọc.  
",165.000 đ,,,,,,,,https://www.fahasa.com/ca-koi-tap-6.html,,,,
23,"Vòng Quanh Thế Giới Board Game - Sách Độc Quyền Fahasa - Tặng Kèm Poster 40x60cm Idol Game + Game Vòng Quanh Thế Giới + 01 Tờ Hướng Dẫn Cắt, Gấp Xí Ngầu In Màu",https://cdn0.fahasa.com/media/catalog/product/cache/1/small_image/600x600/9df78eab33525d08d6e5fb8d27136e95/z/2/z2280714086307_de10b6aa9e8c140b6e2162e81fe5ac77.jpg,TẠP CHÍ - CATALOGUE,Báo Sinh Viên VN - Hoa Học Trò,"
Không biết chơi gì 9 ngày Tết? Khám phá ngay 20+ board game đỉnh nhất thế giới!
HHT - Những tựa game vô cùng lý thú như Ma Sói, Mèo Nổ, Monopoly, Catan… luôn khiến những cuộc “tụ tập” của teen vui nổ trời. Và Tết chính là thời điểm để teen quây quần cùng anhchị em, bạn bè đổ xí ngầu với những board game đỉnh nhất thế giới được “gói gọn” trong bộ sách + phụ kiện “Vòng quanh thế giới board game” với hơn 20 board game đỉnh nhất thế giới.
Là fan cứng của board game? Quyển sách này dành cho bạn!
Nếu đã say mê những bộ board game quyền lực, bạn chắc chắn sẽ thích thú khi tự mình “khui” bí mật làm nên những bộ game huyền thoại. Như Mèo Nổ đã làm nổ tung trang gọi vốn Kickstarter như thế nào, tại sao nói Dungeons & Dragons là “ông tổ” của tất cả video game hiện đại, Monopoly đã làm cách nào để biến một trò chơi được tạo ra để học về địa chủ trở thành board game được tiêu thụ nhiều nhất trên thế giới, hay Catan đã giúp board game trở thành ngành công nghiệp tỷ đô ra sao… 
Bạn sẽ còn nhặt được những bí kíp bá đạo để trở thành cao thủ UNO. Hay tha hồ “đàm đạo” với ông bà chú bác và “chém gió” cùng hội cạ về bộ board game Việt mang tên Đổ Xăm Hường mà ngày xưa vua Tự Đức vô cùng say mê. Đó là chưa kể, hàng loạt những cột mốc liên quan đến ngành công nghiệp board game thế giới nói chung hay cộng đồng board game Việt Nam nói riêng cũng sẽ được chia sẻ chi tiết trong sách.
Là một cuốn sách tham khảo giá trị nếu bạn quan tâm tìm hiểu về board game và ngành công nghiệp giải trí trí tuệ này.
Cuốn sách mở ra thế giới giải trí qua board game đầy lý thú
Với “Vòng quanh thế giới board game”, bạn sẽ được tìm hiểu board game là gì, vì sao nó được yêu mến khắp hành tinh này đến vậy. Và một điều đặc biệt nữa, quyển sách tặng cho bạn chuyến hành trình khám phá board game vòng quanh thế giới. Đó là những board game truyền thống từ Trung Quốc, Nhật Bản, Hàn Quốc, Ấn Độ, đến Pháp, Mỹ, châu Phi…, những bộ board game lừng lẫy quốc gia nhưng vô cùng đơn giản, dễ chơi, dễ ghiền. Và bạn hoàn toàn có thể trải nghiệm những board game này ngay trên sách. Chưa bao giờ những bộ board game cổ xưa và đặc trưng của các nước được “tề tựu” đầy đủ và hấp dẫn đến vậy. Còn chờ gì mà không khám phá ngay! 
Sau khi đã “đi đường quyền” với những game cơ bản, bạn có thể nâng trình của mình ở chương khám phá về thế giới board game hiện đại.
Tết này chưa biết chơi gì? Có tới hơn 20 board game để bạn khám phá!
Sách Board Game 108 trang trong đó 104 trang ruột (Giới thiệu 20 game đỉnh nhất thế giới - khám phá về board game, board game cho bạn đọc chơi). Tặng thêm 01 tờ Poster 40x60cm idol game + game vòng quanh thế giới - gấp cùng trong sách và 01 tờ hướng dẫn cắt + gấp xí ngầu in màu toàn bộ. 
",85.000 đ,,,,,,,,https://www.fahasa.com/vong-quanh-the-gioi-board-game.html,,,,
24,Hoa Học Trò Số 1353 - Tặng Kèm Fanbook Horoscope Idol Aquarius + 2 Mega Poster J-Hope (BTS) & Rosé (BLACKPINK),https://cdn0.fahasa.com/media/catalog/product/cache/1/small_image/600x600/9df78eab33525d08d6e5fb8d27136e95/z/2/z2298380990699_e7a4ad08a13c252e45870e79274542e6.jpg,TẠP CHÍ - CATALOGUE,Báo Sinh Viên Việt Nam - Hoa Học Trò,"
Hoa Học Trò 1353: Nạp cảm hứng cho Tết Trâu Vàng, tặng kèm fanbook Horoscope Idol Aquarius
HHT - Không khí Tết đã rộn ràng, những “đường hoa” bắt đầu bừng sắc. Hãy cùng Hoa Học Trò 1353 nạp đầy cảm hứng, chuẩn bị cho mùa lễ hội tưng bừng bạn nhé!
Giáo sư ""quần đùi"": Bài học chuyển động cho thời đại mới
Nếu bạn đang là một thành viên của hội ""chán đời"", chẳng thể tìm thấy động lực hay niềm yêu thích ở điều gì để “nhấn ga” phát triển mạnh mẽ hơn cho năm mới này, hãy gặp gỡ giáo sư “quần đùi” - thầy Trương Nguyện Thành để “rinh” về các bí kíp xịn sò từ thầy, tìm ra “máy kích hoạt năng lượng” của mình và học cách biến mơ ước thành hành động trên số báo Hoa Học Trò 1353.
Có những ngày nghe nhạc thật khác
Acoustic thì chẳng còn gì xa lạ với teen nhưng vừa nghe nhạc vừa ngắm hoàng hôn ở ngoài trời trong cái se se lạnh của Đà Lạt lại là một trải nghiệm vô cùng mới mẻ. Chuyến xách ba lô lên vùng cao để tận hưởng tiếng nhạc du dương như thế liệu có đáng? Cùng đón xem trên Hoa Học Trò 1353 nha!
Tìm gà bông: Đi tiếp hay Dừng lại?
Trên hành trình đi tìm gà bông của mình, sẽ có không ít lần bạn thấy say nắng một ai đó. Nhưng đây cũng là lúc bạn tự hỏi liêu xiêu như thế đã đủ để mình ""dừng cuộc tìm kiếm"" hoặc làm sao để biết đây chính là Mr. Right của mình? Nhà Hoa sẽ cho bạn câu trả lời trên số báo sau đó! 
",30.000 đ,,,,,,,,https://www.fahasa.com/hoa-hoc-tro-so-1353-tang-kem-fanbook-horoscope-idol-aquarius-2-mega-poster-j-hope-bts-rose-blackpink.html,,,,
25,Hoa Học Trò Số 1360 - Tặng Kèm Fanbook Visual of Visual + Idol Poster Jin (BTS) và Jisoo (BLACKPINK),https://cdn0.fahasa.com/media/catalog/product/cache/1/small_image/600x600/9df78eab33525d08d6e5fb8d27136e95/z/2/z2490365749017_0db859e65686add5d3aae694d0d56e12.jpg,TẠP CHÍ - CATALOGUE,Báo Sinh Viên Việt Nam - Hoa Học Trò,"
Mùa Hè đã cận kề, bạn có Hoa Học Trò 1360 tặng kèm fanbook Visual chưa?
HHT - Miền Bắc và miền Trung đã bắt đầu có những đợt nắng gắt còn miền Nam đã vào mùa mưa với những cơn mưa bất chợt. Và luôn luôn, Hoa Học Trò 1360 đồng hành với bạn đi qua những ngày mưa nắng đỏng đảnh để khám phá những cơ hội trải nghiệm, học tập thú vị!
Rich kid có có gì ngoài hàng hiệu?
Nếu nghĩ rằng ""sống trong nhung lụa"", ""có gia đình chống lưng"" là sở trường của ""rich kid"" thì bạn lầm to rồi nhé! Trải lòng của một cô bạn “rich kid” tài năng đang hot hòn họt trên mạng xã hội trên số báo sau sẽ xoá tan định kiến ""trông nhà mà bắt hình dong"" của nhiều người. Hãy đón xem nhé!
“Lời lỗ” sau 10 ngày đi hết miền Trung
Điên rồ và đáng yêu - chuyên mục đốn tim lẫn chạm dây thần kinh cười của teen mình sẽ trở lại với chuyến thực tập làm hướng dẫn viên nhiều ""thăng trầm"" tại miền Trung. Đừng bỏ lỡ liệu pháp ""giải nhiệt"" mùa Hè này nhé!
Học song ngành có ""ngầu"" như bạn nghĩ?
Phân vân giữa hai ngành yêu thích hay đơn giản là muốn bổ trợ kiến thức nhiều hơn trên giảng đường đại học, nhiều teen tần ngần đứng trước việc học song ngành. Hoa Học Trò 1360 sẽ giải đáp cho bạn những câu hỏi về hình thức mới lạ này, sẵn sàng hành trang rời ghế cấp Ba bạn nhé! 
",30.000 đ,,,,,,,,https://www.fahasa.com/hoa-hoc-tro-so-1360-tang-kem-fanbook-visual-of-visual-idol-poster-jin-bts-va-jisoo-blackpink.html,,,,
26,Hoa Học Trò Số 1368,https://cdn0.fahasa.com/media/catalog/product/cache/1/small_image/600x600/9df78eab33525d08d6e5fb8d27136e95/u/n/untitledhht-1368.jpg,TẠP CHÍ - CATALOGUE,Báo Sinh Viên Việt Nam - Hoa Học Trò,"
HHT - Hoa Học Trò 1368 sẽ là một tia nắng, một chút niềm vui thêm vào một tuần mới nhiều năng lượng của bạn!
Mùa thi tốt nghiệp THPT và tuyển sinh đại học 2022 sẽ có những thay đổi gì?
Dịch COVID-19 và việc chuyển từ học trực tiếp sang online đã ảnh hưởng rất nhiều đến kỳ thi tốt nghiệp THPT và các phương án tuyển sinh ĐH, CĐ 2 năm qua. Trong khi nhiều sĩ tử gặp khó khăn như điểm thi tốt nghiệp cao vẫn không trúng tuyển Đại học thì cũng có những teen đã tận dụng tốt những thay đổi này, biến thành cơ hội cho mình. Chuyên đề phân tích về xu hướng thay đổi trong thi và xét tuyển cùng kinh nghiệm từ những “tiền bối” đã “hoá rồng” thành công trên số báo tới sẽ giúp bạn tự tin hơn để sẵn sàng đối mặt với thử thách lớn này!
Vượt ""chốt chặn"" tình yêu theo kiểu Squid Game
Mùa giãn cách, khi tình iu gà bông bỗng đầy rẫy “chốt chặn” thử thách và đường đến trái tim nhau trở thành hành trình sinh tồn như trong phim Trò Chơi Con Mực (Squid Game), phải làm sao để mối quan hệ của cả hai “sống sót” qua đại dịch từ “virus tan vỡ” này?
Bản địa hóa - nghề hot chưa nhiều người khám phá
Bản địa hóa là “người hùng thầm lặng” ở sau tính năng phụ đề của Netflix hay sự xuất hiện của chương trình Rap Việt từ bản gốc The Rapper (Thái Lan). Cùng là anh em với nghề phiên dịch viên nhưng lĩnh vực bản địa hóa “đa-zi-năng” hơn nhiều, cụ thể như thế nào thì cùng tìm hiểu với nhà Hoa nhé!
Gương mặt trang bìa: Thanh Sơn (11 Tháng 5 Ngày)
Sở hữu loạt vai diễn ấn tượng trong các “phim giờ vàng” trên VTV, Thanh Sơn được đông đảo khán giả yêu mến. Tuy nhiên, nam diễn viên tiết lộ bản thân không tự tin về ngoại hình của mình, lý do là gì? 
",20.000 đ,,,,,,,,https://www.fahasa.com/hoa-hoc-tro-so-1368.html,,,,
27,Hoa Học Trò 1299 - Những Đóa Hoa Nở Rộ Ngày Con Gái,https://cdn0.fahasa.com/media/catalog/product/cache/1/small_image/600x600/9df78eab33525d08d6e5fb8d27136e95/i/m/img_4456.jpg,TẠP CHÍ - CATALOGUE,Báo Sinh Viên Việt Nam - Hoa Học Trò,"
Hoa Học Trò 1299 - Những Đóa Hoa Nở Rộ Ngày Con Gái
Dù mạnh mẽ hay bánh bèo, dù gầy nhom hay múp míp, dù có ""gấu"" hay đang ""ế chỏng chơ"", con gái vẫn luôn là một điều tuyệt vời của thế giới. Chính vì thế, HHT số đặc biệt 1299 chào mừng ngày 8/3 sẽ là một đóa hoa rực rỡ dành riêng tặng hội chị em bạn dì.
Đặc khu ""con gái hội""
Con gái là những sinh vật dễ dàng dính lấy nhau nhất trên đời, có khi chỉ bằng một mẩu chuyện nhỏ xíu. Tuy nhiên, HHT 1299 sẽ mách bạn thêm hàng loạt bí kíp để thắt chặt tình bạn với hội chị em - từ những món quà xinh xắn, những bữa tiệc không-có-con-trai cho đến cách bắt tay nhau ""cá kiếm"" từ một cửa hàng handmade đậm chất ""bánh bèo"".
Song song đó, ""Quán cà phê tuổi trẻ"" cũng sẽ mang đến bạn cuộc gặp với những nữ chính ""xịn xò"" - tung tích sẽ được ""ẩn giấu"" cho đến phút cuối nhưng chắc chắn sẽ không làm bạn thất vọng về độ ""cool"" đâu nha!
Những cô giáo được bình chọn ""cool ngầu "" cũng sẽ ""lên sóng"" trên số sau, đón xem bạn nhé!
Những cực nam châm trái dấu
8/3 là ngày để thể hiện sự trân trọng đối với phái nữ, không vì thế mà làm ""lép vế"" hội ""đầu đinh"". Từ crush - chàng trai không biến sắc - cho đến thằng bạn thân - nhân vật mà ai cũng nghi ngờ sự ""trong sạch"" khi chơi cùng con gái đều sẽ xuất hiện và mang đến những khám phá thú vị. Cẩm nang để đối phó với những ""thất thường"" của con trai theo cách vô cùng con gái cũng sẽ được ""bật mí"" đó nha!
Những món quà cho thanh xuân con gái nở hoa
""20 chàng trai của thanh xuân"" - Phụ kiện đính kèm xứng đáng là món quà đáng nhớ trong tháng xinh đẹp này. Những cái tên như mà bạn đang nghĩ đến trong đầu biết đâu sẽ có với bạn một cuộc gặp bất ngờ trên HHT 1299. Sẵn sàng ""vỡ òa"" trong niềm sung sướng nha! 
",30.000 đ,,,,,,,,https://www.fahasa.com/hoa-hoc-tro-1299-nhung-doa-hoa-no-ro-ngay-con-gai.html,,,,
28,"Thiên Thần Nhỏ - Số 404 - Tặng Kèm Poster Khổ Lớn SHINEE, BTS Và Board Game TWICE",https://cdn0.fahasa.com/media/catalog/product/cache/1/small_image/600x600/9df78eab33525d08d6e5fb8d27136e95/t/t/ttn404.jpg,TẠP CHÍ - CATALOGUE,Báo Sinh Viên VN - Hoa Học Trò,"
Thiên Thần Nhỏ 404: Bạn có biết đôi bàn tay mình kỳ diệu đến thế nào chưa?
HHT - Hóa ra đôi bàn tay quen thuộc có thể tạo ra rất nhiều phép màu, chỉ là bạn có biết cách hay không mà thôi.
Nhìn bàn tay biết ngày tháng
Mỗi tháng có số ngày thường không giống nhau, vì thể để nhớ được chính xác thì rất khó khăn. Nhưng chỉ cần nhìn vào 2 bàn tay là bạn có thể biết được gần như chính xác số ngày của một tháng.
Đầu tiên, bạn nắm hai bàn tay lại và để hai bàn tay sát lại với nhau. Khi nắm tay lại, mỗi bàn tay chúng mình sẽ tạo thành những phần lồi, lõm xem kẽ nhau và Thiên Thần Nhỏ 404 sẽ mách bạn cách đọc ngày tháng từ chúng.
Dự báo thời tiết có gì thú vị?
Bây giờ, nếu bạn muốn biết thời tiết của ngày mai thì có thể mở ứng dụng dự báo thời tiết trên điện thoại, hoặc xem trên TV. Nhưng ngày xưa, khi chưa có công nghệ và các thiết bị cần thiết, thì con người chỉ cần quan sát xung quanh, chú ý đến những tín hiệu của thiên nhiên là cũng có thể dự báo được đấy. Mà những người như thủy thủ, nông dân, người chăn cừu… lại dự đoán cực kỳ chính xác nhé.
Những đám mây là thứ mà người xưa rất tin tưởng trong việc dự báo thời tiết, cả thời tiết tốt lẫn thời tiết xấu. Những đám mây vảy rồng có dạng như những chiếc túi nhỏ lồng phồng, thường sẽ biến thành giông bão. Những đám mây ti trông như những dải mỏng, như những sợi dây hay túm tóc, thường có nghĩa là sắp có mưa hoặc bão.
Còn những đám mây trung tích trông như vảy cá thường báo hiệu mưa sẽ đến trong vòng một ngày tới. Các thủy thủ ngày xưa rất chú ý đến những đám mây kiểu này. 
",20.000 đ,,,,,,,,https://www.fahasa.com/thien-than-nho-so-404-tang-kem-poster-kho-lon-shinee-bts-va-board-game-twice.html,,,,
29,Hoa Học Trò Số Số 1331,https://cdn0.fahasa.com/media/catalog/product/cache/1/small_image/600x600/9df78eab33525d08d6e5fb8d27136e95/c/8/c8ddc46a6d42961ccf53.jpg,TẠP CHÍ - CATALOGUE,Báo Sinh Viên VN - Hoa Học Trò,"
Hoa Học Trò Số Số 1331
Hoa Học Trò 1331 đem đến cho các bạn ti tỉ câu chuyện vui nhộn cùng những xu hướng “sốt dẻo” nhất cho tuần mới thật năng động. Bảo đảm đọc báo vui như được gặp crush!
Nếu Itaewon Class là một trường học
Sức hút của bộ phim hot nhất hiện nay - Itaewon Class nằm ở kịch bản hấp dẫn cùng những nhân vật với tính cách đặc trưng và rất thực tế. Lấy cảm hứng từ bộ phim, một Itaewon Class phiên bản “học đường” được ra đời với nhiều câu chuyện thú vị chờ đón bạn khám phá trên số báo Hoa Học Trò 1331.
Fan của Itaewon Class bhắc chắn không nên bỏ qua số báo này vì vô vàn những bài viết tuôn tràn cảm hứng từ bộ phim sẽ dành cho bạn một cẩm nang vô cùng đặc biệt.
Mách công thức tạo kỷ yếu “triệu like” từ A đến Z
Để sở hữu bộ ảnh kỷ yếu “để đời”, không ít tập thể lớp đã có những bài học “nhớ đời” không đáng có. Bài viết hứa hẹn sẽ cung cấp cho teen tất-tần-tật bí kíp lẫn kinh nghiệm “xương máu” của các tiền bối từ khâu lên ý tưởng, tìm concept cho đến giai đoạn bắt tay thực hiện, cân đối chi phí… “Lời nguyền” bộ ảnh chia cắt tình bạn sẽ được “hóa giải”! 
",30.000 đ,,,,,,,,https://www.fahasa.com/hoa-hoc-tro-so-so-1331.html,,,,
