77,J.O.Y - Issue 4: Chuyến Du Hành Ngược Thời Gian,https://cdn0.fahasa.com/media/catalog/product/cache/1/small_image/600x600/9df78eab33525d08d6e5fb8d27136e95/j/_/j.o.y-4.jpg,TẠP CHÍ - CATALOGUE,NXB Thế Giới,"
J.O.Y - Issue 4: Chuyến Du Hành Ngược Thời Gian
Chào mừng các bạn đã có mặt trên một chuyến tàu kỳ lạ và chuẩn bị bước vào hành trình có một không hai của J.O.Y Issue 4. Issue 4 – mang tên Chuyến Du Hành Ngược Thời Gian sẽ tái hiện quá khứ để bạn cảm nhận bằng cả ngũ quan, cho phép bạn một chốc lát được đắm chìm trong không gian của những ngày xưa yêu dấu.
J.O.Y Magazinebook là ấn phẩm made-in-Vietnam tiên phong trong lĩnh vực sách – tạp chí lối sống dành cho những độc giả có gu, đã dần trở nên quen thuộc với các bạn trẻ yêu thích cái đẹp và những câu chuyện truyền cảm hứng. Với 6 chuyên mục đại diện cho những khía cạnh khác nhau của đời sống, J.O.Y Issue 4 với hơi thở hoài niệm sẽ đưa bạn quay ngược thời gian bằng những bài viết sâu sắc, các sáng tác gợi cảm hứng sống, cảm hứng yêu và cảm hứng sáng tạo.
- Human: Tham gia vào “tour tham quan” hậu trường và khám phá câu chuyện đằng sau các vlog triệu view của 1977 Vlog. Nhìn sâu vào thế giới bên trong những bức thư tình của nhạc sĩ Đỗ Bảo.
- Living: Chuyên mục Living sẽ tái hiện không gian tuổi thơ bằng vị giác và khứu giác với bài viết về những món ăn ấu thơ và mùi hương – cỗ máy thời gian vô hình từ hai tác giả Đỗ Xuân Hoàng và Huy Choco.
- Fashion Discovery: Tìm hiểu thêm về con người và những phẩm chất của Công nương Diana – bông hồng nước Anh và là hình mẫu của biết bao cô gái – qua tủ đồ huyền thoại của công nương. Khám phá lý do vì sao thời trang phong cách “trai hư” lại hấp dẫn.
- Footprints of J.O.Y: Chạm vào những nếp gấp thời gian qua điểm neo của phố – Cà phê Đinh.
- Language of The Soul: Làm giàu suối nguồn tâm hồn với những sáng tác giàu cảm hứng từ các cây viết trẻ được quan tâm: From BeP, Nhược Lạc, Minh Nhật.
- Art In The Air: Khám phá thêm về con người của hoạ sĩ Mai Trung Thứ, họa sĩ nổi tiếng thế giới nhưng ẩn sâu bên trong là một người con yêu quê hương đất Việt.
J.O.Y - Issue 4: Chuyến Du Hành Ngược Thời Gian sẽ tiếp nối những giấc mơ mà đội ngũ thực hiện J.O.Y Magazinebook theo đuổi bằng cả trái tim: lan toả những điều tốt đẹp, ngợi ca những giá trị đích thực và nuôi dưỡng những giấc mơ tuổi trẻ. 
",149.000 đ,,,,,,,,https://www.fahasa.com/j-o-y-issue-4-chuyen-du-hanh-nguoc-thoi-gian.html,,,,
78,Hoa Học Trò Số 1356 - Tặng Kèm Fanbook Soft Boy: Những Chàng Trai Ngọt Ngào + 2 Mega Poster Jimin & BTS,https://cdn0.fahasa.com/media/catalog/product/cache/1/small_image/600x600/9df78eab33525d08d6e5fb8d27136e95/b/g/bghghj.jpg,TẠP CHÍ - CATALOGUE,Báo Sinh Viên Việt Nam - Hoa Học Trò,"
Hoa Học Trò 1356: Đón tuần mới nhiều niềm vui, tặng fanbook “Những chàng trai ngọt ngào“
Chào mừng bạn đến thế giới của “softboy”
Hashtag #softboy đang làm mưa làm gió trên TikTok với những chàng trai có vẻ đẹp mềm mại, quyến rũ. Hoa Học Trò số này sẽ mở cánh cửa của thế giới mới, dẫn bạn dạo một vòng để hiểu hơn về các chàng softboy này nhé!
Để môn Lịch sử không còn khó ""xử""
Sở GD&ĐT Hà Nội đã chính thức ""chốt"" môn Lịch sử là môn thi thứ 4 vào lớp 10 công lập năm 2021. Điều này đang khiến nhiều bạn tỏ ra hào hứng vì ""trúng tủ"", số khác lại ""sục sôi"" vì lo lắng. Cùng Hoa Học Trò 1356 đánh bay nỗi sợ hãi môn Lịch sử với một số chiến thuật ""nhỏ mà có võ"" nhé!
WandaVision - Không đơn thuần là một drama đẫm nước mắt
Thông qua WandaVision, Marvel đã tặng các fan MCU chiếc chìa khoá để mở ra cánh cửa giai đoạn 4 với thật sự nhiều thứ hay ho. Cùng nhà Hoa khám phá những điều thú vị này trên số sau nè các bạn!
Góc ""hóng"" gió: Khi livestream ""tấn công thế giới""
Livestream đang trở thành ""tiếng nói chung"" của mọi thế hệ khi bước chân vào Facebook. Ba coi livestream bình luận bóng đá, mẹ và con mở livestream săn hàng giảm giá... ""Đế chế"" này đã nắm giữ những bí mật gì để chúng ta say mê đến vậy? Cùng Hoa Học Trò 1356 ""hóng"" ngay nào! 
",30.000 đ,,,,,,,,https://www.fahasa.com/hoa-hoc-tro-so-1356-tang-kem-fanbook-soft-boy-nhung-chang-trai-ngot-ngao-2-mega-poster-jimin-bts.html,,,,
79,Hoa Học Trò Số 1358 - Tặng Kèm Fanbook #Theboys - Những Chàng Trai Mùa Hè + 2 Mega Poster,https://cdn0.fahasa.com/media/catalog/product/cache/1/small_image/600x600/9df78eab33525d08d6e5fb8d27136e95/z/2/z2449916954345_2e5ce1e317d2efb893d81ea296d8e6b9.jpg,TẠP CHÍ - CATALOGUE,Báo Sinh Viên Việt Nam - Hoa Học Trò,"
HHT 1358 - TRONG NHỮNG NGÀY NẮNG XANH
Những ngày nắng xuyên qua những tán lá xanh dưới mái trường là những ngày mà HHT 1358 mong bạn sẽ nhớ mãi bởi chúng ta dấu ấn tuyệt vời của thời thanh xuân.
Từ tranh cãi về kỳ thi khoa học kỹ thuật cho học sinh: Trường học đã truyền cảm hứng tìm tòi khám phá cho teen?
Những năm gần đây, nhiều trường đưa vào bộ môn STEM, đầu tư vào các phòng thí nghiệm… với mục tiêu đào tạo nên thế hệ teen yêu thích tìm tòi khám phá khoa học. Thế nhưng kỳ thi tìm kiếm tài năng khoa học kỹ thuật học sinh phổ thông lại liên tục dính nghi vấn đạo chép, làm hộ với những đề tài được cho là quá tầm của teen. Hãy cùng HHT 1358 tìm hiểu liệu các dự án khoa học trong nhà trường đã thực chất chưa nhé!
Trước “ngàn lẻ một” đường vào đại học, teen đã thay đổi cách học thi thế nào?
Bắt đầu từ năm 2020, xu hướng đa dạng hình thức tuyển sinh đã được các trường đại học trên cả nước áp dụng và ngày càng phong phú. Khi điểm thi tốt nghiệp không còn là chiếc chìa khoá duy nhất để mở ra “giảng đường”, teen THPT đang thay đổi lộ trình và mục tiêu học tập của mình thế nào?
Có hay không những chiến lược tỏ tình ""bất bại""?
Kể từ khi ""thính"" xuất hiện trên thị trường, đã có biết bao ""cao thủ"" xuất hiện. Những bí kíp chuyền tay nhau để ""cầm cưa"", tỏ tình hay ""thả thính"" dính chắc. Thế nhưng độ đáng tin cậy của những bí kíp này là bao nhiêu phần trăm và liệu bạn có cơ hội để ""chiến thắng""? 
",30.000 đ,,,,,,,,https://www.fahasa.com/hoa-hoc-tro-so-1358-tang-kem-fanbook-theboys-nhung-chang-trai-mua-he-2-mega-poster.html,,,,
80,Hoa Học Trò Số 1359 - Tặng Kèm Fanbook Horoscope Idol Taurus Và 2 Idol Poster IU & Baekhyun (EXO),https://cdn0.fahasa.com/media/catalog/product/cache/1/small_image/600x600/9df78eab33525d08d6e5fb8d27136e95/z/2/z2461621754956_c7c34ca1e51074754ab6618ac3ade1e3.jpg,TẠP CHÍ - CATALOGUE,Báo Sinh Viên Việt Nam - Hoa Học Trò,"
HHT - Hoa Học Trò 1359 sẽ là bệ phóng để khởi đầu những điều thú vị, những nguồn năng lượng tràn đầy và cả những quyết tâm để “ghi bàn” trong giai đoạn cuối năm học!
Tăng lực cho Gen Z
Chuyên đề “Tăng lực cho Gen Z” tiếp tục mang đến những liều thuốc tăng cường kỹ năng, năng lượng và tinh thần cho chính mình, để tự tin chinh phục kỷ nguyên số. Đừng bỏ lỡ bất kỳ số nào của chuyên mục này nhé!
Sai lầm năm 15 tuổi sẽ theo bạn tới 10 năm sau?
“Trọng đại” ngang ngửa kỳ thi Đại học chính là buổi đi làm Căn cước công dân của hội teen vừa tròn 15 tuổi. Những chuyện dở khóc dở cười nào đã xảy ra và liệu bạn có thể ngăn chặn sai lầm của... số phận này? Cùng đón xem trên Hoa Học Trò 1359 nhé!
Instagram chỉ follow một người duy nhất, chẳng bao giờ thừa nhận nhưng vẫn để manh mối “bay tứ tung”... là những điều “cho mình em” mà các chàng gà vẫn thường tự hào nhắc đến. Thế nhưng liệu điều này có “an toàn” cho mối quan hệ của hai người hay không? Tìm câu trả lời trên chuyên mục Những trái tim đang lớn số sau bạn nhé.“Cho mình em” có phải là trend mới của tình yêu? 
",30.000 đ,,,,,,,,https://www.fahasa.com/hoa-hoc-tro-so-1359-tang-kem-fanbook-horoscope-idol-taurus-va-2-idol-poster-iu-baekhyun-exo.html,,,,
81,"Thiên Thần Nhỏ - Số 405 - Tặng Kèm Poster Khổ Lớn Seventeen, BTS Và Board Game BLACKPINK",https://cdn0.fahasa.com/media/catalog/product/cache/1/small_image/600x600/9df78eab33525d08d6e5fb8d27136e95/z/2/z2449917233394_5c798e7467abb77fba55abc07f649391.jpg,TẠP CHÍ - CATALOGUE,Báo Sinh Viên VN - Hoa Học Trò,"
HHT - Không phải ai cũng có khả năng học những môn cần học thuộc nhiều như môn Văn, Lịch sử hay Địa lý. Nhưng nếu nắm được bí quyết, bạn sẽ thấy đây không còn là nhiệm vụ bất khả thi.
Ăn sô-cô-la cũng là một giải pháp
Bạn không thể học một lượng kiến thức lớn cùng một lúc, vì thế nếu chúng mình không biết cách học bài có quy củ thì việc học sẽ không hiệu quả. Để tránh tâm lý chán nản khi nhìn vào lượng kiến thức cần học, thì trước khi học bạn nên tách nhỏ nội dung thành những phần nhỏ và sắp xếp chúng một cách có khoa học để có thể tiếp thu bài vở nhanh hơn.
Theo nghiên cứu của đại học Nottingham, sô-cô-la đen có chứa nhiều cacao, các flavanol có trong cacao sẽ giúp cải thiện lượng máu đến những vùng chủ chốt của não trong 2 - 3 giờ. Chúng cũng giúp tăng cường chức năng não bộ giúp chống lại sự mất ngủ, sự kiệt sức. Đây là chất có tác dụng trong việc điều chỉnh tâm trạng của bạn khi thi.
Mưa trên hành tinh khác
Mùa Hè đến mang theo những cơn mưa rào, và mưa sẽ rơi thường xuyên hơn là trong mùa Thu hay Đông. Đó là điều mà bạn có thể đã thấy rất quen thuộc ở trên Trái Đất. Nhưng còn những hành tinh khác trong Hệ Mặt Trời thì sao? Hóa ra là, một số hành tinh có thể có một hiện tượng rất giống Trái Đất: Đó là những giọt mưa.
Mưa trên các hành tinh khác là vấn đề mà các nhà khoa học vẫn đang cố gắng tìm hiểu kỹ. Nhưng các nghiên cứu mới đây cho thấy rằng, bản thân những giọt mưa thì rất giống nhau, ngay cả ở những môi trường trên các hành tinh khác. Nhưng “rất giống” cũng không có nghĩa là “hoàn toàn giống”.
Muốn vui vẻ, hãy tìm những cung Hoàng đạo hài hước
Song Tử rất biết cách mang tiếng cười đến cho mọi người, lan truyền suy nghĩ tích cực vui vẻ. Bản thân Song Tử làm mọi thứ rất tự nhiên chứ chẳng hề diễn nên đôi khi, họ còn bối rối hoang mang vì mình chỉ nói một câu bình thường mà sao người khác lại bật cười. Chính vì Song Tử lúc nào cũng mang đến niềm vui, tinh thần lạc quan nên ai cũng muốn kết thân với người cung này đấy. 
",20.000 đ,,,,,,,,https://www.fahasa.com/thien-than-nho-so-405-tang-kem-poster-kho-lon-seventeen-bts-va-board-game-blackpink.html,,,,
82,Hoa Học Trò Số 1357 - Tặng Kèm Fanbook #RapVocals + 2 Mega Poster RM (BTS) & Cung Tuấn - Trương Triết Hạn,https://cdn0.fahasa.com/media/catalog/product/cache/1/small_image/600x600/9df78eab33525d08d6e5fb8d27136e95/z/2/z2422972896972_db6a5ac6482e5fc17275447e211d8ec2.jpg,TẠP CHÍ - CATALOGUE,Báo Sinh Viên Việt Nam - Hoa Học Trò,"
HHT - Đã gần đi đến nửa học kỳ cuối cùng trong năm học, bạn còn chờ gì mà không cùng Hoa Học Trò 1357 giải phóng tháp năng lượng đang còn say ngủ, để bứt phá và tạo ra những cú hích thành công thật lớn cho mình?
Nhà tuyển dụng nói gì về Gen Z
Tuy được đánh giá là một thế hệ sáng tạo, giàu tiềm năng thế nhưng nhiều nhà tuyển dụng vẫn vô cùng đau đầu bởi Gen Z, cho rằng nhiều bạn không thể hiện trách nhiệm, chủ yếu chỉ làm vì vui... Nhân số học sẽ giải mã những lời nhận xét này và có lời khuyên để bạn khắc phục cũng như chinh phục những công việc trong mơ. Cùng xem trên Hoa Học Trò 1357 nhé!
Trong thời đại 4.0, ai cũng nghĩ rằng công nghệ phần mềm là một ngành có thể hái ra tiền. Thế nhưng thực hư về ngành học này và lời đồn giàu sang có thực sự đúng? Hoa Học Trò 1357 sẽ đi tìm lời đáp giúp bạn!Công nghệ phần mềm: Khô - khó nhưng vắt ra nhiều tiền?
Khi teen có đế chế thời trang của riêng mình
Từ một người bị chê toàn mặc đồ pha-ke, cậu bạn này đã trở thành chủ tịch một câu lạc bộ thời trang của riêng mình và làm được nhiều điều vô cùng thú vị. Chắc chắn cuộc hẹn với nhân vật này trên số sau sẽ khiến bạn thích mê đó! 
",30.000 đ,,,,,,,,https://www.fahasa.com/hoa-hoc-tro-so-1357-tang-kem-fanbook-rapvocals-2-mega-poster-rm-bts-cung-tuan-truong-triet-han.html,,,,
83,Hoa Học Trò Số 1321 - Tặng Kèm Fanbook K-POP GIRL POWER + MegaPoster TAEYEON & IU,https://cdn0.fahasa.com/media/catalog/product/cache/1/small_image/600x600/9df78eab33525d08d6e5fb8d27136e95/5/d/5db284810f50d-bia-1-4.jpg,TẠP CHÍ - CATALOGUE,Báo Sinh Viên VN - Hoa Học Trò,"
Hoa Học Trò Số 1321
Khép lại tháng Mười của bạn, Hoa Học Trò 1321 sẽ lên kệ vào ngày 29/10/2019 tại các sạp báo, bưu điện, nhà sách FAHASA trên toàn quốc. Cùng liệt kê những lý do bạn không thể nào thiếu số báo này trong tuần cuối tháng Mười nào!
Mùa Halloween sôi động với nhiều sự kiện hấp dẫn và các xu hướng hóa trang thu hút nhất năm, bạn teen nào cũng muốn được trải nghiệm tất cả để có mùa lễ hội rùng rợn nhưng cũng không kém phần vui vẻ. Vậy nên ""thổ địa bí ngô"" đã nhanh tay tổng hợp một loạt những điều bạn cần biết khi ""bắt sóng"" Halloween 2019, bạn chỉ cần lựa chọn điểm đến yêu thích và ""xin kẹo"" mà thôi.
Bên cạnh đó, các tin tức giải trí, thời trang mới nhất cũng gói gọn trong Hoa Học Trò 1321. Phong cách thường của sao Hàn luôn cực hợp với mùa Thu - Đông, bạn đã chọn được ""hình mẫu"" để lên đồ trong chuỗi ngày se lạnh? Phía sau sự thành công của Miu Lê là những suy nghĩ sâu sắc nhưng rất cá tính, mời bạn cùng chúng tớ ""đọc - hiểu"" công chúa nhé!
Cơn sốt truyện kinh dị tương tác và sức hút của những truyền thuyết đô thị
Xuất hiện lần đầu trên nền tảng Reddit quen thuộc, truyện tương tác kinh dị dần nhận được sự chú ý và say mê của cộng đồng mạng - những người vừa có thể là tác giả, vừa có thể là độc giả.
Mượn truyền thuyết bí ẩn của các thành phố, truyện tương tác kinh dị liên kết rất nhiều câu chuyện quen-lạ đến từ nhiều địa phương, được kể lại dưới sự thêm thắt, trải nghiệm của người viết. Hàng trăm, thậm chí hàng nghìn người truy cập vào các chủ đề kinh dị đã cho thấy truyện kinh dị tương tác đang gây ấn tượng mạnh với giới trẻ.
Quỳnh JP vs Bà Tân Vlog - Sự không khoan nhượng của cộng đồng mạng
Điệp khúc ""siêu to khổng lồ"" của Bà Tân Vlog ngày càng trở nên thiếu hấp dẫn trong bảng tin Youtube của ""các cháu"", những video triệu view chỉ còn ở mức 500-600 nghìn lượt xem và đang có dấu hiệu giảm dần. Trong khi đó, Quỳnh Trần JP - một bà nội trợ sống ở Nhật lại đang thu hút sự chú ý của khán giả cũng với các video theo chủ đề ăn uống. 
Tuy nhiên, trên đường đua sáng tạo của hội Youtuber, Quỳnh Trần JP lại được đánh giá có sức bền hơn Bà Tân Vlog khi khéo léo lồng ghép văn hóa Nhật Bản qua từng video một cách chân thật, gần gũi nhất. Điều này hoàn toàn dễ hiểu, vì cuộc đua duy trì sức nóng không dành chỗ cho những vòng lặp.
Học cách ""detox"" tinh thần cùng ""tiên nữ Tứ Xuyên"" Lý Tử Thất
Lý Tử Thất đã quá quen thuộc với giới trẻ qua những thước hình trong trẻo, yên bình của vùng thôn quê. Một cuộc sống tự làm giấy, bàn tre, tự nấu ăn từ nguyên liệu hoàn toàn ""cây nhà, lá vườn"" khiến bao người trẻ mơ mộng được tạo dựng trong video dành cho hơn 19 triệu follow-ers trên Weibo và 5 triệu subcrise-ers trên Youtube. 
Tuy nhiên, hành trình trở thành ""tiên nữ Tứ Xuyên"" của Lý Tử Thất lại không hề dễ dàng như vậy, và bạn cũng sẽ nhận ra rằng, cuộc sống thôn quê đáng ngưỡng mộ ấy được thực hiện trên rất nhiều nỗ lực. 
K-Pop Girl Power - Bộ sưu tập những ""chị đẹp"" mang nhạc cho bạn nghe
Cuốn fanbook đính kèm Hoa Học Trò 1321 không dành cho một nhóm nhạc, mà là món quà tặng những cô nàng ""chao đảo"" K-Pop - nơi các idol nam vẫn thường chiếm thế thượng phong. Họ là IU, Taeyeon, Sunmi, Chung Ha và Heize, những cái tên quen thuộc trên bảng xếp hạng âm nhạc, đề cử giải thưởng cùng các bài khen ngợi của báo chí, cộng đồng fan. Thế mạnh khác nhau, phong cách khác nhau, điểm chung của những ""chị đẹp"" mà công chúng tin tưởng là gì? Mời bạn cùng chúng tớ tìm đáp án trong cuốn fanbook K-Pop Girl Power nhé! 
",30.000 đ,,,,,,,,https://www.fahasa.com/hoa-hoc-tro-so-1321.html,,,,
84,Hoa Học Trò Số 1346 - Tặng Kèm Fanbook TWICE + 2 Mega Poster Lee Do Hyun (18 Again) & Jin (BTS),https://cdn0.fahasa.com/media/catalog/product/cache/1/small_image/600x600/9df78eab33525d08d6e5fb8d27136e95/z/2/z2150964403022_130832ca29be0ce608d2369dac66142a.jpg,TẠP CHÍ - CATALOGUE,Báo Sinh Viên Việt Nam - Hoa Học Trò,"
Hoa Học Trò Số 1345 - Tặng Kèm Fanbook TWICE + 2 Mega Poster Lee Do Hyun (18 Again) & Jin (BTS)
Với phe kẹp nơ thì ""vi-ô-lông"" là một trong những thứ phiền phức nhất trên đời, làm mất tính thẩm mỹ mà còn khó chịu muôn phần. Cùng khám phá công cuộc ""diệt trừ"" những ""cánh đồng"" này để xem liệu nó có thích hợp cho teen mình không nha!
Thời đại thơ ca lên ngôi
Khi hầu hết những xu hướng, câu nói trendy, hai chương trình Rap đang ""hót hòn họt"" đều xuất phát từ thơ - vần - chơi chữ, phải chăng việc học Văn của teen mình cũng đã đến thời ""bùng nổ""? Đón xem tụi mình có thể áp dụng được những ""bí kíp"" nào để giật điểm 10 Văn ngon ơ không nhé!
Quả bom khó phá: ""Bom hàng""
Cách độ vài ba ngày, một cú ""phốt"" về hội bùng đơn, bom hàng lại được chia sẻ rần rần trên mạng xã hội. Cùng trưởng hội ""hóng"" gió ""mổ xẻ"" một chút về những con người chuyên nhận ""gạch đá"" này nha! 
",30.000 đ,,,,,,,,https://www.fahasa.com/hoa-hoc-tro-so-1346-tang-kem-fanbook-twice-2-mega-poster-lee-do-hyun-18-again-jin-bts.html,,,,
85,Thiên Thần Nhỏ - Số 406 - Tặng Kèm Poster Khổ Lớn BTS Và Board Game NCT,https://cdn0.fahasa.com/media/catalog/product/cache/1/small_image/600x600/9df78eab33525d08d6e5fb8d27136e95/t/h/thi_n-th_n-nh_-406.jpg,TẠP CHÍ - CATALOGUE,Báo Sinh Viên VN - Hoa Học Trò,"
Thiên Thần Nhỏ 406: Tuyệt chiêu giúp bạn vẫn vui khỏe mỗi ngày dù đang ở nhà chống dịch
HHT - Tạm nghỉ học trong thời kỳ dịch bệnh bùng phát thì buồn thật đấy, nhưng đây là dịp để bạn trải nghiệm những điều mình chưa có dịp làm trong những ngày học hành bận rộn.
Tập cho mình thói quen ngủ tốt
Đi ngủ vào giờ nhất định. Ngoài việc đi ngủ đúng giờ thì việc thức dậy cùng một thời gian cũng rất quan trọng. Bạn có thể đặt đồng hồ báo thức mỗi ngày, kể cả ngày cuối tuần.
Không nên để bụng quá no hoặc quá đói khi đi ngủ. Nếu ăn quá no trước khi đi ngủ, dạ dày phải mất nhiều giờ làm việc để tiêu hóa thức ăn. Còn nếu bạn quá đói thì dạ dày chúng mình sẽ cồn cào làm khó ngủ.
Hạn chế sử dụng các thiết bị điện tử trước khi đi ngủ. Việc xem TV hoặc sử dụng điện thoại sẽ khiến bạn khó ngủ hơn, giấc ngủ không yên và dễ thức dậy muộn vào buổi sáng.
Dành một ngày đi thăm họ hàng
Trong tháng 5 có một ngày rất thú vị, đó là Ngày Đến Thăm Họ Hàng (Visit Your Relatives Day), vào 18/5. Đây là một ngày lễ để nhắc nhở và khuyến khích chúng ta đến thăm những người thân của mình, như ông bà, cô dì chú bác… Nó chính là ngày để chúng ta có cơ hội trở nên thân thiết hơn với họ hàng, xây dựng (hoặc củng cố) những mối quan hệ trong gia đình.
Thực tế, càng ngày, chúng ta càng ít gặp họ hàng, bởi vì ai cũng bận rộn, vả lại ai cũng nghĩ rằng nếu cần có thể gọi điện thoại hoặc nhắn tin rồi. Nhưng việc gặp nhau trực tiếp, trò chuyện một buổi cũng lý thú lắm chứ.
Làm bạn với cung Kim Ngưu thật tuyệt!
Nếu như bạn có một nhóm bạn thân thuộc nhiều cung khác nhau, hẳn nhân vật điềm tĩnh, suy nghĩ chín chắn nhất chính là Kim Ngưu rồi. Kim Ngưu được trời phú cho tính cách hiền lành, chu đáo, làm gì cũng suy tính trước sau, nói chuyện nhã nhặn khéo léo. Bởi vậy mà Kim Ngưu luôn được người lớn tin tưởng, yêu quý và hội bạn thân nếu cần xin xỏ bố mẹ, thầy cô thứ gì sẽ nhờ Kim Ngưu đứng ra đại diện. 
",20.000 đ,,,,,,,,https://www.fahasa.com/thien-than-nho-so-406-tang-kem-poster-kho-lon-bts-va-board-game-nct.html,,,,
