540,Tô Màu Thế Giới Khủng Long- Tập 1,https://salt.tikicdn.com/cache/280x280/ts/product/b2/30/b5/6dbdc80dee107b09763e953703f48641.jpg,Tô màu – luyện chữ,Nhiều Tác Giả,"Bộ tô màu với rất nhiều hình ảnh thú vị đang chờ đón các bạn nhỏ. Với quyển sách này, các bé sẽ được trổ tài nghệ thuật của mình thông qua đó sẽ giúp các bé được giải trí và còn để các em rèn luyện k...",16000,Tân Việt,2019-06-01 00:00:00,20.5 x 28 cm,Bìa mềm,24,,,,,,,,
541,Trò Chơi Rèn Luyện Tư Duy Nâng Cao 1 (5-7 Tuổi),https://salt.tikicdn.com/cache/280x280/ts/product/2f/10/54/6549f156b535487170be5ef5f6835051.jpg,Tô màu – luyện chữ,Hà Thu Quang,"Bộ sách đặc biệt được biên soạn dành riêng cho các bé ở độ tuổi từ 3–7, giúp bồi dưỡng TƯ DUY TOÁN HỌC, xây dựng và phát triển khả năng QUAN SÁT, PHÁN ĐOÁN, PHÂN TÍCH, KHÁI QUÁT, SUY LUẬN, TƯỞNG TƯỢNG...",44000,VanLangBooks,2019-10-06 00:00:00,21 x 28.5 cm,Bìa mềm,48,,Doãn Nguyên,,,,,,
542,Tô Màu Công Chúa Nhỏ - Tô Màu Công Chúa - Công Chúa Phương Tây,https://salt.tikicdn.com/cache/280x280/ts/product/95/95/52/03c2cdb0ed09a75661ff6ffe71a3dd90.jpg,Tô màu – luyện chữ,Nhiều Tác Giả,"Tô Màu Công Chúa Nhỏ - Tô Màu Công Chúa - Công Chúa Phương TâyBộ sách kích thích khả năng tập trung, sáng tạo và khéo léo nơi trẻ qua việc nhận biết và tô màu các nhân vật quen thuộc. Đó là các nàng ...",25600,Liên Việt,,,Bìa mềm,,,,,,,,,
543,Tô Màu Bóc Dán - Nông Trại - Farm,https://salt.tikicdn.com/cache/280x280/ts/product/f8/7f/f2/a4ee22e8fca4c02c5630c093bf09098d.jpg,Tô màu – luyện chữ,"Stacey Lamb,Jessica Greenwell","Nông trại vui vẻ với những chú bò đang gặm cỏ, những cánh hoa đang khoe sắc, những chú vịt đang bơi lội trong ao. Nhưng có vẻ còn thiếu chút sắc màu cho chiếc xe kéo, chú bù nhìn rơm hay cây táo sai t...",14400,Đinh Tị,2018-10-01 00:00:00,19 x 24 cm,Bìa mềm,16,,Jean - Pierre D.L.B,,,,,,
544,Tô Màu Nhân Vật (8 cuốn ),https://salt.tikicdn.com/cache/280x280/ts/product/23/a3/f3/38ceabbfa65c2542d6652ee86b11093f.jpg,Tô màu – luyện chữ,Nhiều Tác Giả,"Tô màu luôn là hình thức giúp các bạn nhỏ rèn luyện trí tưởng tượng, tư duy, trí nhớ và sáng tạo rất tốt, nó được đưa vào bộ môn học và chơi trong trường mầm non, với bộ tranh tô màu các nhân vật hoạt...",91200,Nhà Sách Hồng Ân,,<p>17x24</p>,Bìa mềm,,Nhà Xuất Bản Đà Nẵng,,,,,,,
545,Sách : Combo Chuẩn Bị Cho bé Vào Lớp 1 ( Túi 5 Cuốn +Tặng 1 Cây Viết Chì +1 Gôm + 1 Chuốt),https://salt.tikicdn.com/cache/280x280/ts/product/45/a0/1f/99cdc57e028726c4b5c9d80e7d4e820a.jpg,Tô màu – luyện chữ,Lê Tuệ Minh - Lê Thu Ngọc,Sách : Combo Chuẩn Bị Cho bé Vào Lớp 1 ( Túi 5 Cuốn +Tặng 1 Cây Viết Chì +1 Gôm + 1 Chuốt)Tủ sách Chuẩn bị cho bé vào lớp Một gồm 5 cuốn được biên soạn nhằm mục đích trang bị một số kỹ năng cơ bản ch...,59000,Minh Long,2018-07-01 21:22:44,,Bìa mềm,184,Nhà Xuất Bản Mỹ Thuật,,Phiên Bản Thông Thường,,,,,
546,Tô Màu Bóc Dán - Giai Điệu Ngọt Ngào - Nursery Rhymes,https://salt.tikicdn.com/cache/280x280/ts/product/93/28/8a/58e87b803669bd13bb26dd75ee8e89f5.jpg,Tô màu – luyện chữ,Benedetta Giaufret,"Trong vườn những chú chim đang khoe sắc, những bạn bướm đang tung cánh bay. Nhưng có vẻ khu vườn của chúng ta còn thiếu chút sắc màu tươi sáng. Chúng mình cùng thử tài với thật nhiều màu sắc và trang ...",14400,Đinh Tị,2018-10-01 00:00:00,19 x 24 cm,Bìa mềm,16,,Jean - Pierre D.L.B,,,,,,
547,Công Chúa Lộng Lẫy,https://salt.tikicdn.com/cache/280x280/ts/product/b1/1c/c8/de729fdefc9f887a459d9a5899713efa.jpg,Tô màu – luyện chữ,Ấu Tử Văn Hóa,Công Chúa Lộng LẫyViệc tô vẽ sẽ đưa trẻ đến thế giới của trí tưởng tượng và cho chúng cơ hội để thể hiện bảnthân mình. Tô vẽ khiến trẻ cần phải có một bàn tay chắc chắn và dẻo dai để điều khiển những...,11200,Trí Việt,,19 x 27,Bìa mềm,16,,,,,,,,
548,Tập Tô Màu Nhà Trẻ - Chủ Đề Nghề Nghiệp - Màu Ngẫu Nhiên,https://salt.tikicdn.com/cache/280x280/media/catalog/product/i/m/img379_1_6.jpg,Tô màu – luyện chữ,Trung Kiên,"Tập Tô Màu Nhà Trẻ - Chủ Đề Nghề Nghiệp Bộ sách Bé tập tô màu nhà trẻ với nhiều chủ đề khác nhau, không chỉ rèn khả năng khéo léo, sự linh hoạt của đôi tay mà còn hình thành khả năng nhận biết ở trẻ ...",7200,Minh Long,2014-06-20 00:00:00,17 x 24 cm,Bìa mềm,16,,,,,,,,
549,Let's Color - Sáng Tạo Cùng Picasso,https://salt.tikicdn.com/cache/280x280/ts/product/c5/13/3e/addee38b064085f2853618b640d27ba9.jpg,Tô màu – luyện chữ,"Hoàng Thị Quỳnh,Bùi Hồng Hạnh",Picasso cũng là một họa sĩ vô cùng nổi tiếng. Tớ cũng chưa biết làm thế nào để trở thành một họa sĩ nổi tiếng như vậy. Nhưng mẹ đã giúp tớ. Hai mẹ con tớ đã tập hợp lại rất nhiều kiệt tác của Picasso....,42500,Thái Hà,2019-06-01 00:00:00,20 x 20 cm,Bìa mềm,64,,,,,,,,
550,Bé Tô Màu & Đọc Truyện Các Nàng Công Chúa - Cô Bé Quàng Khăn Đỏ,https://salt.tikicdn.com/cache/280x280/ts/product/d7/5a/86/ce5053b51a7906b438d767e75e0c6e68.jpg,Tô màu – luyện chữ,"Quang Toàn,Quang Toản","Thế giới cổ tích với những nhân vật xinh xắn, ngộ nghĩnh, đáng yêu với những câu chuyện kể về thế giới có phép màu kì diệu luôn là niềm yêu thích của các bé.   Mỗi trang sách mở ra bé vừa được nghe m...",8200,Cty Văn Hóa Nhân Văn,,,,,Nhà Xuất Bản Đồng Nai,,,,,,,
551,Tranh Tô Màu Vương Quốc Khủng Long - Cuộc Sống Bầy Đàn,https://salt.tikicdn.com/cache/280x280/ts/product/82/cb/4f/63feef36f49c4de4a36262f019a995b4.jpg,Tô màu – luyện chữ,Nhóm Hoa Mặt Trời,            Tranh Tô Màu Vương Quốc Khủng Long - Cuộc Sống Bầy Đàn        Vườn côn trùng kì diệu có bao nhiêu bí mật chúng ta chưa khám phá? Bên cạnh những động vật có vú mà chúng ta thường thấy...,16000,Tân Việt,2018-01-01 00:00:00,20.5 x 28 cm,Bìa mềm,23,Nhà Xuất Bản Mỹ Thuật,,,,,,,
552,Cùng Gấu Học Tiếng Anh - Số Đếm,https://salt.tikicdn.com/cache/280x280/ts/product/25/87/56/1c9a5e68615cb6eaeefc9079d9c5a14c.jpg,Tô màu – luyện chữ,Nguyễn Thu Huyền,Cùng Gấu Học Tiếng Anh - Số Đếm Phương pháp giáo dục sớm với mục đích kích thích tối đa khả năng tiềm ẩn của các bé trong “giai đoạn vàng” của những năm đầu đời. lợi ích của việc giáo dục sớm có thể ...,19500,MCBOOKS,2017-02-01 00:00:00,15 x 16 cm,Bìa cứng,12,Nhà Xuất Bản Hồng Đức,,2017,,,,,
553,Tô Màu Thế Giới Khủng Long - T2 (Tái Bản),https://salt.tikicdn.com/cache/280x280/ts/product/de/64/b5/249390893e7c03450c26e7bf4b349a6c.png,Tô màu – luyện chữ,Nhiều Tác Giả,"Bộ tô màu với rất nhiều hình ảnh thú vị đang chờ đón các bạn nhỏ. Với quyển sách này, các bé sẽ được trổ tài nghệ thuật của mình thông qua đó sẽ giúp các bé được giải trí và còn để các em rèn luyện kh...",18040,Tân Việt,2021-05-01 00:00:00,20.5 x 28 cm,Bìa mềm,24,Nhà Xuất Bản Mỹ Thuật,Nhiều Tác Giả,,,,,,
554,Mai Em Vào Lớp Một - Dành Cho Trẻ 5 - 6 Tuổi (Bộ 9 Cuốn) - Tái Bản,https://salt.tikicdn.com/cache/280x280/ts/product/8b/8f/12/b2d4a67ce9190f09bd73e14b92a1ad67.jpg,Tô màu – luyện chữ,"Lê Hồng Đăng,Lê Thị Ngọc Ánh","Bộ sách ""Mai em vào lớp 1"" được biên soạn theo Chương trình Giáo dục mầm non mới, dành cho các em nhỏ ở lứa tuổi từ 5 đến 6, giúp các em nắm vững những kiến thức, kĩ năng cơ bản, cần thiết để có một h...",78000,Minh Long,2019-10-01 00:00:00,30 x 20 cm,Bìa mềm,,Nhà Xuất Bản Đại Học Sư Phạm,,,,,,,
555,Tô Màu Bóc Dán - Vườn Bách Thú - Zoo,https://salt.tikicdn.com/cache/280x280/ts/product/13/96/d3/5e78f85441db40108faa6c00afcb27d2.jpg,Tô màu – luyện chữ,Dan Crisp,"Đi thăm vườn bách thú có gì thú vị nhỉ? Ồ, nhiều lắm nhé! Có hàng chục các loài động vật khác nhau để các bạn nhỏ khám phá trong vườn bách thú đấy. Và chúng mình hãy thử tài tô màu và trang trí bằng h...",14400,Đinh Tị,2018-10-01 00:00:00,19 x 24 cm,Bìa mềm,16,,Jean - Pierre D.L.B,,,,,,
556,Tủ Sách Chuẩn Bị Cho Bé Vào Lớp 1 - Vở Tập Viết (Quyển 2),https://salt.tikicdn.com/cache/280x280/ts/product/db/f6/1e/39be81ea56e734fc76e7579977596632.jpg,Tô màu – luyện chữ,Thiên Ân,"Để chuẩn bị cho các bé mẫu giáo lên lớp 1 thì việc làm quen với chữ và số, những phép tính đơn giản là vô cùng quan trọng và cần thiết.Ngoài ra, sách còn có những hình ảnh minh họa sinh động giúp cho...",12000,SÁCH THIẾT BỊ GIÁO DỤC ĐỨC TRÍ,2019-01-04 00:00:00,16 x 24 cm,Bìa mềm,22,,,,,,,,
557,Tô Màu Công Chúa Nhỏ - Tô Màu Công Chúa - Công Chúa Bốn Phương,https://salt.tikicdn.com/cache/280x280/ts/product/a7/dd/c9/756d51f263125f25cfc2c1d6bd021ba8.jpg,Tô màu – luyện chữ,Nhiều Tác Giả,"Tô Màu Công Chúa Nhỏ - Tô Màu Công Chúa - Công Chúa Bốn PhươngBộ sách kích thích khả năng tập trung, sáng tạo và khéo léo nơi trẻ qua việc nhận biết và tô màu các nhân vật quen thuộc. Đó là các nàng ...",25600,Liên Việt,,,Bìa mềm,,,,,,,,,
558,Bộ Sách My Little Pony - Tô Màu Và Các Trò Chơi (Bộ 3 Cuốn),https://salt.tikicdn.com/cache/280x280/ts/product/d2/45/d1/74caf2ba2699ea8326cf20adeaec26ef.jpg,Tô màu – luyện chữ,"Nhiều Tác Giả,Nhiều Tác Giả,Nhiều tác giả,Nhiều Tác Giả ,Nhiều Tác giả",Cùng bước vào thế giới diệu kỳ của những chú ngựa nhỏ và các bạn. Bé hãy sử dụng bút màu cùng với trí tưởng tượng để tạo ra những nhân vật trong My Little Pony theo phong cách của riêng mình.   Bộ sá...,64800,NXB Mỹ Thuật,,,,,,,,,,,,
559,Mỗi Em Bé Là Một Thiên Tài - Tôi 6 Tuổi,https://salt.tikicdn.com/cache/280x280/media/catalog/product/m/o/moi-em-be-la-mot-thien-tai-tap-6.jpg,Tô màu – luyện chữ,Kỷ Giang Hồng,"Mỗi Em Bé Là Một Thiên Tài - Tôi 6 Tuổi Mỗi em bé là một thiên tài là bộ sách gồm 6 tập dành cho bé từ 1 đến 6 tuổi nhằm phát triển toàn diện sáu kĩ năng: ngôn ngữ, trí nhớ, đọc hiểu, tư duy, sáng tạ...",52000,Tân Việt,2013-09-22 00:00:00,,,100,,,,,,,,
560,Combo Tô Màu Kỹ Năng (5 Cuốn),https://salt.tikicdn.com/cache/280x280/ts/product/4a/6f/4f/08a0e525472c205500358db66b05a34c.JPG,Tô màu – luyện chữ,Huyền Linh,"Tô Màu Kỹ Năng là bộ sách giúp bé thỏa sức khám phá môi trường xung quanh các chủ đề hấp dẫn: môi trường, thể thao, sinh hoạt hằng ngà giúp bé khám môi trường xung quanh 1 cách toàn diện nhất.  Đây c...",48600,Trí Việt,2019-01-09 00:00:00,17 x 24 cm,Bìa mềm,,,,,,,,,
561,Tô Màu Bóc Dán - Khu Vườn - Garden,https://salt.tikicdn.com/cache/280x280/ts/product/2d/eb/a3/d0f8389157db51fcf0d2ddab8d9da244.jpg,Tô màu – luyện chữ,Maria Pearson,"Trong vườn những chú chim đang khoe sắc, những bạn bướm đang tung cánh bay. Nhưng có vẻ khu vườn của chúng ta còn thiếu chút sắc màu tươi sáng. Chúng mình cùng thử tài với thật nhiều màu sắc và trang ...",14400,Đinh Tị,2018-10-01 00:00:00,19 x 24 cm,Bìa mềm,16,,Jean - Pierre D.L.B,,,,,,
562,Bé Làm Họa Sỹ - Bé Tô Màu (Tập 11),https://salt.tikicdn.com/cache/280x280/media/catalog/product/i/m/img700_6.jpg,Tô màu – luyện chữ,Nhóm tác giả,"Bé Làm Họa Sỹ - Bé Tô Màu (Tập 11)  Tô màu giúp các bé làm quen với thế giới màu sắc đa dạng, rèn luyện những thao tác cơ bản: cầm bút, phân biệt hình khối, cảm nhận sự hài hòa... Đây là hoạt động vừ...",9100,Pandabooks,2011-09-20 00:00:00,19 x 27 cm,Bìa mềm,,,,,,,,,
563,Thước Đo Chiều Cao - Rau Củ Quả,https://salt.tikicdn.com/cache/280x280/media/catalog/product/r/a/raucu_2.jpg,Tô màu – luyện chữ,Nhiều Tác Giả,"Thước Đo Chiều Cao - Rau Củ Quả - Tranh nhận biết - Sách gấp: Đây là thiết kế đặc biệt để đo chiều cao cho trẻ từ 1 đến 7 tuổi. Khi dán lên tường, các em vừa có thước đo chiểu cao vừa có thể học được...",23300,Công Ty Cổ Phần Văn Hóa Đông A,2012-12-31 07:00:00,29 x 172 cm ,,1,,Ngô Minh Vân,,,,,,
564,Vở Ô Li Bài Tập Toán Lớp 1 Quyển 2 (Biên Soạn Theo Chương Trình Mới),https://salt.tikicdn.com/cache/280x280/ts/product/2b/db/c4/ad61ea2dd0e09db55b1d9fff27810ae4.jpg,Tô màu – luyện chữ,Nguyễn Đức Tấn,"Để khắc sâu những kiến thức toán học, ngoài những bài tập trong sách giáo khoa các em học sinh cần luyện tập thêm bài tập trong các sách bài tập. Đặc biệt, các em học sinh tiểu học thường ham chơi, hi...",27200,Công ty MTV DV - VH Khang Việt,2020-09-01 00:00:00,19 x 27 cm,Bìa mềm,56,Nhà Xuất Bản Đại Học Quốc Gia Hà Nội,"Nguyễn Đức Phát, Lê Thị Kim Phượng",,,,,,
565,Sách Tô Màu Các Siêu Anh Hùng - Siêu Anh Hùng Phóng Băng,https://salt.tikicdn.com/cache/280x280/media/catalog/product/i/m/img_20170806_0001.u5426.d20170813.t075629.827587.jpg,Tô màu – luyện chữ,Họa sĩ Tống," Sách Tô Màu Các Siêu Anh Hùng - Siêu Anh Hùng Phóng Băng  sẽ luôn là món quà vô cùng hấp dẫn và bổ ích cho các bạn bé nhà mình. Những vị anh hùng xả thân bảo vệ chính nghĩa, chiê...",12000,Tân Việt,2017-07-06 00:00:00,19 x 27 cm,Bìa mềm,23,Nhà Xuất Bản Mỹ Thuật,,,,,,,
566,"Combo Bé Tập Viết Quyển 1, 2 và Bé Tập Tô (tặng kèm 1 tờ sticker dán 36 hình ngôi sao)",https://salt.tikicdn.com/cache/280x280/ts/product/19/74/e7/35ed08e90b2cac5f99839c2a7b76d9c6.jpg,Tô màu – luyện chữ,Nhiều Tác Giả,"Gồm 29 CHỮ CÁI VIẾT THƯỜNG, CHỮ VIẾT ĐỨNG NÉT ĐỀU theo đúng tiêu chuẩn của bộ giáo dục về kiểu chữ, số nét chữ, hướng đưa nét chữ.Đúng với tên gọi “Bộ sách diệu kì” - bộ sách đặc biệt giúp bé có thể ...",68000,Trí Nhân Tâm,2018-03-03 12:00:56,<p>17x24cm</p>,Bìa mềm,44,,,,,,,,
567,"Sách - Hành Trang Cho Bé Vào Lớp Một Túi 6 Cuốn,Tập Tô,Tập Viết Chữ Cái Chữ Số ,Tặng 1 Cây Viết chì, 1 Chốt , 1 Gôm Tẩy",https://salt.tikicdn.com/cache/280x280/ts/product/dc/24/19/dc1dd41cdb5df48a2e819c4a74c1b91f.jpg,Tô màu – luyện chữ,nhieu tac gia,"Sách - Hành Trang Cho Bé Vào Lớp Một Túi 6 Cuốn,Tập Tô,Tập Viết Chữ Cái Chữ Số ,Tặng 1 Cây Viết chì, 1 Chốt , 1 Gôm TẩyTừ mẫu giáo lên tiểu học là bước tiến quan trọng để bé bước chân vào thế giới tr...",72000,Minh Long,2018-07-01 20:10:55,,Bìa mềm,32,Nhà Xuất Bản Đại Học Sư Phạm,,Phiên bản thông thường,,,,,
568,Học Vần Tiếng Việt - Tập 2 (Dùng Cho Mẫu Giáo),https://salt.tikicdn.com/cache/280x280/ts/product/d8/6b/12/c94a936fb1ef8edcfb2977cca8df6c3c.jpg,Tô màu – luyện chữ,Nhân Văn Group,Học Vần Tiếng Việt - Tập 2 (Dùng Cho Mẫu Giáo)Cuốn sách Học Vần Tiếng Việt Dùng Cho Mẫu Giáo (Tập 2) được biên soạn theo chương trình cải cách mới nhất của Bộ Giáo Dục và Đào Tạo.Cuốn sách gồm 28 bà...,29000,Công Ty CP Văn Hóa Nhân Văn,,,Bìa mềm,31,Nhà Xuất Bản Đại Học Sư Phạm TPHCM,,,,,,,
569,My Big Animal_Con Tập Tô Cảm Xúc Rừng Xanh,https://salt.tikicdn.com/cache/280x280/ts/product/3d/05/6b/f3183a2acc7daf48e57ce03170e90d32.jpg,Tô màu – luyện chữ,Nguyễn Hoa,"My Big Animal_Con Tập Tô Cảm Xúc Rừng Xanh là cuốn tập tô thú vị, 24 trang sách chứa 23 loài động vật rừng xanh đáng yêu, cho con những giây phút thư giãn, thỏa sức sáng tạo cùng sắc màu.Không chỉ d...",23200,Megabook,2018-10-09 10:27:30,<p>22 x 27cm</p>,Bìa mềm,24,,,,,,,,
570,Vẽ Ngẫu Hứng - Những Hình Ảnh Dễ Thương,https://salt.tikicdn.com/cache/280x280/ts/product/5b/c3/ca/4f1fc040463941c14e657ad1bc250a8a.jpg,Tô màu – luyện chữ,Olga Utkina,"Vẽ ngẫu hứng là một cách để thể hiện cá tính và cảm xúc của người vẽ. Nhằm giúp trẻ em sớm bộc lộ tính cách riêng, phát triển tư duy sáng tạo ngay từ nhỏ, bộ sách Vẽ Ngẫu Hứng được thiết kế với những ...",50500,Đinh Tị,,14.5 x 19 cm,Bìa mềm,104,Nhà Xuất Bản Thanh Niên,"Minh họa: Anastasia Druzhininskaya, Maria Truschenkova, Natalia Sharovatova-Thùy Dương",,,,,,
571,Vừa Học Vừa Chơi - Bảng Chữ Cái Tiếng Anh,https://salt.tikicdn.com/cache/280x280/media/catalog/product/d/s/dsc_0019.u5426.d20170813.t082104.830602.jpg,Tô màu – luyện chữ,Minh Trang," Vừa Học Vừa Chơi - Bảng Chữ Cái Tiếng Anh  là sự kết hợp giữa hình ảnh tươi sáng, cùng với những câu hỏi thú vị sẽ khuyến khích sự tương tác và hứng thú trong học     tập. Cuốn sách giúp trẻ mở rộng...",35000,Tân Việt,2017-07-04 00:00:00,25 x 30.5 cm,Bìa mềm,32,,,,,,,,
572,"Hành Trang Giúp Bé Sẵn Sàng Vào Lớp 1: Bé Vào Lớp 1, Bé Vui Học Toán, Bé Học iQ",https://salt.tikicdn.com/cache/280x280/ts/product/96/83/5e/7b023e194fb88e20b6a9cfdb2d93692d.png,Tô màu – luyện chữ, Nhiều Tác Giả," HÀNH TRANG GIÚP CON SẴN SÀNG VÀO LỚP 1 Khởi đầu hoàn hảo với  dành cho bé Con hứng thú với những chữ số, hình học Con khao khát được làm quen với thế giới xung quanh Tiếp sức cho con - Vững tin v...",278000,An Phước Books,,,,,Nhà Xuất Bản Phụ Nữ Việt Nam,,,,,,,
573,Sticker Khủng Long: Phát Triển Trí Thông Minh Cho Trẻ Tập 4,https://salt.tikicdn.com/cache/280x280/ts/product/b7/4c/25/75214c9f53a33ed45cb84aa390195a45.jpg,Tô màu – luyện chữ,Nhiều Tác Giả,"Sticker khủng long: Phát triển trí thông minh cho trẻ 4Bộ sách dán hình khủng long thú vị, không chỉ để giải trí mà còn mang lại kiến thức cho các bạn nhỏ: Khủng long thần bí và mạnh mẽ thế nào?Khi ...",48000,Nhà sách Minh Thắng,2019-12-01 00:00:00,20.5 x 28.5cm,Bìa mềm,32,Nhà Xuất Bản Dân Trí,,,,,,,
574,Phía Sau Các Vĩ Nhân Là Đại Boss - Tặng Kèm Sổ Tay,https://salt.tikicdn.com/cache/280x280/ts/product/24/00/58/23419de81e302900c2ff272031f3e424.jpg,Tô màu – luyện chữ,Sam Kalda,"Các boss mèo sang chảnh và kiêu kỳ chiếm lĩnh mạng xã hội chắc không còn là điều xa lạ, nhưng cho tới tận cách đây không lâu, việc yêu mèo vẫn bị coi là “lập dị”, là “quái đản” và thường bị gắn với cá...",64000,AZ Việt Nam,,<p>14.5 x 21 cm</p>,Bìa mềm,112,,,,,,,,
575,Dán Hình Trang Phục Công Chúa Tuyệt Đỉnh - Công Chúa Cuốn Hút,https://salt.tikicdn.com/cache/280x280/ts/product/89/79/21/e783a821d3d2940068b44dd57887cf0a.jpg,Tô màu – luyện chữ,Ưu Ưu Thử,"3-9 tuổi là giai đoạn bộ não của trẻ phát triển nhanh nhất để có thể nhận thức được màu sắc, hình khối, đồ vật, phát triển mạnh mẽ về cả ngôn ngữ, tư duy logic và khả năng sáng tạ Cũng bởi thế mà trẻ ...",24600,Đinh Tị,,,,,Nhà Xuất Bản Thanh Niên,,,,,,,
576,Camille Tô Màu 3+ (Tái Bản),https://salt.tikicdn.com/cache/280x280/media/catalog/product/c/a/camille-to-mau_1.u4972.d20170607.t140115.181063.jpg,Tô màu – luyện chữ,Nhiều Tác Giả,"Camille Tô Màu 3+ (Tái Bản) Hãy tìm hình của Camille và Nounous thân yêu trong cuốn sách tô màu này. Dùng bút chì, bút dạ màu, hay bút lông, em hãy từ từ tô màu vào những hình đó cho thật đẹp nhé. Em...",11500,Đinh Tị,2017-06-07 00:00:00,19 x 26.5 cm,Bìa mềm,20,,,,,,,,
577,Tô Màu Công Chúa - Tập 4,https://salt.tikicdn.com/cache/280x280/ts/product/d9/1e/07/22ea72a25845bfa81c1c3659bd6ae901.jpg,Tô màu – luyện chữ,Nhiều Tác Giả,"Tô màu giúp bé phát triển tư duy, trí tuệ. Đây cũng là hình thức khơi gợi trí tưởng tượng, kích thích tinh thần ham học hỏi, khám phá thế giới xung quanh của các em. Những sắc màu tươi sáng, sinh động...",12500,Đinh Tị,2019-05-01 00:00:00,19 x 26.5cm,Bìa mềm,,,,,,,,,
578,Piano (Quyển 1C),https://salt.tikicdn.com/cache/280x280/media/catalog/product/0/0/002_3_11.jpg,Tô màu – luyện chữ,Nhà báo Nguyễn Hùng,Piano (Quyển 1C)...,45000,Đinh Tị,2016-02-04 00:00:00,,Bìa mềm,,,,,,,,,
579,1000 Hình Dán Trang Phục Công Chúa - Công Chúa Hoàn Mỹ,https://salt.tikicdn.com/cache/280x280/ts/product/be/4c/b9/a6ac8a6dba9972f20943be5b74518a06.jpg,Tô màu – luyện chữ,Muyuwenhua,"Bộ sách “1000 hình dán trang phục công chúa” là món quà đặc biệt dành tặng cho các bạn nhỏ với hàng trăm kiểu tạo hình khác nhau. Những công chúa của chúng ta giữa cảnh vật tráng lệ, trang sức tinh tế...",61500,Nhà sách Minh Thắng,,,,,Nhà Xuất Bản Dân Trí,,,,,,,
580,Combo Tủ Sách Luyện Chữ Của Bé,https://salt.tikicdn.com/cache/280x280/ts/product/23/09/15/c59b2d596c82dbcb08916a69b1de2312.jpg,Tô màu – luyện chữ,Thùy Nguyễn,"Tủ sách luyện chữ của bé gồm 05 cuốn, trong đó có cuốn Luyện những nét cơ bản để các bạn nhỏ bắt đầu tập luyện từ những nét đơn giản nhất, đến luyện chữ cái, nguyên âm, chữ hoa và luyện chữ đẹp. Bộ sá...",39000,Công ty TNHH Văn hóa & Truyền thông Trí Việt,,,Bìa mềm,156,NXB Dân Trí,,,,,,,
581,Tô Điểm Thiên Nhiên - Sách Tô Màu Và Kiến Thức Khoa Học - Biển Khơi Xanh Thẳm,https://salt.tikicdn.com/cache/280x280/media/catalog/product/t/o/to-diem-thien-nhien_bia_6-cuon-4.u5387.d20170708.t134825.197039.jpg,Tô màu – luyện chữ,"Susan Meredith,Jenny Cooper,Nelupa Hussain","Tô Điểm Thiên Nhiên - Sách Tô Màu Và Kiến Thức Khoa Học - Biển Khơi Xanh Thẳm Bộ sách “Tô Điểm Thiên Nhiên - Sách Tô Màu Và Kiến Thức Khoa Học” không chỉ là một bộ sách tô màu bình thường, các bạn sẽ...",28050,Nhà Xuất Bản Kim Đồng,2017-01-07 00:00:00,20 x 24 cm,Bìa mềm,32,,Hoàng Phương Thúy,,,,,,
