161,Nối Chấm - Tô Màu - Tập Đếm 01,https://salt.tikicdn.com/cache/280x280/ts/product/14/ee/23/58328c6ce6975b484485e2e861528baa.jpg,Tô màu – luyện chữ,Award,Tô màu không chỉ giúp bé giải trí mà còn là cách để giúp bé phát triển toàn diện. Tại sao chúng ta không thử kết hợp hoạt động tô màu với các con số nhỉ? Khi bé đã biết phân biệt màu sắc và nhận định ...,21250,NXB Trẻ,2021-04-01 00:00:00,20 x 28 cm,Bìa mềm,20,NXB Trẻ,,,,,,,
162,Sách: Tuyển Chọn Và Tự Kiểm Tra Tiếng Việt Lớp 2 - Tập 1,https://salt.tikicdn.com/cache/280x280/ts/product/68/28/13/78009b4125c7714c983c2f83bb1efb29.jpg,Tô màu – luyện chữ,"Nguyễn Tú Phương,Nguyễn Khánh Phương",Tuyển Chọn Đề Ôn Luyện Và Tự Kiểm Tra Tiếng Việt Lớp 2 (Tập 1) cung cấp hệ thống đề kiểm tra định kì từng tuần của sách giáo khoa Tiếng Việt 2 (Chương trình Tiểu học mới).Nội dung các bài kiểm tra đị...,23200,Minh Long,2019-10-01 00:00:00,14.5 x 20.5 cm,Bìa mềm,,,,,,,,,
163,Dán Hình Sáng Tạo Trang Phục Búp Bê 69N - Chúng Mình Là Bạn Thân (Tái Bản),https://salt.tikicdn.com/cache/280x280/ts/product/b3/b8/7b/322e53d88197dc51fdbc6f85d49c33af.jpg,Tô màu – luyện chữ,Usbone,"Các nàng công chúa qua đôi tay khéo léo cùng trí tưởng tượng phong phú của các bạn nhỏ sẽ dần được khoác lên mình những bộ trang phục xinh xắn, lộng lẫy, trang sức cầu kỳ, cùng kiểu tóc ngộ nghĩnh...E...",57700,Đinh Tị,2019-04-01 00:00:00,"20,5 x 26,3 cm",Bìa mềm,,,,,,,,,
164,Combo (Bộ 4 Cuốn) Cô Bé Bánh Dâu: Bộ Sưu Tập 1000 Hình Đề Can Lấp Lánh,https://salt.tikicdn.com/cache/280x280/ts/product/08/df/0e/3e308beff9d2a9f930cf2782a3e68ed2.jpg,Tô màu – luyện chữ,Children Fun,Combo (Bộ 4 Cuốn) Cô Bé Bánh Dâu: Bộ Sưu Tập 1000 Hình Đề Can Lấp LánhBộ sách giúp trẻ thỏa niềm đam mê sáng tạo nghệ thuật và phát huy trí tưởng tượng bay bổng.Được tạo ra bởi American Greetings và...,160000,Tân Việt,2020-01-01 00:00:00,20.5 x 28 cm,Bìa mềm,,Nhà Xuất Bản Mỹ Thuật,Như Lê,,,,,,
165,Bóc Dán Thông Minh - Các Phương Tiện Giao Thông,https://salt.tikicdn.com/cache/280x280/ts/product/bc/31/58/0dfc029011a8f2451fbb1e2a050e3ab4.jpg,Tô màu – luyện chữ,Gia Long,"Thông qua trò chơi dán hình, Bộ Bóc dán hình thông minh đem lại cho trẻ những kiến thức bổ ích: nhận biết các loại động vật; phương tiện giao thông; phân biệt các loại màu sắc, con số, hình dạng. Các ...",22800,Trí Việt,2019-01-09 00:00:00,20.5 x 28 cm,Bìa mềm,,,,,,,,,
166,"Combo Tập Tô Chữ, Tập Tô Nét, Tập Tô Số , Làm Quen Với Toán Học - Trọn Bộ 12 Cuốn (Dành Cho Trẻ Từ 4 - 7 Tuổi)",https://salt.tikicdn.com/cache/280x280/ts/product/47/0b/74/248e298a8877afd17b7e2517e899a637.jpg,Tô màu – luyện chữ,Nhiều Tác Giả,"Combo 12 Cuốn Tập Tô Chữ - Tập Tô Nét - Tập Tô Số - Làm Quen Với Toán Học Một trong những yêu cầu quan trọng để giúp trẻ học tốt chương trình lớp 1 là sự chuẩn bị đầy đủ các điều kiện về thể chất, tr...",60000,-,,<p>17 x 24 cm</p>,Bìa mềm,,,,,,,,,
167,Bé Vào Lớp 1 Dành Cho Bé Từ 4 - 6 Tuổi: Bé Tập Làm Toán + Bé Tập Tô Tập Ghép Vần Tập 1 Và Tập 2 + Bé Tập So Sánh + Bé Tập Tô Nét Cơ Bản + Bé Tập Tô Chữ Số + Bé tập Tô Chữ Viết Hoa + Bé Tập Tô Chữ Viết Thường (8 Cuốn),https://salt.tikicdn.com/cache/280x280/ts/product/65/1d/cc/bb2245172dff523abe2107825411b59b.jpg,Tô màu – luyện chữ,Nhâm Nguyễn,"BỘ SÁCH BÉ VÀO LỚP 1 – 8 cuốnChuẩn bị vào lớp 1, bé có bao điều bỡ ngỡ và lo lắng. Không chỉ các bé, bố mẹ cũng có những băn khoăn về việc bé có nhanh chóng hòa nhập và theo kịp chương trình học có h...",115000,An Phước Books,,,Bìa mềm,,Nhà Xuất Bản Phụ Nữ Việt Nam,,,,,,,
168,Cách Viết Chữ Thảo,https://salt.tikicdn.com/cache/280x280/ts/product/85/d2/4c/71510a38be10577b96557b50850b779b.jpg,Tô màu – luyện chữ,Zenbooks,"Chữ viết là công cụ để ghi chép lời nói, ngôn ngữ và giao lưu tư tưởng.Vì thế, cách viết chữ Thảo đơn giản đã trở thành cách viết chữ quan trọng trong đời sống của những người hiện đại, và cũng được ...",53900,Zenbooks,2019-06-01 00:00:00,21 x 29.7 cm,Bìa mềm,80,,,,,,,,
169,Vừa Tô Màu - Vừa Tập Đếm 02,https://salt.tikicdn.com/cache/280x280/ts/product/a3/4d/a0/e799a7e490d154ffc9f1c0de9d4262e3.jpg,Tô màu – luyện chữ,Award,Tô màu không chỉ giúp bé giải trí mà còn là cách để giúp bé phát triển toàn diện. Tại sao chúng ta không thử kết hợp hoạt động tô màu với các con số nhỉ? Khi bé đã biết phân biệt màu sắc và nhận định ...,20800,NXB Trẻ,2021-04-01 00:00:00,20 x 28 cm,Bìa mềm,20,NXB Trẻ,,,,,,,
170,Combo 2 túi : Chuẩn bị cho bé vào lớp 1 (túi 10 cuốn ) + Tập tô màu Mẫu Giáo ( túi 8 cuốn ),https://salt.tikicdn.com/cache/280x280/ts/product/42/c5/b0/1eb75ec8e40d01c82a449ed4db227b9a.jpg,Tô màu – luyện chữ,Nhiều Tác Giả,"CHUẨN BỊ CHO BÉ VÀO LỚP MỘT (TÚI 10 CUỐN) B102Từ mẫu giáo lên tiểu học là bước tiến quan trọng để bé bước chân vào thế giới tri thức, cũng là một bước ngoặt lớn trong cuộc đời các bé. Làm thế nào để ...",127000,Tân Việt,2019-11-14 20:59:07,,,448,,,,,,,,
171,Combo 5 Cuốn Bé Tập Làm Họa Sĩ - Bé Tô Màu (Phiên Bản Song Ngữ Việt -Anh dành cho bé 4-6 tuổi),https://salt.tikicdn.com/cache/280x280/ts/product/c0/ba/87/07e15f8033dd92134e729a2831de252d.jpg,Tô màu – luyện chữ,Nhiều Tác Giả,"Những cuốn sách tập tô chính là cây cầu nối đầu tiên giúp bé làm quen với bộ môn vẽ. Khi ngồi tô màu, bé dần dần nhận biết rõ hơn về hình khối, màu sắc, sự vật. Trọn bộ gồm nhiều chủ đề khác nhau như ...",25000,-,,<p>17 x 24 cm</p>,Bìa mềm,,,,,,,,,
172,Tập Tô Chữ Cái - Tập 2 (Kèm Bút Lông Bảng),https://salt.tikicdn.com/cache/280x280/ts/product/b4/9c/30/2c032646ebb091c92d6eaf531533122c.jpg,Tô màu – luyện chữ,Nhiều Tác Giả,"Luyện Kỹ Năng Cầm Bút Cho Bé Tự Tin Vào Lớp 1:Vừa học vừa chơi: Tô màu nối hình, đoán sốLuyện kỹ năng cầm bút, viết và xóa thỏa thíchNhận biết chữ cái, làm quen với tiếng AnhTiết kiệm, dùng được ...",44600,VanLangBooks,2021-05-01 00:00:00,20 x 26 cm,Bìa mềm,20,Nhà Xuất Bản Hồng Đức,,,,,,,
173,Sách - CÙNG BÉ HỌC TOÁN (Giúp bé tự tin vào lớp 1),https://salt.tikicdn.com/cache/280x280/ts/product/c0/44/e4/3bcdeea682ad8e582aaf25bdd26092b8.jpg,Tô màu – luyện chữ,Vân Hương," Sách - CÙNG BÉ HỌC TOÁN (Giúp bé tự tin vào lớp 1)Từ mẫu giáo lên Tiểu học là bước tiến quan trọng, trẻ cần được trang bị một nền móng vững chắc ngay từ giai đoạn tiền tiểu học. Cha mẹ nên:- Rèn ch...",18000,Công Ty TNHH Sách và Thiết Bị Giáo Dục ID,2021-04-02 09:10:20,,Bìa mềm,,Nhà Xuất Bản Đại Học Quốc Gia Hà Nội,,,,,,,
174,"Bộ Sưu Tập 200 Sticker - Số Đếm, Hình Dạng , Màu Sắc",https://salt.tikicdn.com/cache/280x280/ts/product/0c/4f/fb/4a5fa0cd3bc0cd87c2c94bf37e91e553.jpg,Tô màu – luyện chữ,Phan Minh Đạo,"Sau thành công từ các bộ sách trước, bộ sách ""200 STICKER"" là bộ sách tiếp theo thuộc TỦ SÁCH RÈN LUYỆN KỸ NĂNG CHO TRẺ TRƯỚC TUỔI ĐẾN TRƯỜNG"". Bộ sách được thiết kế đẹp mắt, sinh động. Các hình ảnh, ...",59000,Nhà sách Minh Thắng,2019-12-01 00:00:00,26x26cm,Bìa mềm,26,Nhà Xuất Bản Mỹ Thuật,,,,,,,
175, Tập Tô Số Và Hình Khối (Kèm Bút Lông Bảng),https://salt.tikicdn.com/cache/280x280/ts/product/90/8b/2a/0dd853c88454137999b22ada1a64fe86.jpg,Tô màu – luyện chữ,Nhiều Tác Giả,"Luyện Kỹ Năng Cầm Bút Cho Bé Tự Tin Vào Lớp 1:Vừa học vừa chơi: Tô màu nối hình, đoán sốLuyện kỹ năng cầm bút, viết và xóa thỏa thíchNhận biết chữ cái, làm quen với tiếng AnhTiết kiệm, dùng được ...",39500,VanLangBooks,2021-05-01 00:00:00,20 x 26 cm,Bìa mềm,16,Nhà Xuất Bản Hồng Đức,,,,,,,
176,Tô Màu Cho Giáng Sinh Rực Rỡ - Mùa Đông Không Lạnh,https://salt.tikicdn.com/cache/280x280/media/catalog/product/m/u/mua-dong-khong-lanh.jpg,Tô màu – luyện chữ,Jang Hye-jin,"Tô Màu Cho Giáng Sinh Rực Rỡ - Mùa Đông Không Lạnh Hãy tạm quên đi cái rét mướt của mùa đông cùng bầu trời đầy mây xám, bạn có thể tự thưởng cho mình những giờ phút êm đềm và tuyệt vời nhất. Hãy man...",33400,Nhà Xuất Bản Kim Đồng,2015-12-16 00:00:00,25 x 25 cm ,Bìa mềm,76,,,,,,,,
177,Dán Hình Thông Minh (Dành Cho Các Bé Từ 3 Đến 6 Tuổi) - Tập 2,https://salt.tikicdn.com/cache/280x280/media/catalog/product/d/a/dan-hinh-thong-minh-tap-2_2.jpg,Tô màu – luyện chữ,Nhóm tác giả,"Dán Hình Thông Minh (Dành Cho Các Bé Từ 3 Đến 6 Tuổi) - Tập 2 Chơi cùng hình dán Phát triển kĩ năng Tưởng tượng phán đoán Ghi nhớ, học hình... Với bộ sách dán hình thông minh, các em sẽ được chơi...",48700,Công Ty Cổ Phần Văn Hóa Đông A,2014-08-15 00:00:00,21 x 29.5 cm,Bìa mềm,24,,,,,,,,
178,Numagician - Đánh Thức Họa Sĩ Sáng Tạo Trong Bạn - FuSuSu (Sách nhỏ mà có võ),https://salt.tikicdn.com/cache/280x280/ts/product/38/75/37/910c4ab0d05485a415bd2ec91a994068.jpg,Tô màu – luyện chữ,Nguyễn Chu Nam Phương,"Pablo Picasso từng nói: Ai cũng là họa sĩ, chỉ là khi lớn lên, họ đã quên mà thôi. ​Ngày bé tôi rất thích vẽ. Tôi có thể vẽ khắp nơi, từ mặt ghế chân bàn cho tới sách vở. Nếu ai đó chiêm ngưỡng các ...",79000,NXB Đà Nẵng,2018-04-04 14:48:46,<p>14.5 x 10 cm</p>,Bìa mềm,220,,,Sách Bỏ Túi,,,,,
179,Sticker Book - Giấy Dán & Tô Màu Công Chúa 4 - Quyến Rũ (Tặng Kèm 4 Trang Sticker Dán Hình),https://salt.tikicdn.com/cache/280x280/ts/product/3f/6e/29/2e13a8df9675afa73cd7334dc474b4a5.jpg,Tô màu – luyện chữ,Minh Đạo,"Sticker book - Giấy gián & tô màu công chúa 4 - Quyến rũ (tặng kèm 4 trang sticker dán hình)Thay quần áo cho các công chúa bằng cách:"" Dán giấy"" và ""Tô màu""Để tránh sự nhàm chán, bé vừa có thể vừa ...",25100,Nhà sách Minh Thắng,2020-02-02 00:00:00,13 x 19 cm,Bìa mềm,20,Nhà Xuất Bản Dân Trí,,,,,,,
180,Tuyển Chọn Đề Ôn Luyện Và Tự Kiểm Tra Toán Lớp 3 - Tập 2 (Tái Bản),https://salt.tikicdn.com/cache/280x280/ts/product/4e/15/00/2b29babe6d2e30466245b2654274c1d5.jpg,Tô màu – luyện chữ,Trần Thị Kim Cương,"Nội dung bộ sách đã bao quát toàn bộ các kiến thức, các dạng bài thường xuất hiện trong các kì thi. Giúp nâng cao trình độ và định hướng ôn tập cho các em học sinh....",26400,Minh Long,2019-10-01 00:00:00,14.5 x 20.5 cm,Bìa mềm,,,,,,,,,
181,Dán Hình Trang Phục Công Chúa - Nàng Tiên Cá Lãng Mạn,https://salt.tikicdn.com/cache/280x280/ts/product/3a/49/a9/10580f9cf7cfde683d81fe32da292f7a.jpg,Tô màu – luyện chữ,Văn Tâm,"Bộ sách ""Dán hình trang phục công chúa"" gồm 6 tập sách in màu trên giấy dày, đẹp, có nhiều tranh vẽ và đề can dán hình sặc sỡ, sắc nét, giúp cho đôi tay các bé thêm linh hoạt, khéo léo, nhận biết được...",31200,Liên Việt,2019-06-01 00:00:00,20.5 x 28.5 cm,Bìa mềm,32,,,,,,,,
182,Bé Tập Tô - Bé Học Chữ - Chữ Cái Tiếng Việt A Ă Â,https://salt.tikicdn.com/cache/280x280/ts/product/8b/ce/99/a43c5c96e85882050e3cd5a5f43d82a8.jpg,Tô màu – luyện chữ,Runkids,"Bé tập tô – Bé học chữ là bộ sách dành cho trẻ từ 3 đến 6 tuổi. Nội dung cuốn sách thông qua các hình ảnh và hoạt động tô màu, giúp các con học số, học chữ cái tiếng Anh, tiếng Việt, từ đó giúp co...",26100,Megabook,2019-05-01 00:00:00,20.5 x 29.5 cm,Bìa mềm,20,,,,,,,,
183,Combo 2 Cuốn: Tập Viết Tiếng Anh,https://salt.tikicdn.com/cache/280x280/ts/product/81/b6/f6/07e737740becb9a8d9e5cdb063912230.jpg,Tô màu – luyện chữ,First News,"Hiện nay, tiếng Anh đã trở thành một ngôn ngữ quốc tế thông dụng và quan trọng trên mọi lĩnh vực. Vì vậy, việc học tiếng Anh là vô cùng thiết thực và cần thiết đối với tất cả mọi người nói chung và cá...",28800,First News - Trí Việt,,16 x 24 cm,Bìa mềm,,Nhà Xuất Bản Tổng hợp TP.HCM,,,,,,,
184,"Combo Vở Tập Viết Quyển 1, Quyển 2 - CÙNG HỌC ĐỂ PHÁT TRIỂN NĂNG LỰC",https://salt.tikicdn.com/cache/280x280/ts/product/47/e6/50/4480a17002268741da423d4e0848d2a3.jpg,Tô màu – luyện chữ,Hải Yến,"VỞ TẬP VIẾT được biên soạn giúp các giáo viên Lớp 1 và các con đang dùng bộ sách CÙNG HỌC ĐỂ PHÁT TRIỂN NĂNG LỰC giảm bớt rất nhiều vất vả.Bộ sách gồm 2 cuốn, mỗi cuốn 48 trang được thiết kế bám sát ...",50000,Công Ty TNHH Sách và Thiết Bị Giáo Dục ID,2020-03-22 11:49:06,,Bìa mềm,96,Nhà Xuất Bản Mỹ Thuật,,,,,,,
185,Cuộc Sống Muôn Màu - Tô Màu & Dán Hình (Tập 6),https://salt.tikicdn.com/cache/280x280/ts/product/83/b6/93/e37b6802422bbc67c43c240e9680ab4c.jpg,Tô màu – luyện chữ,Nhiều Tác Giả,Cuộc Sống Muôn Màu - Tô Màu & Dán Hình (Tập 6) Tập sách tô màu đầu tiên của bé - Thích hợp cho trẻ 2-6 tuổiTô màu có tác dụng gì đối với sự phát triển não bộ của trẻ?Tô màu không chỉ giúp rèn luy...,22750,Công Ty Cổ Phần Văn Hóa Đông A,2013-08-25 00:00:00,24 x 30 cm,Bìa mềm,26,,,,,,,,
186,Cùng Khủng Long Tập Viết Chữ Cơ Bản - Chữ Cái Tiếng Anh Viết Hoa - Quyển 4 - Sticker Bé Trai,https://salt.tikicdn.com/cache/280x280/ts/product/39/a9/91/b4c423e13291e6da46c80aaac3e4b340.jpg,Tô màu – luyện chữ,Runkids,"Cùng Khủng long tập viết chữ cơ bản là bộ sách dành cho trẻ từ 4 - 6 tuổi, giúp các con tập viết thành thạo chữ cái tiếng Anh và tiếng Việt, cả viết hoa và viết thường....",29000,Megabook,2019-11-01 00:00:00,19 x 27 cm,Bìa mềm,32,Nhà Xuất Bản Thanh Niên,,,,,,,
187,Sách Tập Đánh Vần Tập Học Chữ Tiếng Việt Tặng Kèm Thẻ Flashcard Thông Minh,https://salt.tikicdn.com/cache/280x280/ts/product/51/ec/c1/ac8ed5719ab16b482188e32765b5cee0.jpg,Tô màu – luyện chữ, Thanh Hương,Sách Tập Đánh Vần Tập Học Chữ Tiếng Việt Tặng Kèm Thẻ Flashcard Thông MinhSản phẩm giúp bé học đánh vần tiếng việt chỉ trong 2 tháng họcSản phẩm được chứng nhận và kiểm định chất lượng phù hợp với ...,85000,Nhà Xuất Bản Hà Nội,2020-04-28 15:17:53,,,,Nhà Xuất Bản Hà Nội,,,,,,,
188,Tập Tô Màu Nhà Trẻ - Chủ Đề Động Vật,https://salt.tikicdn.com/cache/280x280/media/catalog/product/i/m/img371_1_5.jpg,Tô màu – luyện chữ,Khánh Hòa,"Tập Tô Màu Nhà Trẻ - Chủ Đề Động Vật Bộ sách Bé tập tô màu nhà trẻ với nhiều chủ đề khác nhau, không chỉ rèn khả năng khéo léo, sự linh hoạt của đôi tay mà còn hình thành khả năng nhận biết ở trẻ thô...",7500,Minh Long,2014-06-20 00:00:00,17 x 24 cm,Bìa mềm,16,,,,,,,,
189,Tô Màu Thông Minh - Chúng Mình Cùng Tô Quyền Hoa (Cho Bé Từ 2- 6 Tuổi),https://salt.tikicdn.com/cache/280x280/ts/product/3b/32/08/5b82c72382e7eb749a4c316faf827248.jpg,Tô màu – luyện chữ,Minh Thư,"Cuốn sách về tô màu với hình ảnh tươi sáng sống động, được chi ra 4 cấp độ theo hình ảnh sự trưởng thành của một cái cây....",23280,Tân Việt,2021-06-15 00:00:00,22.5 x 22.5 cm,Bìa mềm,47,Nhà Xuất Bản Mỹ Thuật,,,,,,,
190,Combo Bộ 4  Cuốn Tô Màu Thông Minh - Chúng Mình Cùng Tô: Quyển Hạt + Quyển Mầm + Quyền Hoa +  Quyển Lá (Cho Bé Từ 2- 6 Tuổi),https://salt.tikicdn.com/cache/280x280/ts/product/a6/78/6c/2ada5241dfc00992f1ee78ce9a9f0e60.jpg,Tô màu – luyện chữ,Minh Thư,"Bộ combo gồm 4 cuốn sách về tô màu. Hình ảnh tươi sáng sống động, được chi ra 4 cấp độ theo hình ảnh sự trưởng thành của một cái cây....",91500,Tân Việt,2021-06-15 00:00:00,22.5 x 22.5 cm,Bìa mềm,,Nhà Xuất Bản Mỹ Thuật,Minh Thư (Biên soạn),,,,,,
191,Tô Màu Thông Minh - Chúng Mình Cùng Tô Quyền Mầm (Cho Bé Từ 2- 6 Tuổi),https://salt.tikicdn.com/cache/280x280/ts/product/92/92/9a/b8b13b4f4b006d8c9d44f34ecfad13e8.jpg,Tô màu – luyện chữ,Minh Thư,"Cuốn sách về tô màu với hình ảnh tươi sáng sống động, được chi ra 4 cấp độ theo hình ảnh sự trưởng thành của một cái cây....",23280,Tân Việt,2021-06-15 00:00:00,22.5 x 22.5 cm,Bìa mềm,47,Nhà Xuất Bản Mỹ Thuật,,,,,,,
192,Bé Tập Tô - Bé Học Chữ - Chữ Cái Tiếng Anh Abc,https://salt.tikicdn.com/cache/280x280/ts/product/9b/d8/ed/2a050b76daf59cbc1ed4a0ca6a8e98a0.jpg,Tô màu – luyện chữ,Runkids,"Bé tập tô – Bé học chữ là bộ sách dành cho trẻ từ 3 đến 6 tuổi. Nội dung cuốn sách thông qua các hình ảnh và hoạt động tô màu, giúp các con học số, học chữ cái tiếng Anh, tiếng Việt, từ đó giúp co...",26100,Megabook,2019-05-01 00:00:00,20.5 x 29.5 cm,Bìa mềm,18,,,,,,,,
193,Cùng Khủng Long Tập Viết Chữ Cơ Bản - Chữ Cái Tiếng Anh Viết Thường - Quyển 5 - Sticker Bé Trai,https://salt.tikicdn.com/cache/280x280/ts/product/06/4c/2c/d9a2d741657758b6ae72e78751b6c629.jpg,Tô màu – luyện chữ,Runkids,"Cùng Khủng long tập viết chữ cơ bản là bộ sách dành cho trẻ từ 4 - 6 tuổi, giúp các con tập viết thành thạo chữ cái tiếng Anh và tiếng Việt, cả viết hoa và viết thường....",26700,Megabook,2019-11-01 00:00:00,19 x 27 cm,Bìa mềm,32,Nhà Xuất Bản Thanh Niên,,,,,,,
194,Bộ Sách Tô Màu Thú Vị 1 (Bộ 5 Cuốn),https://salt.tikicdn.com/cache/280x280/ts/product/83/fb/98/2dd320a87bc5b7c265bbeb19f1e7d7ea.jpg,Tô màu – luyện chữ,"Nhiều Tác Giả,Nhiều Tác Giả,Nhiều tác giả,Nhiều Tác Giả ,Nhiều Tác giả","Bộ sách Tô Màu Thú Vị 1, bao gồm các cuốn: - Dễ Dàng - Xuất Sắc - Rực Rỡ - Đáng Yêu - Vui Nhộn...",75500,Tân Việt,,,,,,,,,,,,
195,Vừa Tô Màu - Vừa Tập Đếm 04,https://salt.tikicdn.com/cache/280x280/ts/product/21/46/ce/0dd9eb54cd800ce1dfb58b5883c172a4.jpg,Tô màu – luyện chữ,Award,Tô màu không chỉ giúp bé giải trí mà còn là cách để giúp bé phát triển toàn diện. Tại sao chúng ta không thử kết hợp hoạt động tô màu với các con số nhỉ? Khi bé đã biết phân biệt màu sắc và nhận định ...,20800,NXB Trẻ,2021-04-01 00:00:00,20 x 28 cm,Bìa mềm,20,NXB Trẻ,,,,,,,
196,Vừa Tô Màu Vừa Học - Động Vật Ở Biển,https://salt.tikicdn.com/cache/280x280/ts/product/39/f3/a9/b58b641a91525a282d00b07a3c83a5f7.jpg,Tô màu – luyện chữ,Hà Linh Minh,"Dạy bé nhận biết các con vật từ hình dáng, tên gọi và một số đặc điểm thú vị của chúng bằng những hình vẽ đơn giản mà sinh động, và những đoạn văn với những từ khóa được in đậm, tăng kiến thức về thế ...",17900,NXB Trẻ,2019-04-01 00:00:00,19 x 26 cm,Bìa mềm,24,,,,,,,,
197,Bé Trai Dán Hình - Xe Tải,https://salt.tikicdn.com/cache/280x280/media/catalog/product/x/e/xe tai.u547.d20160922.t084912.382342.jpg,Tô màu – luyện chữ,Fleurus,"Bé Trai Dán Hình - Xe Tải Bé thích xe đỏ của các chú lính cứu hỏa hay xe vàng của bác đưa thư? Trong cuốn sách này xe gì cũng có, nhờ bé giúp các bác tài cho xe bon bon trên đường bằng những hình dán...",31500,Công Ty Cổ Phần Văn Hóa Đông A,2016-09-21 00:00:00,21.5 x 28.5 cm ,Bìa mềm,12,,,,,,,,
198,200 Miếng Bóc Dán TM PT Chỉ Số Tình Cảm EQ T2 - Dành Cho Trẻ 2-10 Tuổi (Tái Bản 2018),https://salt.tikicdn.com/cache/280x280/ts/product/68/3b/e1/083e28e7a56a87e0a602c6ed8f6331b9.jpg,Tô màu – luyện chữ,"Cung Huân,Ngọc Linh","  200 Miếng Bóc Dán TM PT Chỉ Số Tình Cảm EQ T2 - Dành Cho Trẻ 2-10 Tuổi (Tái Bản 2018)  Đây là cuốn sách được tuyển chọn và những trò chơi dán hình, giúp cho đôi tay của các em thêm linh hoạt, ...",46300,Đinh Tị,,21 x 28.5 cm,Bìa mềm,,,,,,,,,
199,Dán Hình Trang Phục Công Chúa - Công Chúa Tóc Mây,https://salt.tikicdn.com/cache/280x280/ts/product/1c/24/88/dc4e2eb53a4c2677f4ac0bc5533a583a.jpg,Tô màu – luyện chữ,Văn Tâm,"Bộ sách ""Dán hình trang phục công chúa"" gồm 6 tập sách in màu trên giấy dày, đẹp, có nhiều tranh vẽ và đề can dán hình sặc sỡ, sắc nét, giúp cho đôi tay các bé thêm linh hoạt, khéo léo, nhận biết được...",31200,Liên Việt,2019-06-01 00:00:00,20.5 x 28.5 cm,Bìa mềm,32,,,,,,,,
200,"Bộ 6 Cuốn Vừa Tô Màu Vừa Học Cho Bé 3 Tuổi: Bé Tô Màu Phương Tiện Giao Thông, Tô Màu Khủng Long, Côn Trùng, Pokemon, Nhân Vật Hoạt Hình, Tô Hình Siêu Nhân",https://salt.tikicdn.com/cache/280x280/ts/product/ce/cf/18/a386bdcce814374f37f52eb365711e90.png,Tô màu – luyện chữ,Sao Bùi,"BỘ 6 CUỐN SÁCH TẬP TÔ MÀU CHO BÈ TỪ 3 TUỔIĐược thiết kế sáng tạo với tạo hình của một chú heo con, bộ sách tô màu xinh đẹp này sẽ giúp bé rèn tính kiên nhẫn, rèn vận động tinh của đôi tay, khéo léo h...",67000,Công ty TNHH An Phước Books Việt Nam,,,Bìa mềm,,Nhà Xuất Bản Phụ Nữ Việt Nam,,,,,,,
201,Combo Tô Màu Công Chúa Sáng Tạo (5 Cuốn),https://salt.tikicdn.com/cache/280x280/ts/product/3a/ba/a2/92baa0476a379e8965dfbb800c2917c9.jpg,Tô màu – luyện chữ,Ngô Cảnh,Các bạn nhỏ hãy cùng sưu tập trọn bộ ảnh thẻ công chúa được tặng kèm trên mỗi cuốn sách nhé.Bộ sách Tô màu công chúa sáng tạo gồm 5 cuốn:Những nàng công chúa đại dươngNhững nàng công chúa sành điệ...,80000,Đinh Tị,2019-10-01 00:00:00,19 x 26.5 cm,Bìa mềm,,Nhà Xuất Bản Hà Nội,,,,,,,
202,1000 Hình Dán Trang Phục Công Chúa - Công Chúa Hoa Lan Hồ Điệp,https://salt.tikicdn.com/cache/280x280/ts/product/c9/6a/e8/175d7f0a7acc322c6ffbcf38ef3c33f8.jpg,Tô màu – luyện chữ,Mật Đào,"pBộ dán hình ""strongCông chúa Vương Quốc Hoa/strong"" là món quà mà họa sĩ Mật Đào đặc biệt dành tặng cho các bạn nhỏ với hàng trăm kiểu tạo hình khác nhau. Những công chúa của chúng ta giữa cảnh vật t...",49300,Nhà sách Minh Thắng,2020-05-12 00:00:00,21.5 x 28.5 cm,Bìa mềm,38,Nhà Xuất Bản Phụ Nữ Việt Nam,Phạm Hồng,,,,,,
