327,Bé Khéo Tay - Động Vật Đáng Yêu,https://salt.tikicdn.com/cache/280x280/media/catalog/product/d/v/dv_1.jpg,Tô màu – luyện chữ,NXB Triết Giang,"Bé Khéo Tay - Động Vật Đáng Yêu Có  bao giờ bạn quan sát các con làm một món đồ thủ công nào đó chưa? Có phải nhìn các  bé rất chăm chú, đam mê và đầy nhiệt huyết không? Thông qua việc  làm thủ công,...",44200,Công Ty Cổ Phần Văn Hóa Đông A,2012-12-20 00:00:00,26.4 x 25.2 cm,Bìa mềm,15,,Ngô Minh Vân,,,,,,
328,Sách - Công chúa nhỏ (tặng kèm bookmark thiết kế),https://salt.tikicdn.com/cache/280x280/ts/product/d3/0c/ae/8c4e6ea3ecf831a8dee9674ffd12e5c3.jpg,Tô màu – luyện chữ,Frances Hodgson Burnett,       Tác giả: Frances Hodgson Burnett   Dịch giả: Nguyên Tâm   Nhà xuất bản: Hội nhà văn   Số trang: 272   Kích thước: 15 x 24 cm   Ngày phát hành: 09-2018   Nhưng rồi một biến cố trọng đạ...,60060,Nhã Nam,,,,,Nhà Xuất Bản Hội Nhà Văn,,,,,,,
329,Túi Tô Màu Phương Tiện Giao Thông (Song Ngữ Anh-Việt) - Trọn Bộ 6 Cuốn,https://salt.tikicdn.com/cache/280x280/ts/product/7b/30/20/efbe9f15de9fc8a79c6e8ef286e80171.jpg,Tô màu – luyện chữ,Phan Minh Đạo,"Ở lứa tuổi mẫu giáo, bé bắt đầu tìm hiểu về thế giới vạn vật xung quanh. Chính vì vậy việc giúp bé học và tham gia các trò chơi phù hợp đóng vai trò rất quan trọng.Bộ tô màu với rất nhiều hình ảnh ph...",53500,Nhà sách Minh Thắng,2019-02-02 00:00:00,19 x 27 cm,Bìa mềm,,,,,,,,,
330,Tủ Sách Bé Vào Lớp 1 - Bé Tập Tô Và Làm Quen Với Chữ Cái (Tập 1)(Tái Bản),https://salt.tikicdn.com/cache/280x280/ts/product/97/d6/2b/f68b6bc8c2f712369d6247237beb8473.jpg,Tô màu – luyện chữ,"Lê Tuệ Minh,Lê Thu Ngọc","Một trong những yêu cầu quan trọng để giúp trẻ học tốt chương trình lớp 1 là sự chuẩn bị đầy đủ các điều kiện về thể chất, trí tuệ, tình cảm, ngôn ngữ và một số kỹ năng cần thiết. Vì vậy, trẻ cần được...",8800,Minh Long,2019-10-01 00:00:00,14.5 x 20.5 cm,Bìa mềm,,Nhà Xuất Bản Mỹ Thuật,,,,,,,
331,Cuộc Sống Muôn Màu - Tô Màu & Dán Hình (Tập 1),https://salt.tikicdn.com/cache/280x280/media/catalog/product/t/o/to-mau-va-dan-hinh-1-a.jpg,Tô màu – luyện chữ,Nhiều Tác Giả,Cuộc Sống Muôn Màu - Tô Màu & Dán Hình (Tập 1) Tập sách tô màu đầu tiên của bé - Thích hợp cho trẻ 2-6 tuổiTô màu có tác dụng gì đối với sự phát triển não bộ của trẻ?Tô màu không chỉ giúp rèn luy...,26250,Công Ty Cổ Phần Văn Hóa Đông A,2013-08-25 00:00:00,24 x 30 cm,Bìa mềm,26,,,,,,,,
332,Dán Hình Trang Phục Công Chúa - Công Chúa Hồng Âm Áp,https://salt.tikicdn.com/cache/280x280/ts/product/91/3d/11/327ecdc914f67a864a7fe8316f324c4d.jpg,Tô màu – luyện chữ,Văn Tâm,"Bộ sách ""Dán hình trang phục công chúa"" gồm 6 tập sách in màu trên giấy dày, đẹp, có nhiều tranh vẽ và đề can dán hình sặc sỡ, sắc nét, giúp cho đôi tay các bé thêm linh hoạt, khéo léo, nhận biết được...",31200,Liên Việt,2019-06-01 00:00:00,20.5 x 28.5 cm,Bìa mềm,32,,,,,,,,
333,Bé Làm Quen Với Chữ Cái - Danh Cho Trẻ 5-6 Tuổi - Combo Tủ Sách Mầm Non,https://salt.tikicdn.com/cache/280x280/ts/product/a8/9b/d7/732d6eab6427f1f734c18d2beef4d031.jpg,Tô màu – luyện chữ,Chính Bình,"Bé Làm Quen Với Chữ Cái - Danh Cho Trẻ 5-6 Tuổi - Combo Tủ Sách Mầm NonBé làm quen và tập tô các nét cơ bản, chữ số và chữ cái.Bé Làm Quen Với Các Nét Cơ bảnBé Làm Quen Với Chữ SốBé Làm Quen Với Chữ...",45000,Công Ty TNHH TM & DV Văn Hóa Giáo Dục Phía Nam,2020-11-20 15:53:39,,Bìa mềm,32,Nhà Xuất Bản Đồng Nai,,,,,,,
334,Túi Tô Màu Rau-Củ-Quả Song Ngữ Anh-Việt,https://salt.tikicdn.com/cache/280x280/ts/product/96/97/27/b2bc74b4529a4c06dd21920110d4c468.jpg,Tô màu – luyện chữ,Phan Minh Đạo,            Túi Tô Màu Rau-Củ-Quả Song Ngữ Anh-Việt        Tô màu có thể coi là một trong những môn học đơn giản và hiệu quả mang lại rất nhiều lợi ích cho bé ở lứa tuổi mẫu giáo.    Không chỉ ...,57600,Nhà sách Minh Thắng,2018-01-01 00:00:00,19 x 27 cm,Bìa mềm,,Nhà Xuất Bản Mỹ Thuật,,,,,,,
335,Dán Hình Thông Minh (Dành Cho Các Bé Từ 3 Đến 6 Tuổi) - Tập 3,https://salt.tikicdn.com/cache/280x280/ts/product/67/d8/db/2b7e16ff89658b8e740459f9ace55107.jpg,Tô màu – luyện chữ,Nhóm tác giả,"Dán Hình Thông Minh (Dành Cho Các Bé Từ 3 Đến 6 Tuổi) - Tập 3 Chơi cùng hình dán Phát triển kĩ năng Tưởng tượng phán đoán Ghi nhớ, học hình... Với bộ sách dán hình thông minh, các em sẽ được chơi...",38350,Công Ty Cổ Phần Văn Hóa Đông A,2014-08-15 00:00:00,21 x 29.5 cm,Bìa mềm,24,,,,,,,,
336,Tô Màu Bóc Dán - Sân Bay - Airport,https://salt.tikicdn.com/cache/280x280/ts/product/56/49/3a/6bbb5fc687affcbbf424a85ddeaed0eb.jpg,Tô màu – luyện chữ,Benedetta Giaufret,"Trong sân bay, hành khách đang hối hả cho kịp giờ khởi hành, những chiếc máy bay cất cánh và hạ cánh mỗi ngày trên các đường băng. Nhưng sân bay lúc này trông thật mờ nhạt. Chúng ta hãy thử tài tô màu...",13900,Đinh Tị,2018-10-01 00:00:00,19 x 24 cm,Bìa mềm,16,,Jean - Pierre D.L.B,,,,,,
337,Miếng Dán Thần Kỳ 2-3 Tuổi,https://salt.tikicdn.com/cache/280x280/ts/product/b9/03/f5/d74189b3e7879360e8ebb0110808c9a0.jpg,Tô màu – luyện chữ,NXB Bang Son,"Nội dung sách:Chắc hẳn ba mẹ nào cũng mong con mình sẽ thông minh, giàu cảm xúc và dồi dào khả năng sáng tạo. Nhưng làm thế nào để giúp trẻ có được sự phát triển toàn diện ấy?Bộ sách Miếng dán thần ...",27300,Đông A,,,Bìa mềm,25,NXB Dân Trí,,,,,,,
338,Tủ Sách Bé Vào Lớp Một - Bé Làm Quen Với Chữ Cái Và Tập Tô Chữ,https://salt.tikicdn.com/cache/280x280/ts/product/ef/0f/07/bb14e18dfa448fe62d07c4e386f8d13a.jpg,Tô màu – luyện chữ,Lê Tuệ Minh - Lê Thu Ngọc,"Một trong những yêu cầu quan trọng để giúp trẻ học tốt chương trình lớp 1 là sự chuẩn bị đầy đủ các điều kiện về thể chất, trí tuệ, tình cảm, ngôn ngữ và một số kỹ năng cần thiết. Vì vậy, trẻ cần được...",8000,Minh Long,,,Bìa mềm,23,,,,,,,,
339,Dán Hình Sáng Tạo Trang Phục Búp Bê 69N - Bộ Sưu Tập Mùa Xuân (Tái Bản),https://salt.tikicdn.com/cache/280x280/ts/product/44/a9/96/2b7ef8ff01b8874d9e4f1fe2a424164b.jpg,Tô màu – luyện chữ,Usbone,"Các nàng công chúa qua đôi tay khéo léo cùng trí tưởng tượng phong phú của các bạn nhỏ sẽ dần được khoác lên mình những bộ trang phục xinh xắn, lộng lẫy, trang sức cầu kỳ, cùng kiểu tóc ngộ nghĩnh...E...",68500,Đinh Tị,2019-04-01 00:00:00,"20,5 x 26,3 cm",Bìa mềm,,,,,,,,,
340,300 Miếng Bóc Dán Thông Minh - Khả Năng Sáng Tạo,https://salt.tikicdn.com/cache/280x280/ts/product/9d/be/c2/07bda8a528513369006e56f359d914a7.jpg,Tô màu – luyện chữ,Ưu Ưu Thử,"3-6 tuổi là giai đoạn bộ não của trẻ phát triển nhanh nhất để có thể nhận thức được màu sắc, hình khối, đồ vật, phát triển mạnh mẽ về cả ngôn ngữ, tư duy logic và khả năng sáng tạ Cũng bởi thế mà trẻ ...",24000,Đinh Tị,,,,,Nhà Xuất Bản Thanh Niên,,,,,,,
341,Bé Tập Tô Màu - Phương Tiện Giao Thông (2014),https://salt.tikicdn.com/cache/280x280/media/catalog/product/i/m/img054.u547.d20160531.t112754.jpg,Tô màu – luyện chữ,Trần Ngọc Bảo Hân,"Bé Tập Tô Màu - Phương Tiện Giao Thông Tô màu là hình thức kích thích trí tưởng tượng cũng như hình thành tư duy cho các bé mẫu giáo. Tô màu giúp các bé làm quen với thế giới màu sắc, làm quen với sự...",9600,Công Ty CP Văn Hóa Nhân Văn,2014-03-13 00:00:00,19 x 27 cm ,Bìa mềm,20,,,,,,,,
342,300 Miếng Bóc Dán Thông Minh - Phát Triển Tư Duy,https://salt.tikicdn.com/cache/280x280/ts/product/fc/1e/d7/fcc1460dba0f9a7feeae17a6c296b525.jpg,Tô màu – luyện chữ,Ưu Ưu Thử,"3-6 tuổi là giai đoạn bộ não của trẻ phát triển nhanh nhất để có thể nhận thức được màu sắc, hình khối, đồ vật, phát triển mạnh mẽ về cả ngôn ngữ, tư duy logic và khả năng sáng tạ Cũng bởi thế mà trẻ ...",24000,Đinh Tị,,,,,Nhà Xuất Bản Thanh Niên,,,,,,,
343,Bé Ơi Tô Màu Các Loài Hoa,https://salt.tikicdn.com/cache/280x280/ts/product/26/f0/88/86e9b9b526a1b3f595085f57e0e76ac2.jpg,Tô màu – luyện chữ,Hà Vy,"Tập tô màu là hoạt động ưa thích của các bé. Hoạt động này không những giúp rèn luyện đôi tay khéo léo, đức tính kiên trì mà còn có thể bồi dưỡng cho bé khả năng nhận biết màu sắc, phát triển óc sáng ...",10000,Nhà Sách Hà Vy,2019-01-05 00:00:00,16 x 24 cm,Bìa mềm,22,,,,,,,,
344,Sách : Tô Màu Mẫu Giáo 8 cuốn + Bút Sáp Dầu 18 Màu Duka,https://salt.tikicdn.com/cache/280x280/ts/product/4f/16/f0/86506a17848e78fef38e614a25b2b5eb.jpg,Tô màu – luyện chữ,Trung Kiên,"Sách : Tô Màu Mẫu Giáo 8 cuốn + Bút Sáp Dầu 18 Màu DukaViệc giáo dục con cái cần bắt đầu từ sớm. Đa số các bé còn chưa biết cầm bút, các bé thường vẽ linh tinh khắp nơi. Dạy bé tô màu là một cách để ...",79000,Minh Long,2012-06-04 08:00:00,,Bìa mềm,128,nxb my thuat,,Thường,,,,,
345,Hành Trang Cho Bé Vào Lớp 1 - Vở Bé Tập Viết - Dành Cho Trẻ 5- 6- Tuổi - Quyển 1 - Tái Bản,https://salt.tikicdn.com/cache/280x280/ts/product/f0/0d/ce/fab19271eb3035f5cccf040f16cc5a44.jpg,Tô màu – luyện chữ,Lê Hồng Đăng - Lê Thị Ngọc Ánh,"Hành Trang Cho Bé Vào Lớp 1 - Vở Bé Tập Viết (Dành Cho Trẻ 5 - 6 Tuổi) - Quyển 1 - Tái BảnHành Trang Cho Bé Vào Lớp 1 là bộ sách giúp trẻ chuẩn bị những kiến thức, kỹ năng cơ bản trước khi bước vào l...",12000,Minh Long,,,Bìa mềm,36,,,,,,,,
346,Bé Khéo Tay - Công Trình Kiến Trúc,https://salt.tikicdn.com/cache/280x280/ts/product/92/de/37/041a9423f02552377346dce0b5acf894.jpg,Tô màu – luyện chữ,NXB Triết Giang,"Bé Khéo Tay - Công Trình Kiến Trúc Có bao giờ bạn quan sát các con làm một món đồ thủ công nào đó? Nhìn các  bé rất chăm chú, đam mê và đầy nhiệt huyết phải không? Thông qua việc  làm thủ công, các b...",44200,Công Ty Cổ Phần Văn Hóa Đông A,2012-12-31 07:00:00,26.4 x 25.2 cm,Bìa mềm,15,,Ngô Minh Vân,,,,,,
347,300 Miếng Bóc Dán Thông Minh - Rèn Luyện Thói Quen Tốt,https://salt.tikicdn.com/cache/280x280/ts/product/44/93/64/611c1259d243231d3fe9835465937cdf.jpg,Tô màu – luyện chữ,Ưu Ưu Thử,"3-6 tuổi là giai đoạn bộ não của trẻ phát triển nhanh nhất để có thể nhận thức được màu sắc, hình khối, đồ vật, phát triển mạnh mẽ về cả ngôn ngữ, tư duy logic và khả năng sáng tạ Cũng bởi thế mà trẻ ...",24000,Đinh Tị,,,,,Nhà Xuất Bản Thanh Niên,,,,,,,
348,Cuộc Sống Muôn Màu - Tô Màu & Dán Hình (Tập 2),https://salt.tikicdn.com/cache/280x280/ts/product/aa/8e/f3/7e5e1926607446f81caac5d445224f72.jpg,Tô màu – luyện chữ,Nhiều Tác Giả,Cuộc Sống Muôn Màu - Tô Màu & Dán Hình (Tập 2) Tập sách tô màu đầu tiên của bé - Thích hợp cho trẻ 2-6 tuổiTô màu có tác dụng gì đối với sự phát triển não bộ của trẻ?Tô màu không chỉ giúp rèn luy...,22750,Công Ty Cổ Phần Văn Hóa Đông A,2013-08-25 00:00:00,24 x 30 cm,Bìa mềm,26,,,,,,,,
349,COMBO TÔ CHỮ CHUẨN BỊ CHO BÉ VÀO LỚP 1 (8 cuốn) -NXB Hà Nội,https://salt.tikicdn.com/cache/280x280/ts/product/b4/43/f7/b13ec1f018228f9e50ac726d5402bc0d.jpg,Tô màu – luyện chữ,Nguyễn Chí Phúc," TỦ SÁCH DÀNH CHO BÉ - CHUẨN BỊ CHO BÉ VÀO LỚP 1 (8 cuốn)  còn / bộ, 8 cuốn của NXB Hà Nội Từ mẫu giáo lên tiểu học là bước tiến quan trọng để bé bước chân vào thế giới tri thức, cũng là một bước ngo...",50000,Công ty CP in Thương Mại Nam Hải,2021-01-08 15:27:56,,Bìa cứng,20,Nhà Xuất Bản Hà Nội,,,,,,,
350,Dán Hình Sáng Tạo Trang Phục Búp Bê - Buổi Dạ Hội Đáng Nhớ (Tái Bản),https://salt.tikicdn.com/cache/280x280/ts/product/31/a8/72/798150e6a2088bd9ae9fe37c0e84fb22.jpg,Tô màu – luyện chữ,Nhiều Tác Giả,Bộ sách Dán hình sáng tạo trang phục búp bê giúp bé thỏa sức sáng tạo ra các tác phẩm tuyệt đẹp.Các nàng búp bê qua đôi tay khéo léo cùng trí tưởng tượng phong phú của các bạn nhỏ sẽ dần được khoác l...,62100,Đinh Tị,2019-05-01 00:00:00,20.5 x 26.3cm,Bìa mềm,24,Nhà Xuất Bản Thanh Niên,,,,,,,
351,Sticker Dolly Dressing - Dán Hình Sáng Tạo Trang Phục Búp Bê - Nàng Bạch Tuyết,https://salt.tikicdn.com/cache/280x280/ts/product/95/82/4d/356c1680492ea2137d48cfe20a3b43a9.jpg,Tô màu – luyện chữ,Fiona Watt,Bộ sách Dán hình sáng tạo trang phục búp bê giúp bé thỏa sức sáng tạo ra các tác phẩm tuyệt đẹp.Các nàng búp bê qua đôi tay khéo léo cùng trí tưởng tượng phong phú của các bạn nhỏ sẽ dần được khoác l...,44000,Đinh Tị,,17 x 24 cm,Bìa mềm,34,Nhà Xuất Bản Thanh Niên,Tranh: Antonia Miller-Biên dịch: Minh Trang,,,,,,
352,Chuẩn Bị Cho Bé Vào Lớp Một Dành Cho Bé 5 - 6 Tuổi (  5 Cuốn ),https://salt.tikicdn.com/cache/280x280/ts/product/4b/0a/d4/657e2dc8af719ce7ed85b2bbaf3fb831.jpg,Tô màu – luyện chữ,Minh Tâm,"Bộ sách bao gồm các cuốn sách : bé tập viết nét cơ bản, bé tập viết chữ cái, bé tập viết chữ số, vở tập viết có mẫu chữ quyển 1,vở tập viết có mẫu chữ quyển 2...",59250,Nhà Sách Hồng Ân,2017-05-01 00:00:00,19x27,Bìa mềm,155,Nhà Xuất Bản Hải Phòng,,,,,,,
353,Luyện Tập Làm Văn 4 (Tái Bản),https://salt.tikicdn.com/cache/280x280/ts/product/f9/b6/eb/fe915b6c711ce004ba74a4ef8e5adfb6.jpg,Tô màu – luyện chữ,"Nguyễn Khánh Phương,Nguyễn Tú Phương","Cuốn sách giúp các em học sinh ôn luyện và rèn luyện kỹ năng tập làm văn đã học trên lớp một cách hiệu quả, đưa ra những câu gợi ý, hướng dẫn, tham khảo tùy từng dạng bài tập. Về cơ bản, các bái tập p...",26000,Minh Long,2019-10-01 00:00:00,14.5 x 20.5 cm,Bìa mềm,,Nhà Xuất Bản Đại Học Sư Phạm,,,,,,,
354,Bé Tập Tô Màu - Bò Sát Và Côn Trùng,https://salt.tikicdn.com/cache/280x280/media/catalog/product/i/m/img058.u547.d20160531.t114643.jpg,Tô màu – luyện chữ,Trần Ngọc Bảo Hân,"Bé Tập Tô Màu - Bò Sát Và Côn Trùng  Tô màu là hình thức kích thích trí tưởng tượng cũng như hình thành tư duy cho các bé mẫu giáo. Tô màu giúp các bé làm quen với thế giới màu sắc, làm quen với sự v...",9600,Công Ty CP Văn Hóa Nhân Văn,2014-03-13 00:00:00,19 x 27 cm ,Bìa mềm,20,,,,,,,,
355,Vừa Tô Màu Vừa Học - Thú Nhỏ Đáng Yêu,https://salt.tikicdn.com/cache/280x280/ts/product/e0/43/6a/7c1349f026d1de1f26bfa7198266bfb6.jpg,Tô màu – luyện chữ,Hà Linh Minh,"Vừa Tô Màu Vừa Học - Thú Nhỏ Đáng YêuDạy bé nhận biết các con vật từ hình dáng, tên gọi và một số đặc điểm thú vị của chúng bằng những hình vẽ đơn giản mà sinh động, và những đoạn văn với những từ kh...",16500,NXB Trẻ,2019-04-01 00:00:00,19 x 26 cm,Bìa mềm,24,,,,,,,,
356,"Vở Ô Ly Có Chữ Mẫu Luyện Viết Chữ Đẹp - Chữ Nghiêng, Chữ Viết Thường - Tập 2 (Tái Bản)",https://salt.tikicdn.com/cache/280x280/ts/product/2b/fd/ce/2437db12e376d61828179e1ab787fa18.jpg,Tô màu – luyện chữ,"Chính An, Nhóm Giáo Viên ĐHSP","Luyện chữ đẹp, rèn tính nết.   Các em chú ý:   1. Tư thế ngồi viết   Đầu hơi cúi, không tì ngực xuống bàn   Mắt cách vở khoảng 20-25cm   Tay phải cầm bút, tay trái tì nhẹ lên mép vở để giữ.   Lư...",9840,Cty TNHH TM&DV VH GD Phía Nam,,,,,Nhà Xuất Bản Đồng Nai,,,,,,,
357,Bộ sách bé tập tô và đọc truyện- Truyện cổ tích thế giới song ngữ Việt Anh bộ 8 cuốn,https://salt.tikicdn.com/cache/280x280/ts/product/50/ba/94/9d3482e8b68009ae42d06c3deee00148.jpg,Tô màu – luyện chữ,Nguyễn Chí Phúc,Bộ sách bé tập tô và đọc truyện- Truyện cổ tích thế giới song ngữ Việt Anh bộ 8 cuốn ...,69000,Wabooks,,,Bìa mềm,10,Nhà Xuất Bản Hà Nội,,2021,,,,,
358,Thước Đo Chiều Cao - Động Vật Hoang Dã (Trí Việt),https://salt.tikicdn.com/cache/280x280/ts/product/ad/a3/3d/77defca12486d7924b56acbb2f6950a1.jpg,Tô màu – luyện chữ,Nhiều Tác Giả,"Thước Đo Chiều Cao - Động Vật Hoang Dã (Trí Việt) Chiều cao của trẻ luôn được các bà mẹ đặc biệt quan tâm, bởi nó liên quan mật thiết tới sức khỏe và sự phát triển của trẻ. Nếu trẻ thấp hơn chiều cao...",24000,Trí Việt,2014-06-20 00:00:00,29 x 30 cm,Bìa mềm,,,,,,,,,
359,"Vở Ô Ly Có Chữ Mẫu Luyện Viết Chữ Đẹp - Nét Thanh Nét Đậm, Chữ Viết Hoa - Tập 2 (Tái Bản)",https://salt.tikicdn.com/cache/280x280/ts/product/cf/8d/c7/3f6f3d8672d98a6c3bb2bc3e1e8c526c.jpg,Tô màu – luyện chữ,"Chính An, Nhóm Giáo Viên ĐHSP","Luyện chữ đẹp, rèn tính nết.   Các em chú ý:   1. Tư thế ngồi viết   Đầu hơi cúi, không tì ngực xuống bàn   Mắt cách vở khoảng 20-25cm   Tay phải cầm bút, tay trái tì nhẹ lên mép vở để giữ.   Lư...",9840,Cty TNHH TM&DV VH GD Phía Nam,,,,,Nhà Xuất Bản Đồng Nai,,,,,,,
360,"Combo Vở Tập Viết Có Mẫu Chữ Quyển 1,2 Và Bé Làm Quen Với Chữ Số Và Phép Tính Và Bé Tập Tô Chữ Cái (Diệu Linh) (Tặng Kèm 1 Tờ 36 Hình Dán Ngôi Sao)",https://salt.tikicdn.com/cache/280x280/ts/product/84/f3/3c/542593374a174ca1b207ab937306af04.jpg,Tô màu – luyện chữ,Trần Diệu Linh,"Trước khi vào lớp 1, các bé mẫu giáo cần được trang bị kiến thức cơ bản về chữ viết giúp các em có được sự tự tin khi tiếp xúc với môi trường học tập ở trường tiểu học.Vở tập viết có mẫu chữ (Quyển 1...",65000,Liên kết với tác giả,2018-03-03 11:43:57,<p>17x24</p>,Bìa mềm,44,,,,,,,,
361,Dán Hình Ô Tô Thú Vị - Những Tay Đua Cực Oách,https://salt.tikicdn.com/cache/280x280/ts/product/f3/4e/0c/2975381291ce5b34a030149a26e8ae9c.jpg,Tô màu – luyện chữ,Đổng Nhã,"Trong đời sống và trên ti vi, hẳn là các bé đã từng nhìn thấy rất nhiều loại xe ô tô, từ xe cứu hỏa, xe cảnh sát, xe công trình tới những chiếc xe đua cực oách. Thế nhưng, để gọi được tên của từng chi...",39700,Đinh Tị,2020-02-02 00:00:00,<p>21 x 28.4 cm</p>,Bìa mềm,,Nhà Xuất Bản Thanh Niên,,,,,,,
362,"Combo Vở Tập Viết Có Mẫu Chữ Quyển 1, 2 ,3 và Bé Tập Tô Chữ Cái (Diệu Linh) (tặng kèm 1 tờ 36 hình dán ngôi sao)",https://salt.tikicdn.com/cache/280x280/ts/product/e6/61/13/7bd0449e10b3f4ed2d438de4e3caa020.jpg,Tô màu – luyện chữ,Trần Diệu Linh,"Trước khi vào lớp 1, các bé mẫu giáo cần được trang bị kiến thức cơ bản về chữ viết giúp các em có được sự tự tin khi tiếp xúc với môi trường học tập ở trường tiểu học.Vở tập viết có mẫu chữ (Quyển 1...",65000,Liên kết với tác giả,2018-03-03 11:47:40,<p>17x24cm</p>,Bìa mềm,44,,,,,,,,
363,Sách Bé Tập Tô Màu Công Viên Khủng Long,https://salt.tikicdn.com/cache/280x280/ts/product/84/4b/c3/e955999e8ee7616079409612639a7647.jpg,Tô màu – luyện chữ,Sao Bùi,Bé Tập Tô Màu Công viên khủng longThế giới khủng long cổ đại luôn là chủ đề thu hút các bé. Những bạn khủng long trong cuốn sách tô màu này vô cùng ngộ nghĩnh đáng yêu. Bé sẽ biết thêm tên của những ...,16000,Công ty TNHH An Phước Books Việt Nam,,,Bìa mềm,16,Nhà Xuất Bản Phụ Nữ Việt Nam,,,,,,,
364,Chuẩn Bị Cho Bé Vào Lớp 1 - Tập Viết Chữ Hoa - Theo Mẫu Chữ Viết Cải Cách Lớp 1 (Dành Cho Bé 4-5 Tuổi),https://salt.tikicdn.com/cache/280x280/ts/product/95/e5/35/3856ea13f0c31088c89f62e69b7e0aa3.jpg,Tô màu – luyện chữ,Trần Ngọc Bảo Hân,Chuẩn Bị Cho Bé Vào Lớp 1 - Tập Viết Chữ Hoa - Theo Mẫu Chữ Viết Cải Cách Lớp 1 (Dành Cho Bé 4-5 Tuổi)...,9840,Cty Văn Hóa Nhân Văn,,,,,Nhà Xuất Bản Đại Học Sư Phạm,,,,,,,
365,Combo Dán Hình Trang Phục Công Chúa Tuyệt Đỉnh (10 cuốn),https://salt.tikicdn.com/cache/280x280/ts/product/62/17/f0/c7fb5ce2a22dec35de9f4613ca4f8b8f.jpg,Tô màu – luyện chữ,Ưu Ưu Thử,"3-9 tuổi là giai đoạn bộ não của trẻ phát triển nhanh nhất để có thể nhận thức được màu sắc, hình khối, đồ vật, phát triển mạnh mẽ về cả ngôn ngữ, tư duy logic và khả năng sáng tạ Cũng bởi thế mà trẻ ...",240000,Đinh Tị,2021-07-14 06:03:56,,Bìa mềm,160,Nhà Xuất Bản Thanh Niên,,,,,,,
366,Tô Màu Bóc Dán - Trang Phục - Getting Dressed,https://salt.tikicdn.com/cache/280x280/ts/product/10/f0/68/feaf721b58733c8dd7d8e301b3a581d4.jpg,Tô màu – luyện chữ,Benedetta Giaufret,"Trong vườn những chú chim đang khoe sắc, những bạn bướm đang tung cánh bay. Nhưng có vẻ khu vườn của chúng ta còn thiếu chút sắc màu tươi sáng. Chúng mình cùng thử tài với thật nhiều màu sắc và trang ...",13900,Đinh Tị,2018-10-01 00:00:00,19 x 24 cm,Bìa mềm,16,,Jean - Pierre D.L.B,,,,,,
367,Sách - Gi gỉ gì gi cái gì cũng biết - Dành cho lớp 3 (tặng kèm bookmark thiết kế),https://salt.tikicdn.com/cache/280x280/ts/product/af/55/3c/8625369c19b1a107618be193d5634029.jpg,Tô màu – luyện chữ,Mima Noyuri,"       Dịch giả: Quang Phú   Nhà xuất bản: Thế Giới   Số trang: 180   Kích thước: 16x20.5 cm   Ngày phát hành: 12-2020   Từ năm lớp 3, các bạn sẽ được làm quen với vật lý nhiều hơn. ...",93000,Nhã Nam,,,,,Nhà Xuất Bản Thế Giới,,,,,,,
368,Vui Làm Toán Để Ngủ Ngon 01 - Bedtime Math 1,https://salt.tikicdn.com/cache/280x280/ts/product/48/f1/98/23999c5342c1e4187ec267b45d3a9079.jpg,Tô màu – luyện chữ," Jim Paillot,Laura Overdeck","Đối với rất nhiều người, kể cả người lớn và trẻ nhỏ, toán là môn học căng thẳng và tẻ nhạt. Các con của chúng ta sợ học toán vì các bé nghĩ mình không thể học giỏi. Nhưng từ nay ""Vui làm toán để ngủ n...",73950,NXB Trẻ,,,,,NXB Trẻ,,,,,,,
