,Tên Sách,Ảnh bìa,Thể loại,Tác giả,Nội dung tóm tắt,Giá bìa,Công ty phát hành,Ngày xuất bản,Kích thước,Loại bìa,Số trang,Nhà xuất bản,Dịch Giả,Phiên bản,Lưu ý,Thương hiệu,Xuất xứ thương hiệu,Xuất xứ,Chất liệu
0,,,,,,,,,,,,,,,,,,,
1,Combo Luyện Viết Chữ Đẹp (4 Cuốn) - (Luyện Viết Chữ Đẹp Tập 1 + Luyện Viết Chữ Đẹp Tập 2 + Luyện Viết Chữ Đẹp Chữ Thường + Luyện Viết Chữ Đẹp Chữ Hoa),https://salt.tikicdn.com/cache/280x280/ts/product/37/2e/60/cbf6ae36fc2b3e26e801deefdcf835e3.jpg,Tô màu – luyện chữ,Thanh Hoài,Bộ sách Luyện viết chữ đẹp hướng dẫn các em viết chữ đẹp.Cha mẹ và các em hãy đón mua!...,54400,Huy Hoàng Bookstore,2020-01-03 00:00:00,17 x 24 cm,Bìa mềm,,Nhà Xuất Bản Mỹ Thuật,,,,,,,
2,Bé Tập Tô Màu (Tập 6) - Dành Cho Trẻ Từ 3 Đến 6 Tuổi,https://salt.tikicdn.com/cache/280x280/media/catalog/product/b/e/be-tap-to-mau-tap-6_1.jpg,Tô màu – luyện chữ,Nhiều Tác Giả,"Bé Tập Tô Màu (Tập 6) - Dành Cho Trẻ Từ 3 Đến 6 Tuổi Khoa học đã chứng minh, trí thông minh của trẻ có thể gia tăng với những bài tập kích thích trí não đúng mức. Tô màu là một trong những phương phá...",23500,Công Ty Cổ Phần Văn Hóa Đông A,2014-01-21 00:00:00,21 x 28.5 cm,Bìa mềm,31,,,,,,,,
3,Bộ vở viết xóa được 5 quyển - Tặng kèm 2 bút viết xóa màu ngẫu nhiên - Wipe clean,https://salt.tikicdn.com/cache/280x280/ts/product/4e/17/da/93171bada04f622328d4e0289e34e0e4.jpg,Tô màu – luyện chữ,Thanh Hương,"Bạn đang có con ở độ tuổi 3-5?Bạn muốn bé vừa học vừa chơi với sách + bút?Nhưng những sách giấy thường chỉ dùng được 1 lần, bé có thể hay nghịch làm ướt, làm bẩn, thậm chí làm rách vở.Bộ Vở viết xó...",95000,Việt Hà,,,,,Nhà Xuất Bản Hà Nội,,,,,,,
4,"Combo Bóc Dán Thông Minh - Luyện Tay Thật Khéo, Luyện Mắt Thật Tinh (6 Cuốn)",https://salt.tikicdn.com/cache/280x280/ts/product/66/26/ce/1f4032f4d614b0b4a2b013fd7dccd3ec.jpg,Tô màu – luyện chữ,Nhiều Tác Giả,"Với những chủ đề quen thuộc như động vật, nông trại, nhà cửa, phương tiện giao thô, bộ sách ""Bóc dán thông minh"" (6 cuốn) là công cụ thú vị mà hữu ích giúp các bạn nhỏ khám phá thế giới xung quanh mìn...",163300,Đinh Tị,2020-02-03 00:00:00,<p>17 x 23 cm</p>,Bìa mềm,,Nhà Xuất Bản Thanh Niên,,,,,,,
5,Bộ Túi Tô Màu Cho Bé Tập Làm Họa Sĩ,https://salt.tikicdn.com/cache/280x280/ts/product/58/e7/c8/fccf47f7e079c4935d3e519ada574480.jpg,Tô màu – luyện chữ,Sao Bùi,"Bộ Túi Tô Màu Cho Bé Tập Làm Họa SĩNằm trong series sách dạy vẽ cho trẻ em .Quan tâm đến việc chỉ dẫn và bồi dưỡng những nét vẽ đầu tiên của trẻ nhỏ là điều hết sức cần thiết, bởi nó giúp thúc đẩy k...",75000,ANPHUOCBOOKS,2020-02-02 00:00:00,17 x 24 cm,Bìa mềm,,Nhà Xuất Bản Phụ Nữ,,,,,,,
6,Phía Sau Các Vĩ Nhân Là Đại Boss,https://salt.tikicdn.com/cache/280x280/ts/product/0e/99/a7/70547af160ac3d81a5f238a11b130bb0.jpg,Tô màu – luyện chữ,Sam Kalda,"Phía Sau Các Vĩ Nhân Là Đại BossCác boss mèo sang chảnh và kiêu kỳ chiếm lĩnh mạng xã hội chắc không còn là điều xa lạ, nhưng cho tới tận cách đây không lâu, việc yêu mèo vẫn bị coi là “lập dị”, là “...",62000,R.E.A.D Books,2019-02-18 17:29:09,<p>14.5 x 21 cm</p>,Bìa mềm,112,Nhà Xuất Bản Thế Giới,,,,,,,
7,COMBO: Bé Tập Viết Nét Cơ Bản + Bé Tập Viết Chữ Cái + Bé Tập Viết Chữ Ghép - Hành trang cho bé chuẩn bị vào lớp 1 ,https://salt.tikicdn.com/cache/280x280/ts/product/be/a2/83/1834e8179db820e461a6c36dc95130ec.jpg,Tô màu – luyện chữ,Nguyễn Thị Thúy Hà,TÊN SÁCH: COMBO: Bé Tập Viết Nét Cơ Bản + Bé Tập Viết Chữ Cái + Bé Tập Viết Chữ Ghép - Hành trang cho bé chuẩn bị vào lớp 1NXB: NXB Đại học Quốc gia Hà NộiĐƠN VỊ PHÁT HÀNH: Trung tâm Kinh doanh Xuất...,45000,Trung Tâm Kinh Doanh Xuất Bản Và Phát Hành Sách,,,Bìa mềm,,Nhà Xuất Bản Đại Học Quốc Gia Hà Nội,,,,,,,
8,Sách - Bé Khởi Đầu Tập Viết - Tâm Thế Và Hành Trang Vào Lớp 1,https://salt.tikicdn.com/cache/280x280/ts/product/c7/9e/bf/d60570dd5d247ff856afb689b4cd8cd4.jpg,Tô màu – luyện chữ,Vân Hương,"Tâm thế & hành trang vào lớp 1- BÉ KHỞI ĐẦU TẬP VIẾT là cuốn sách được biên soạn dựa trên nghiên cứu khởi đầu cho Tập viết chuẩn mực. Bé sẽ được tập tô - tập viết từ các nét cơ bản, chữ cái, chữ g...",64000,Công Ty TNHH Sách và Thiết Bị Giáo Dục ID,2020-04-01 02:07:14,,Bìa mềm,100,Nhà Xuất Bản Đại Học Quốc Gia Hà Nội,,,,,,,
9,Em Thích Tô Màu ABC Và 123 - Tập Đánh Vần Tiếng Anh Bằng Tranh (Có Chú Thích Tiếng Việt),https://salt.tikicdn.com/cache/280x280/ts/product/7f/12/bb/75ca3d0bd7f35536a231df26b6e10ce1.jpg,Tô màu – luyện chữ,Award,Tô màu không chỉ giúp bé giải trí mà còn là cách để giúp bé phát triển toàn diện. Tại sao chúng ta không thử kết hợp hoạt động tô màu với các con chữ nhỉ? Khi bé đã biết phân biệt màu sắc và nhận định...,30300,NXB Trẻ,2021-04-01 00:00:00,20 x 28 cm,Bìa mềm,36,NXB Trẻ,,,,,,,
10,"Giúp Bé Vững Bước Vào Lớp 1 - Tập Viết, Tô Chữ Và Số",https://salt.tikicdn.com/cache/280x280/ts/product/ec/a5/f4/c3a2e7b8cedfe8f615f1b52ad5bdc432.png,Tô màu – luyện chữ,"Vân Hương,Hải Yến"," GIỚI THIỆUTập Viết Chữ Và Số - Giúp Bé Tự Tin Vào Lớp 1Tập Tô Chữ Và Số - Giúp Bé Tự Tin Vào Lớp 1Mỗi mẫu chữ đều có hướng dẫn từng nét cụ thể giúp bé dễ dàng tập viết. Ngoài ra, tập sách còn có ...",16000,Công Ty TNHH Sách và Thiết Bị Giáo Dục ID,2020-04-01 11:41:46,,Bìa mềm,104,Nhà Xuất Bản Thanh Niên,,Con Mèo,,,,,
11,Combo Luyện Viết Chữ Nhớ Từ Vựng Tiếng Anh Theo Chương Trình Sách Giáo Khoa Lớp 3 – Tập 1 & 2,https://salt.tikicdn.com/cache/280x280/ts/product/52/d1/37/0f033f5e4e0e351a4d32d2e9bb0f0876.jpg,Tô màu – luyện chữ,Runkids,"Luyện viết chữ nhớ từ vựng tiếng Anh theo chương trình Sách giáo khoa là bộ tập viết được biên soạn cho các bé học sinh từ lớp 3 – lớp 5, hỗ trợ các bé học hiệu quả, ghi nhớ nhanh từ vựng theo chương ...",66000,Megabook,2020-07-01 14:23:17,19 x 26 cm,Bìa mềm,,Nhà Xuất Bản Thanh Niên,,,,,,,
12,Bộ Sưu Tập 200 sticker - Bé Làm Quen Với Môn Toán,https://salt.tikicdn.com/cache/280x280/ts/product/6a/13/d3/2de1b5c098ddef63d26211db3123d433.jpg,Tô màu – luyện chữ,Phan Minh Đạo,"Sau thành công từ các bộ sách trước, bộ sách ""200 STICKER"" là bộ sách tiếp theo thuộc TỦ SÁCH RÈN LUYỆN KỸ NĂNG CHO TRẺ TRƯỚC TUỔI ĐẾN TRƯỜNG"". Bộ sách được thiết kế đẹp mắt, sinh động. Các hình ảnh, ...",44200,Nhà sách Minh Thắng,2019-12-01 00:00:00,26x26cm,Bìa mềm,26,,,,,,,,
13,"Sách - Bé Vui Học Toán - Làm Quen Số Đếm Từ 1 đến 10, Làm Quen Với Số Đếm Từ 11 đến 20, Phép Tính Từ 1 đến 10, Làm Quen Với Phép Tính Từ 1 đến 20, Bé Học So Sánh, Xem Giờ, Bé Nhận Biết Hình Dạng Và Toán Thông Minh, BÉ Làm Bài Tập Cuối Tuần - Dành Cho Bé Chuẩn Bị Vào Lớp 1",https://salt.tikicdn.com/cache/280x280/ts/product/42/10/2d/0f9a5fadaefdb64cd7d000346165d3ba.JPG,Tô màu – luyện chữ,Nhâm Nguyễn,"BỘ SÁCH BÉ VUI HỌC TOÁN – 8 cuốnToán học luôn là môn học đòi hỏi sự cẩn thận, tập trung cao. Với những bé chuẩn bị bước vào lớp 1, làm quen với toán là một bước cần thiết và quan trọng để bé không c...",99000,Công ty TNHH An Phước Books Việt Nam,,,Bìa mềm,15,Nhà Xuất Bản Phụ Nữ Việt Nam,,,,,,,
14,Nối Chấm - Tô Màu - Tập Đếm 04,https://salt.tikicdn.com/cache/280x280/ts/product/c8/cb/d0/f46fd0c8d34f6ab03ca4c048959b7864.jpg,Tô màu – luyện chữ,Award,Tô màu không chỉ giúp bé giải trí mà còn là cách để giúp bé phát triển toàn diện. Tại sao chúng ta không thử kết hợp hoạt động tô màu với các con số nhỉ? Khi bé đã biết phân biệt màu sắc và nhận định ...,14000,NXB Trẻ,2021-04-01 00:00:00,20 x 28 cm,Bìa mềm,20,NXB Trẻ,,,,,,,
15,Sách - TẬP TÔ VIẾT NÉT CƠ BẢN (Giúp bé tự tin vào lớp 1),https://salt.tikicdn.com/cache/280x280/ts/product/37/2e/ef/7bb1302353c3b45727f8daac9b0644dc.jpg,Tô màu – luyện chữ,Vân Hương,"Từ mẫu giáo lên Tiểu học là bước tiến quan trọng, trẻ cần được trang bị một nền móng vững chắc ngay từ giai đoạn tiền tiểu học. Cha mẹ nên: - Rèn cho con kỹ năng tự phục vụ để thích nghi với môi trườn...",16200,Công Ty TNHH Sách và Thiết Bị Giáo Dục ID,2021-04-02 15:48:50,,Bìa mềm,32,Nhà Xuất Bản Đại Học Quốc Gia Hà Nội,,,,,,,
16,Combo 2 Cuốn Luyện Viết Chữ Nhớ Từ Vựng – English Writing My Phonics,https://salt.tikicdn.com/cache/280x280/ts/product/2d/e9/b1/a04036fe692dc53c2d4905a269ee167b.jpg,Tô màu – luyện chữ,Little Rainbow,"Luyện viết chữ nhớ từ vựng – English Writing My Phonics là bộ sách dành cho các bé học sinh lớp 1 và lớp 2, giúp các con luyện viết chữ cơ bản trong những năm học chính thức đầu tiên.Ưu điểm của bộ L...",55000,Megabook,2020-05-01 14:25:42,20 x 28 cm,Bìa mềm,,Nhà Xuất Bản Thanh Niên,,,,,,,
17,Combo Bé Tập Tô Màu (8 Tập) - Tái Bản,https://salt.tikicdn.com/cache/280x280/ts/product/df/dd/2a/5df47c462a49c4f72ed53668fd4d5168.jpg,Tô màu – luyện chữ,Hải Nam,"Tập tô màu là hoạt động ưa thích của các bé. Hoạt động này không những giúp rèn luyện đôi tay khéo léo, đức tính kiên trì mà còn có thể bồi dưỡng cho bé khả năng nhận biết màu sắc, phát triển óc sáng ...",64000,Minh Long,2019-07-01 00:00:00,,Bìa mềm,,,,,,,,,
18,Bé Khởi Đầu Tập Viết - Tâm Thế & Hành Trang Vào Lớp 1,https://salt.tikicdn.com/cache/280x280/ts/product/ce/f1/83/b16d76608e9a6b4344c4953e3865be4e.jpg,Tô màu – luyện chữ,Vân Hương (Biên Soạn),"Tâm thế & hành trang vào lớp 1- BÉ KHỞI ĐẦU TẬP VIẾT là cuốn sách được biên soạn dựa trên nghiên cứu khởi đầu cho Tập viết chuẩn mực. Bé sẽ được tập tô - tập viết từ các nét cơ bản, chữ cái, chữ g...",57000,Công Ty TNHH Sách và Thiết Bị Giáo Dục ID,2020-06-11 11:32:23,,Bìa mềm,100,Nhà Xuất Bản Đại Học Quốc Gia Hà Nội,,,,,,,
19,Dán Hình Thông Minh (Dành Cho Các Bé Từ 3 Đến 6 Tuổi) - Tập 1,https://salt.tikicdn.com/cache/280x280/media/catalog/product/d/a/dan-hinh-thong-minh-tap-1_2.jpg,Tô màu – luyện chữ,Nhóm tác giả,"Dán Hình Thông Minh (Dành Cho Các Bé Từ 3 Đến 6 Tuổi) - Tập 1 Chơi cùng hình dán Phát triển kĩ năng Tưởng tượng phán đoán Ghi nhớ, học hình... Với bộ sách dán hình thông minh, các em sẽ được chơi...",46700,Công Ty Cổ Phần Văn Hóa Đông A,2014-08-15 00:00:00,21 x 29.5 cm,Bìa mềm,24,,,,,,,,
20,VỞ LUYỆN VIẾT MẪU CHỮ NHỎ MỘT Ô LY,https://salt.tikicdn.com/cache/280x280/ts/product/eb/8b/f8/72dc5b956d9d5550875829e4c97907bc.jpg,Tô màu – luyện chữ,Vân Hương,"Cuốn vở tập viết dành cho học sinh Tiểu học đặc biệt là các là Học sinh lớp Một, lớp Hai, đang tập viết hạ cỡ chữ và bắt đầu dùng bút mực. Sách dày 48 trang, khổ 17x24 cm, giấy dày đẹp, chống lóa, khô...",18000,Công Ty TNHH Sách và Thiết Bị Giáo Dục ID,2020-12-17 15:42:43,,Bìa mềm,48,Nhà Xuất Bản Đại Học Quốc Gia Hà Nội,,,,,,,
21,Tranh Tô Màu Tập Thể - Lễ Hội Rộn Ràng,https://salt.tikicdn.com/cache/280x280/media/catalog/product/r/o/ronranglehoi_review.jpg,Tô màu – luyện chữ,Tạ Lan Hạnh,"Tranh Tô Màu Tập Thể - Lễ Hội Rộn Ràng Bộ đôi ""siêu phẩm"" tranh tô màu khổ đại (A0) cực kì đẹp mắt với hai chủ đề Rộn ràng lễ hội và Công viên giải trí là món quà dành tặng độc giả. Trò chơi tô màu m...",15900,Nhà Xuất Bản Kim Đồng,2015-10-29 00:00:00,71 x 104 cm,Bìa mềm,,,,,,,,,
22,Arty Mouse - Tô Màu (Học Tập Đầu Đời Thông Qua Mỹ Thuật),https://salt.tikicdn.com/cache/280x280/ts/product/42/87/9e/cc3f6bb39c63897bb850b655732b3431.jpg,Tô màu – luyện chữ,Mandy Stanley,"Việc vui chơi một cách sáng tạo là một phần quan trọng trong sự phát triển của con bạn. Do đó, hãy mang đến cho trẻ một sự khởi đầu thuận lợi với sự giúp đỡ của chuột Arty và những người bạn đầy màu s...",34600,Zenbooks,2020-12-01 00:00:00,21.6 x 28 cm,Bìa mềm,48,Nhà Xuất Bản Đà Nẵng,Nguyên Chính,,,,,,
23,Sách: Combo Chuẩn Bị Cho Bé Vào Lớp Một (Túi 10 Cuốn Tặng 1 Cây Viết Chì),https://salt.tikicdn.com/cache/280x280/ts/product/31/ec/35/3f7b728a4091f31fb3740eaa4f4467ae.jpg,Tô màu – luyện chữ,Lê Tuệ Minh - Lê Thu Ngọc,"Sách: Combo Chuẩn Bị Cho Bé Vào Lớp Một (Túi 10 Cuốn Tặng 1 Cây Viết Chì)Từ mẫu giáo lên tiểu học là bước tiến quan trọng để bé bước chân vào thế giới tri thức, cũng là một bước ngoặt lớn trong cuộc ...",82000,Minh Long,2017-06-01 20:57:29,,Bìa mềm,320,Nhà Xuất Bản Đại Học Sư Phạm,,Phiên bản thông thường,,,,,
24,Arty Mouse - Cắt Giấy (Học Tập Đầu Đời Thông Qua Mỹ Thuật),https://salt.tikicdn.com/cache/280x280/ts/product/eb/5f/d8/4a3fd9aae09468d6f9d9e90dd7309b04.jpg,Tô màu – luyện chữ,Mandy Stanley,"Việc vui chơi một cách sáng tạo là một phần quan trọng trong sự phát triển của con bạn. Do đó, hãy mang đến cho trẻ một sự khởi đầu thuận lợi với sự giúp đỡ của chuột Arty và những người bạn đầy màu s...",34700,Zenbooks,,21.6 x 28 cm,Bìa mềm,48,Nhà Xuất Bản Đà Nẵng,Nguyên Chính,,,,,,
25,200 Miếng Bóc Dán TM PT Chỉ Số Tình Cảm EQ T1 - Dành Cho Trẻ 2-10 Tuổi (Tái Bản 2018),https://salt.tikicdn.com/cache/280x280/ts/product/1d/a6/1e/35ce691c881d88a82987f1c2f640a79d.jpg,Tô màu – luyện chữ,"Cung Huân,Ngọc Linh","  200 Miếng Bóc Dán TM PT Chỉ Số Tình Cảm EQ T1 - Dành Cho Trẻ 2-10 Tuổi (Tái Bản 2018)  Đây là cuốn sách được tuyển chọn và những trò chơi dán hình, giúp cho đôi tay của các em thêm linh hoạt, ...",47100,Đinh Tị,,21 x 28.5 cm,Bìa mềm,,,,,,,,,
26,Sách - Vở bé Tập viết - Hành trang cho bé vào lớp một -  Combo 2 Quyển,https://salt.tikicdn.com/cache/280x280/ts/product/c4/a4/47/110a472521107235674aa4bef5b6a2f6.jpg,Tô màu – luyện chữ,Hải Yến,"GIỚI THIỆU SÁCHHành Trang Cho Bé Vào Lớp 1 là bộ sách giúp trẻ chuẩn bị những kiến thức, kỹ năng cơ bản trước khi bước vào lớp 1: tập viết, làm quen với toán. Hình vẽ minh họa sinh động, ngộ nghĩnh c...",21000,Công Ty TNHH Sách và Thiết Bị Giáo Dục ID,2020-03-01 01:47:34,,Bìa mềm,96,Nhà Xuất Bản Mỹ Thuật,,,,,,,
27,"Combo 06 Quyển Hành Trang Cho Bé Chuẩn Bị Vào Lớp 1 (Tập Tô, Viết, Học Toán)",https://salt.tikicdn.com/cache/280x280/ts/product/33/23/2d/8e45b532c3e562da528067c756a0238b.jpg,Tô màu – luyện chữ,Hải Thanh,"Bé học toán cho bé chuẩn bị vào lớp 1( độ tuổi 4-6 tuổi) Giúp bé tăng khả năng nhận thức câc con số, tính toán, nhận dạng hình họ️ Phương pháp học mà chơi chơi mà học️ Giúp bé nhận thức sớm về toán ...",13000,Công Ty TNHH Sách và Thiết Bị Giáo Dục ID,2020-04-01 22:28:55,,Bìa mềm,240,Nhà Xuất Bản Thanh Niên,,UNION,,,,,
28,Sách - Giúp Bé Vững Bước Vào Lớp 1 - Tập Viết Chữ Hoa (Chuẩn Nhà Xuất Bản),https://salt.tikicdn.com/cache/280x280/ts/product/65/a1/9a/fc2725df0764be7203bc176f64ab3607.jpg,Tô màu – luyện chữ,"Hải Yến,Vân Hương",GIỚI THIỆU SÁCHTập viết chữ hoa - Giúp Bé Tự Tin Vào Lớp 1 Được biên soạn theo chương trình giáo dục mầm non mới giới thiệu những kiến thức cơ bản về chữ số giúp các em học sinh mẫu giáo tự tin thích...,15000,Công Ty TNHH Sách và Thiết Bị Giáo Dục ID,2020-04-01 23:40:05,,Bìa mềm,51,Nhà Xuất Bản Đại Học Quốc Gia Hà Nội,,Phiên Bản Con Voi,,,,,
29,Bộ Sưu Tập 200 Sticker - Vương Quốc Khủng Long,https://salt.tikicdn.com/cache/280x280/ts/product/8c/1c/91/2cce20e75df679ca8ca9ecd96a5b4268.jpg,Tô màu – luyện chữ,Phan Minh Đạo,"Sau thành công từ các bộ sách trước, bộ sách ""200 STICKER"" là bộ sách tiếp theo thuộc TỦ SÁCH RÈN LUYỆN KỸ NĂNG CHO TRẺ TRƯỚC TUỔI ĐẾN TRƯỜNG"". Bộ sách được thiết kế đẹp mắt, sinh động. Các hình ảnh, ...",44200,Nhà sách Minh Thắng,2019-12-01 00:00:00,26x26cm,Bìa mềm,26,,,,,,,,
30,Arty Mouse - Vẽ Theo Mẫu (Học Tập Đầu Đời Thông Qua Mỹ Thuật),https://salt.tikicdn.com/cache/280x280/ts/product/41/01/4d/7e74e8579cd7172ee11d28ea1d55c5f3.jpg,Tô màu – luyện chữ,Mandy Stanley,"Việc vui chơi một cách sáng tạo là một phần quan trọng trong sự phát triển của con bạn. Do đó, hãy mang đến cho trẻ một sự khởi đầu thuận lợi với sự giúp đỡ của chuột Arty và những người bạn đầy màu s...",35000,Zenbooks,2020-12-01 00:00:00,21.6 x 28 cm,Bìa mềm,48,Nhà Xuất Bản Đà Nẵng,Nguyên Chính,,,,,,
31,Luyện Viết Chữ Lớp 2 - Tập 1 (Theo Chương Trình Giáo Dục Phổ Thông Mới),https://salt.tikicdn.com/cache/280x280/ts/product/12/be/21/f154f7eaadf5adaddac7c6c3ada897af.jpg,Tô màu – luyện chữ,Lê Phương Nga,Luyện Viết Chữ Lớp 2 - Tập 1 (Theo Chương Trình Giáo Dục Phổ Thông Mới)Xin trân trọng giới thiệu đến quí phụ huynh cùng các em học sinh lớp 2 các tập sách rất hữu ích sau đây để các em luyện viết đún...,28000,Nhà Sách Hồng Ân,,,Bìa mềm,,Nhà Xuất Bản Đại Học Quốc Gia Hà Nội,,,,,,,
32,Combo Luyện Viết Chữ Nhớ Từ Vựng Tiếng Anh Theo Chương Trình Sách Giáo Khoa Lớp 5 – Tập 1 & 2,https://salt.tikicdn.com/cache/280x280/ts/product/21/4c/99/20f75bedbe9ebc2f8f282f219382c82a.jpg,Tô màu – luyện chữ,Runkids,"Luyện viết chữ nhớ từ vựng tiếng Anh theo chương trình Sách giáo khoa là bộ tập viết được biên soạn cho các bé học sinh từ lớp 3 – lớp 5, hỗ trợ các bé học hiệu quả, ghi nhớ nhanh từ vựng theo chương ...",56100,Megabook,2020-07-01 14:51:30,19 x 26 cm,Bìa mềm,,Nhà Xuất Bản Thanh Niên,,,,,,,
33,Nối Chấm - Tô Màu - Tập Đếm 05,https://salt.tikicdn.com/cache/280x280/ts/product/ba/78/06/839ec6a8e6ad7cf43db7c2347a2087ad.jpg,Tô màu – luyện chữ,Award,Tô màu không chỉ giúp bé giải trí mà còn là cách để giúp bé phát triển toàn diện. Tại sao chúng ta không thử kết hợp hoạt động tô màu với các con số nhỉ? Khi bé đã biết phân biệt màu sắc và nhận định ...,14450,NXB Trẻ,,,,,NXB Trẻ,,,,,,,
34,Tủ Sách Bách Khoa Tri Thức Phổ Thông: Những Câu Chuyện Kỳ Thú về Động Vật (Tái Bản),https://salt.tikicdn.com/cache/280x280/media/catalog/product/n/h/nhung-cau-chuyen-ky-thu-ve-dong-vat.jpg,Tô màu – luyện chữ,Hoàng Lê Minh,Tủ Sách Bách Khoa Tri Thức Phổ Thông: Những Câu Chuyện Kỳ Thú về Động Vật (Tái Bản) Loài động vật nào có lưỡi dài bằng cơ thể nó? Cá voi thở như thế nào? Tại sao ngựa vằn lại có sọc? Những câu hỏi nà...,43200,Đinh Tị,2011-08-20 00:00:00,13 x 20.5 cm,Bìa mềm,304,,,,,,,,
35,Arty Mouse - Đồ Theo Nét (Học Tập Đầu Đời Thông Qua Mỹ Thuật),https://salt.tikicdn.com/cache/280x280/ts/product/67/ca/a5/98d75851e5dc4e35fb3b1ac5ba7f5618.jpg,Tô màu – luyện chữ,Mandy Stanley,"Việc vui chơi một cách sáng tạo là một phần quan trọng trong sự phát triển của con bạn. Do đó, hãy mang đến cho trẻ một sự khởi đầu thuận lợi với sự giúp đỡ của chuột Arty và những người bạn đầy màu s...",34900,Zenbooks,2020-12-01 00:00:00,21.6 x 28 cm,Bìa mềm,48,Nhà Xuất Bản Đà Nẵng,Nguyên Chính,,,,,,
36,Combo 3 Cuốn Cùng Khủng Long Học Nét Cơ Bản - Bé Trai,https://salt.tikicdn.com/cache/280x280/ts/product/68/2c/3e/66d90e87d02befde9884249cede75cef.jpg,Tô màu – luyện chữ,Runkids,"Cùng khủng long học các nét cơ bản là bộ sách dành cho trẻ từ 4- 6 tuổi, giúp các con luyện các nét cơ bản của số và chữ, để con tự tin vào lớp 1Bộ sách gồm 3 cuốn: Cùng khủng long học nét cơ bản –...",57000,Megabook,2019-05-01 00:00:00,19 x 27 cm,Bìa mềm,76,Nhà Xuất Bản Thanh Niên,,,,,,,
37,Toán Nâng Cao Và Bồi Dưỡng Học Sinh Giỏi Lớp 5 (Tái Bản),https://salt.tikicdn.com/cache/280x280/ts/product/d4/04/3a/ebee48087985971b0f18e74e7ebd4294.jpg,Tô màu – luyện chữ,"Nguyễn Bảo Minh,Lê Yến Ngọc","Nội dung cuốn sách được biên soạn theo chương trình giảm tải của Bộ GD & ĐT, bám sát chương trình. Cuốn sách hội tụ đầy đủ hệ thống bài tập nâng cao môn Toán. Các bậc phụ huynh và giáo viên có thể tha...",39000,Minh Long,2019-10-01 00:00:00,14.5 x 20.5 cm,Bìa mềm,,Nhà Xuất Bản Đại Học Sư Phạm,,,,,,,
38,Bộ Sách Khởi Đầu Cho Bé Vào Lớp 1 - Dành Cho Bé Từ 4-6 Tuổi - Biên Soạn Theo Chương Trình Giáo Dục Mầm Non Mới (Bộ 9 Cuốn),https://salt.tikicdn.com/cache/280x280/ts/product/ab/92/6b/baaebbc6c31ae5edf2a2320ef58a45e6.jpg,Tô màu – luyện chữ,Ngọc Nguyên,"Bộ sách tập tô tập viết, dành cho các bé chuẩn bị bước vào lớp 1, với các kĩ năng cơ bản về tập tô nét, học đọc và học viết....",105000,Tân Việt,,,,,Nhà Xuất Bản Mỹ Thuật,,,,,,,
39,Sticker Dolly Dressing - Dán Hình Sáng Tạo Trang Phục Búp Bê - Tiên Nữ,https://salt.tikicdn.com/cache/280x280/ts/product/ae/21/66/12adf37abc94d8f07751bb923336d97e.jpg,Tô màu – luyện chữ,Fiona Watt,Bộ sách Dán hình sáng tạo trang phục búp bê giúp bé thỏa sức sáng tạo ra các tác phẩm tuyệt đẹp.  Các nàng búp bê qua đôi tay khéo léo cùng trí tưởng tượng phong phú của các bạn nhỏ sẽ dần được khoá...,47300,Đinh Tị,2021-01-01 00:00:00,17 x 24 cm,Bìa mềm,34,Nhà Xuất Bản Thanh Niên,"Tranh: Lizzie Mackay, Thiết kế: Antonia Miller-Biên dịch: Minh Trang",,,,,,
